Hovis, Jonathan RP NYY	Free Agent	0.0	0	0	0	0	0	0	0	0	0	0	N/A	N/A	1982
Geary, Geoff RP LA	Free Agent	0.0	0	0	0	0	0	0	0	0	0	0	N/A	N/A	1984
Hunton, Jon P OAK	Free Agent	0.0	0	0	0	0	0	0	0	0	0	0	N/A	N/A	1985
Cave, Kevin RP FLA	Free Agent	0.0	0	0	0	0	0	0	0	0	0	0	N/A	N/A	1992
Britton, Chris RP SD	Free Agent	0.0	0	0	0	0	0	0	0	0	0	0	N/A	N/A	1994
Morlan, Eduardo RP TB	Free Agent	0.0	0	0	0	0	0	0	0	0	0	0	N/A	N/A	1995
Zumwalt, Alec RP MIL	Free Agent	0.0	0	0	0	0	0	0	0	0	0	0	N/A	N/A	2000
Wilson, Kris RP PHI	Free Agent	0.0	0	0	0	0	0	0	0	0	0	0	N/A	N/A	2009
Manon, Julio RP OAK	Free Agent	0.0	0	0	0	0	0	0	0	0	0	0	N/A	N/A	2018
McConnell, Sam RP ATL	Free Agent	0.0	0	0	0	0	0	0	0	0	0	0	N/A	N/A	2019
Saenz, Chris RP MIL	Free Agent	0.0	0	0	0	0	0	0	0	0	0	0	N/A	N/A	2023
Bush, Matt RP TB	Free Agent	0.0	0	0	0	0	0	0	0	0	0	0	N/A	N/A	2026
Currin, Patrick RP OAK	Free Agent	0.0	0	0	0	0	0	0	0	0	0	0	N/A	N/A	2034
Whisler, Wesley RP CHW	Free Agent	0.0	0	0	0	0	0	0	0	0	0	0	N/A	N/A	2035
Voyles, Brad RP MIN	Free Agent	0.0	0	0	0	0	0	0	0	0	0	0	N/A	N/A	2041
Avery, Matthew RP WAS	Free Agent	0.0	0	0	0	0	0	0	0	0	0	0	N/A	N/A	2043
Pichardo, Kelvin RP SF	Free Agent	0.0	0	0	0	0	0	0	0	0	0	0	N/A	N/A	2044
Curtis, Dan RP ATL	Free Agent	0.0	0	0	0	0	0	0	0	0	0	0	N/A	N/A	2045
Edlefsen, Steve RP SF	Free Agent	0.0	0	0	0	0	0	0	0	0	0	0	N/A	N/A	2046
Jimenez, Cesar RP SEA	Free Agent	0.0	0	0	0	0	0	0	0	0	0	0	N/A	N/A	2053
Howard, Adam RP ARI	Free Agent	0.0	0	0	0	0	0	0	0	0	0	0	N/A	N/A	2055
Hensley, Matt RP TOR	Free Agent	0.0	0	0	0	0	0	0	0	0	0	0	N/A	N/A	2059
Hurd, John RP CHW	Free Agent	0.0	0	0	0	0	0	0	0	0	0	0	N/A	N/A	2062
Dingman, Craig RP DET	Free Agent	0.0	0	0	0	0	0	0	0	0	0	0	N/A	N/A	2065
Ormond, Rodney RP TOR	Free Agent	0.0	0	0	0	0	0	0	0	0	0	0	N/A	N/A	2074
Takahashi, Ken RP NYM	Free Agent	0.0	0	0	0	0	0	0	0	0	0	0	N/A	N/A	2075
Abreu, Juan RP ATL	Free Agent	0.0	0	0	0	0	0	0	0	0	0	0	N/A	N/A	2077
Robbins, Jake RP CIN	Free Agent	0.0	0	0	0	0	0	0	0	0	0	0	N/A	N/A	2080
Gunderson, Kevin RP ATL	Free Agent	0.0	0	0	0	0	0	0	0	0	0	0	N/A	N/A	2086
De La Cruz, Julio RP KC	Free Agent	0.0	0	0	0	0	0	0	0	0	0	0	N/A	N/A	2087
Smith, Matt J. RP CHC	Free Agent	0.0	0	0	0	0	0	0	0	0	0	0	N/A	N/A	2088
O'Connor, Mike RP SD 	Free Agent	0.0	0	0	0	0	0	0	0	0	0	0	N/A	N/A	2089
Gonzalez, Luis E. RP SEA	Free Agent	0.0	0	0	0	0	0	0	0	0	0	0	N/A	N/A	2090
Speier, Justin RP COL	Free Agent	0.0	0	0	0	0	0	0	0	0	0	0	N/A	N/A	2091
Green, Matthew RP ARI	Free Agent	0.0	0	0	0	0	0	0	0	0	0	0	N/A	N/A	2095
Magnuson, Trystan RP OAK 	Free Agent	0.0	0	0	0	0	0	0	0	0	0	0	N/A	N/A	2096
Valenzuela, Sergio RP CIN	Free Agent	0.0	0	0	0	0	0	0	0	0	0	0	N/A	N/A	2100
DePaula, Julio RP TB	Free Agent	0.0	0	0	0	0	0	0	0	0	0	0	N/A	N/A	2107
Downs, Brodie RP SEA	Free Agent	0.0	0	0	0	0	0	0	0	0	0	0	N/A	N/A	2112
Klatt, Ryan RP SD	Free Agent	0.0	0	0	0	0	0	0	0	0	0	0	N/A	N/A	2121
Sanchez, Duaner RP SD	Free Agent	0.0	0	0	0	0	0	0	0	0	0	0	N/A	N/A	2127
Guevara, Carlos RP SD	Free Agent	0.0	0	0	0	0	0	0	0	0	0	0	N/A	N/A	2129
Miller, Ryne RP BOS	Free Agent	0.0	0	0	0	0	0	0	0	0	0	0	N/A	N/A	2132
Martin, Adrian RP SF	Free Agent	0.0	0	0	0	0	0	0	0	0	0	0	N/A	N/A	2137
Warden, Jim Ed RP WAS	Free Agent	0.0	0	0	0	0	0	0	0	0	0	0	N/A	N/A	2138
Wild, Jacob RP SEA	Free Agent	0.0	0	0	0	0	0	0	0	0	0	0	N/A	N/A	2139
Brunet, Michael RP SD	Free Agent	0.0	0	0	0	0	0	0	0	0	0	0	N/A	N/A	2142
Jan, Carlos RP BAL	Free Agent	0.0	0	0	0	0	0	0	0	0	0	0	N/A	N/A	2143
Ovalles, Juan RP CHW	Free Agent	0.0	0	0	0	0	0	0	0	0	0	0	N/A	N/A	2153
Mateo, Julio RP SF	Free Agent	0.0	0	0	0	0	0	0	0	0	0	0	N/A	N/A	2158
Horst, Jeremy P CIN	Free Agent	0.0	0	0	0	0	0	0	0	0	0	0	N/A	N/A	2160
Muessig, Jeff RP OAK	Free Agent	0.0	0	0	0	0	0	0	0	0	0	0	N/A	N/A	2162
Isringhausen, Jason RP CIN	Free Agent	0.0	0	0	0	0	0	0	0	0	0	0	N/A	N/A	2169
De La Vara, Gilbert RP CIN	Free Agent	0.0	0	0	0	0	0	0	0	0	0	0	N/A	N/A	2173
White, Bill RP PHI	Free Agent	0.0	0	0	0	0	0	0	0	0	0	0	N/A	N/A	2180
Garcia, Rosman RP TEX	Free Agent	0.0	0	0	0	0	0	0	0	0	0	0	N/A	N/A	2181
Asencio, Miguel RP BOS	Free Agent	0.0	0	0	0	0	0	0	0	0	0	0	N/A	N/A	2182
Delgado, Jesus RP CIN	Free Agent	0.0	0	0	0	0	0	0	0	0	0	0	N/A	N/A	2184
Parrott, Rhett RP STL	Free Agent	0.0	0	0	0	0	0	0	0	0	0	0	N/A	N/A	2187
Spurling, Chris RP MIL	Free Agent	0.0	0	0	0	0	0	0	0	0	0	0	N/A	N/A	2193
Cherry, Rocky RP SD	Free Agent	0.0	0	0	0	0	0	0	0	0	0	0	N/A	N/A	2199
Thomas, Jared RP SEA	Free Agent	0.0	0	0	0	0	0	0	0	0	0	0	N/A	N/A	2206
Akin, Brian RP LA	Free Agent	0.0	0	0	0	0	0	0	0	0	0	0	N/A	N/A	2207
Braun, Ryan Z. RP CHW 	Free Agent	0.0	0	0	0	0	0	0	0	0	0	0	N/A	N/A	2209
Henn, Sean RP TOR 	Free Agent	0.0	0	0	0	0	0	0	0	0	0	0	N/A	N/A	2210
Osoria, Franquelis RP KC	Free Agent	0.0	0	0	0	0	0	0	0	0	0	0	N/A	N/A	2213
Rincon, Ricardo RP NYM	Free Agent	0.0	0	0	0	0	0	0	0	0	0	0	N/A	N/A	2217
McDade, Neal RP PIT	Free Agent	0.0	0	0	0	0	0	0	0	0	0	0	N/A	N/A	2227
Startup, Will RP ATL	Free Agent	0.0	0	0	0	0	0	0	0	0	0	0	N/A	N/A	2228
Juarez, William RP LA	Free Agent	0.0	0	0	0	0	0	0	0	0	0	0	N/A	N/A	2230
Sanchez, Eduardo RP STL	Free Agent	0.0	0	0	0	0	0	0	0	0	0	0	N/A	N/A	2234
Vogelsong, Ryan P PHI	Free Agent	0.0	0	0	0	0	0	0	0	0	0	0	N/A	N/A	2235
Jones, Mike RP MIL	Free Agent	0.0	0	0	0	0	0	0	0	0	0	0	N/A	N/A	2236
Smit, Kyle RP CHC	Free Agent	0.0	0	0	0	0	0	0	0	0	0	0	N/A	N/A	2237
Camacho, Eddie RP NYM	Free Agent	0.0	0	0	0	0	0	0	0	0	0	0	N/A	N/A	2238
Honel, Kris RP STL	Free Agent	0.0	0	0	0	0	0	0	0	0	0	0	N/A	N/A	2241
Machi, Jean RP PIT	Free Agent	0.0	0	0	0	0	0	0	0	0	0	0	N/A	N/A	2246
Shackelford, Brian RP LA	Free Agent	0.0	0	0	0	0	0	0	0	0	0	0	N/A	N/A	2247
Jimenez, Kelvin RP CHW	Free Agent	0.0	0	0	0	0	0	0	0	0	0	0	N/A	N/A	2248
Hughes, Travis RP BOS	Free Agent	0.0	0	0	0	0	0	0	0	0	0	0	N/A	N/A	2252
Hoey, Jim RP MIN 	Free Agent	0.0	0	0	0	0	0	0	0	0	0	0	N/A	N/A	2253
Salas, Juan RP CLE	Free Agent	0.0	0	0	0	0	0	0	0	0	0	0	N/A	N/A	2257
Peterson, Adam RP DET	Free Agent	0.0	0	0	0	0	0	0	0	0	0	0	N/A	N/A	2259
King, Blake RP STL	Free Agent	0.0	0	0	0	0	0	0	0	0	0	0	N/A	N/A	2261
James, Michael RP BOS	Free Agent	0.0	0	0	0	0	0	0	0	0	0	0	N/A	N/A	2266
Michalak, Chris RP WAS	Free Agent	0.0	0	0	0	0	0	0	0	0	0	0	N/A	N/A	2274
Gayhart, Jared RP DET	Free Agent	0.0	0	0	0	0	0	0	0	0	0	0	N/A	N/A	2275
Salmon, Brad RP ANA	Free Agent	0.0	0	0	0	0	0	0	0	0	0	0	N/A	N/A	2279
Goocher, Clint RP ARI	Free Agent	0.0	0	0	0	0	0	0	0	0	0	0	N/A	N/A	2286
Schreiber, Zach RP ATL	Free Agent	0.0	0	0	0	0	0	0	0	0	0	0	N/A	N/A	2288
Gryboski, Kevin RP SF	Free Agent	0.0	0	0	0	0	0	0	0	0	0	0	N/A	N/A	2301
Montero, Agustin RP LA	Free Agent	0.0	0	0	0	0	0	0	0	0	0	0	N/A	N/A	2303
Brazoban, Yhency RP NYM 	Free Agent	0.0	0	0	0	0	0	0	0	0	0	0	N/A	N/A	2306
Graves, Danny RP HOU	Free Agent	0.0	0	0	0	0	0	0	0	0	0	0	N/A	N/A	2311
Dumatrait, Phil RP MIN 	Free Agent	0.0	0	0	0	0	0	0	0	0	0	0	N/A	N/A	2314
Gulin, Lindsay RP MIL	Free Agent	0.0	0	0	0	0	0	0	0	0	0	0	N/A	N/A	2317
Papelbon, Jeremy RP CHC	Free Agent	0.0	0	0	0	0	0	0	0	0	0	0	N/A	N/A	2326
Sadler, Billy RP HOU	Free Agent	0.0	0	0	0	0	0	0	0	0	0	0	N/A	N/A	2332
Collazo, Willie RP TOR	Free Agent	0.0	0	0	0	0	0	0	0	0	0	0	N/A	N/A	2333
Rowe, Steven RP TEX	Free Agent	0.0	0	0	0	0	0	0	0	0	0	0	N/A	N/A	2334
Grilli, Jason RP CLE	Free Agent	0.0	0	0	0	0	0	0	0	0	0	0	N/A	N/A	2340
Ruffin, Chance RP DET	Free Agent	0.0	0	0	0	0	0	0	0	0	0	0	N/A	N/A	2345
Anderson, Jason RP PHI	Free Agent	0.0	0	0	0	0	0	0	0	0	0	0	N/A	N/A	2349
Worrell, Mark RP SEA	Free Agent	0.0	0	0	0	0	0	0	0	0	0	0	N/A	N/A	2354
Starner, Nathan RP TOR	Free Agent	0.0	0	0	0	0	0	0	0	0	0	0	N/A	N/A	2355
Gogal, Jeffrey RP FLA	Free Agent	0.0	0	0	0	0	0	0	0	0	0	0	N/A	N/A	2360
Gronkiewicz, Lee RP BOS	Free Agent	0.0	0	0	0	0	0	0	0	0	0	0	N/A	N/A	2363
Reifer, Adam P STL	Free Agent	0.0	0	0	0	0	0	0	0	0	0	0	N/A	N/A	2365
Hertzler, Barry RP BOS	Free Agent	0.0	0	0	0	0	0	0	0	0	0	0	N/A	N/A	2384
Bynum, Mike RP DET	Free Agent	0.0	0	0	0	0	0	0	0	0	0	0	N/A	N/A	2385
Brooks, Richard RP CHW	Free Agent	0.0	0	0	0	0	0	0	0	0	0	0	N/A	N/A	2389
Bowles, Brian RP SF	Free Agent	0.0	0	0	0	0	0	0	0	0	0	0	N/A	N/A	2391
Regilio, Nick RP TEX	Free Agent	0.0	0	0	0	0	0	0	0	0	0	0	N/A	N/A	2392
Meszaros, Daniel P HOU	Free Agent	0.0	0	0	0	0	0	0	0	0	0	0	N/A	N/A	2397
Childers, Matt RP PHI	Free Agent	0.0	0	0	0	0	0	0	0	0	0	0	N/A	N/A	2398
Forystek, Brian RP BAL	Free Agent	0.0	0	0	0	0	0	0	0	0	0	0	N/A	N/A	2399
Massaro, Michael RP OAK	Free Agent	0.0	0	0	0	0	0	0	0	0	0	0	N/A	N/A	2405
Dohmann, Scott RP LA	Free Agent	0.0	0	0	0	0	0	0	0	0	0	0	N/A	N/A	2408
Gonzalez, Marco RP STL	Free Agent	0.0	0	0	0	0	0	0	0	0	0	0	N/A	N/A	2409
Smith, Dan B. RP ATL	Free Agent	0.0	0	0	0	0	0	0	0	0	0	0	N/A	N/A	2410
Schmoll, Steve RP NYM	Free Agent	0.0	0	0	0	0	0	0	0	0	0	0	N/A	N/A	2420
Lugo, Jose RP MIN	Free Agent	0.0	0	0	0	0	0	0	0	0	0	0	N/A	N/A	2422
Nannini, Mike RP TOR	Free Agent	0.0	0	0	0	0	0	0	0	0	0	0	N/A	N/A	2424
Huisman, Justin RP KC	Free Agent	0.0	0	0	0	0	0	0	0	0	0	0	N/A	N/A	2435
Wolfe, Brian RP TOR	Free Agent	0.0	0	0	0	0	0	0	0	0	0	0	N/A	N/A	2436
Nix, Michael RP ATL	Free Agent	0.0	0	0	0	0	0	0	0	0	0	0	N/A	N/A	2437
Johnson, Jeremy RP DET	Free Agent	0.0	0	0	0	0	0	0	0	0	0	0	N/A	N/A	2439
Searles, Jonathan RP BOS	Free Agent	0.0	0	0	0	0	0	0	0	0	0	0	N/A	N/A	2443
Cali, Carmen RP LA	Free Agent	0.0	0	0	0	0	0	0	0	0	0	0	N/A	N/A	2447
Woody, Abraham RP ARI	Free Agent	0.0	0	0	0	0	0	0	0	0	0	0	N/A	N/A	2448
Garcia, Angel RP OAK	Free Agent	0.0	0	0	0	0	0	0	0	0	0	0	N/A	N/A	2451
Smith, Jesse RP ANA	Free Agent	0.0	0	0	0	0	0	0	0	0	0	0	N/A	N/A	2458
Fish, Robert P NYY 	Free Agent	0.0	0	0	0	0	0	0	0	0	0	0	N/A	N/A	2459
Tobin, Mason RP TEX 	Free Agent	0.0	0	0	0	0	0	0	0	0	0	0	N/A	N/A	2464
Bell, Rob RP WAS	Free Agent	0.0	0	0	0	0	0	0	0	0	0	0	N/A	N/A	2466
Glant, Dustin RP ARI	Free Agent	0.0	0	0	0	0	0	0	0	0	0	0	N/A	N/A	2471
Garcia, Harvey RP LA	Free Agent	0.0	0	0	0	0	0	0	0	0	0	0	N/A	N/A	2474
Chiavacci, Ron RP PHI	Free Agent	0.0	0	0	0	0	0	0	0	0	0	0	N/A	N/A	2477
Yabuta, Yasuhiko RP KC	Free Agent	0.0	0	0	0	0	0	0	0	0	0	0	N/A	N/A	2482
Rust, Evan RP STL	Free Agent	0.0	0	0	0	0	0	0	0	0	0	0	N/A	N/A	2483
Buglovsky, Christopher RP SEA	Free Agent	0.0	0	0	0	0	0	0	0	0	0	0	N/A	N/A	2484
Whitaker, Craig RP SF	Free Agent	0.0	0	0	0	0	0	0	0	0	0	0	N/A	N/A	2488
Vaughan, Beau RP OAK	Free Agent	0.0	0	0	0	0	0	0	0	0	0	0	N/A	N/A	2491
Ramirez, Horacio RP SF	Free Agent	0.0	0	0	0	0	0	0	0	0	0	0	N/A	N/A	2493
Rice, Scott RP COL	Free Agent	0.0	0	0	0	0	0	0	0	0	0	0	N/A	N/A	2494
Brown, Brooks RP DET	Free Agent	0.0	0	0	0	0	0	0	0	0	0	0	N/A	N/A	2498
Aquino, Greg RP CHW	Free Agent	0.0	0	0	0	0	0	0	0	0	0	0	N/A	N/A	2505
De La Rosa, Dane RP TB	Free Agent	0.0	0	0	0	0	0	0	0	0	0	0	N/A	N/A	2506
Rivera, Mumba RP SEA	Free Agent	0.0	0	0	0	0	0	0	0	0	0	0	N/A	N/A	2508
Mastny, Thomas RP CLE	Free Agent	0.0	0	0	0	0	0	0	0	0	0	0	N/A	N/A	2510
Songster, Jud RP COL	Free Agent	0.0	0	0	0	0	0	0	0	0	0	0	N/A	N/A	2512
Moss, Damian P COL	Free Agent	0.0	0	0	0	0	0	0	0	0	0	0	N/A	N/A	2515
McKiernan, Eddie RP ANA	Free Agent	0.0	0	0	0	0	0	0	0	0	0	0	N/A	N/A	2516
Moreno, Edwin RP BOS	Free Agent	0.0	0	0	0	0	0	0	0	0	0	0	N/A	N/A	2517
Mattioni, Nick RP OAK	Free Agent	0.0	0	0	0	0	0	0	0	0	0	0	N/A	N/A	2518
Dunn, Scott RP OAK	Free Agent	0.0	0	0	0	0	0	0	0	0	0	0	N/A	N/A	2522
Fogg, Josh RP PHI	Free Agent	0.0	0	0	0	0	0	0	0	0	0	0	N/A	N/A	2524
Stewart, Scott E. RP NYM	Free Agent	0.0	0	0	0	0	0	0	0	0	0	0	N/A	N/A	2526
Maxwell, Blake RP BOS	Free Agent	0.0	0	0	0	0	0	0	0	0	0	0	N/A	N/A	2539
Musser, Neal RP NYM	Free Agent	0.0	0	0	0	0	0	0	0	0	0	0	N/A	N/A	2544
Benitez, Armando RP FLA	Free Agent	0.0	0	0	0	0	0	0	0	0	0	0	N/A	N/A	2545
Diaz, Felix RP WAS	Free Agent	0.0	0	0	0	0	0	0	0	0	0	0	N/A	N/A	2558
Crawford, Tristan RP WAS	Free Agent	0.0	0	0	0	0	0	0	0	0	0	0	N/A	N/A	2561
Campusano, Ed RP CHC	Free Agent	0.0	0	0	0	0	0	0	0	0	0	0	N/A	N/A	2563
Waddell, Jason RP DET	Free Agent	0.0	0	0	0	0	0	0	0	0	0	0	N/A	N/A	2572
Hernandez, Fernando RP OAK	Free Agent	0.0	0	0	0	0	0	0	0	0	0	0	N/A	N/A	2575
Rundles, Richard RP CLE	Free Agent	0.0	0	0	0	0	0	0	0	0	0	0	N/A	N/A	2582
Rogers, Brian A. RP PIT	Free Agent	0.0	0	0	0	0	0	0	0	0	0	0	N/A	N/A	2583
Turnbow, Derrick RP FLA	Free Agent	0.0	0	0	0	0	0	0	0	0	0	0	N/A	N/A	2584
Murphy, Bill RP TOR	Free Agent	0.0	0	0	0	0	0	0	0	0	0	0	N/A	N/A	2590
Urquidez, Jason RP ARI	Free Agent	0.0	0	0	0	0	0	0	0	0	0	0	N/A	N/A	2592
Ray, Ronald RP SF	Free Agent	0.0	0	0	0	0	0	0	0	0	0	0	N/A	N/A	2595
Vargas, Jose RP TEX	Free Agent	0.0	0	0	0	0	0	0	0	0	0	0	N/A	N/A	2598
Kontos, George RP SD 	Free Agent	0.0	0	0	0	0	0	0	0	0	0	0	N/A	N/A	2599
Atlee, Thomas RP MIL	Free Agent	0.0	0	0	0	0	0	0	0	0	0	0	N/A	N/A	2601
Beam, T.J. RP ARI	Free Agent	0.0	0	0	0	0	0	0	0	0	0	0	N/A	N/A	2604
Wilkie, Josh RP WAS	Free Agent	0.0	0	0	0	0	0	0	0	0	0	0	N/A	N/A	2613
Bongiovanni, Vincent RP TOR	Free Agent	0.0	0	0	0	0	0	0	0	0	0	0	N/A	N/A	2615
Pote, Lou RP TEX	Free Agent	0.0	0	0	0	0	0	0	0	0	0	0	N/A	N/A	2620
Shappi, A.J. RP ARI	Free Agent	0.0	0	0	0	0	0	0	0	0	0	0	N/A	N/A	2628
Felix, Francisco RP LA	Free Agent	0.0	0	0	0	0	0	0	0	0	0	0	N/A	N/A	2631
Stinson, Josh RP NYM	Free Agent	0.0	0	0	0	0	0	0	0	0	0	0	N/A	N/A	2634
Fox, Chad RP CHC	Free Agent	0.0	0	0	0	0	0	0	0	0	0	0	N/A	N/A	2635
Bateman, Joe RP TB	Free Agent	0.0	0	0	0	0	0	0	0	0	0	0	N/A	N/A	2639
Moreno, Victor RP BAL	Free Agent	0.0	0	0	0	0	0	0	0	0	0	0	N/A	N/A	2640
Miller, Greg D. RP LA	Free Agent	0.0	0	0	0	0	0	0	0	0	0	0	N/A	N/A	2645
Butto, Francisco RP PHI	Free Agent	0.0	0	0	0	0	0	0	0	0	0	0	N/A	N/A	2651
Province, Christopher RP MIN	Free Agent	0.0	0	0	0	0	0	0	0	0	0	0	N/A	N/A	2654
Cox, Bryson RP BOS	Free Agent	0.0	0	0	0	0	0	0	0	0	0	0	N/A	N/A	2655
Smith, Cody RP KC	Free Agent	0.0	0	0	0	0	0	0	0	0	0	0	N/A	N/A	2658
Rueckel, Danny RP WAS	Free Agent	0.0	0	0	0	0	0	0	0	0	0	0	N/A	N/A	2661
Campbell, Brett B. RP MIL	Free Agent	0.0	0	0	0	0	0	0	0	0	0	0	N/A	N/A	2664
Furnish, Brad RP STL	Free Agent	0.0	0	0	0	0	0	0	0	0	0	0	N/A	N/A	2672
Lujan, John RP CHW	Free Agent	0.0	0	0	0	0	0	0	0	0	0	0	N/A	N/A	2674
De Fratus, Justin RP PHI	Free Agent	0.0	0	0	0	0	0	0	0	0	0	0	N/A	N/A	2685
Core, Danny RP TOR	Free Agent	0.0	0	0	0	0	0	0	0	0	0	0	N/A	N/A	2687
Smith, Sean H. RP COL	Free Agent	0.0	0	0	0	0	0	0	0	0	0	0	N/A	N/A	2688
Pineda, Michael P SEA 	Free Agent	0.0	0	0	0	0	0	0	0	0	0	0	N/A	N/A	2691
Segovia, Zack RP NYY	Free Agent	0.0	0	0	0	0	0	0	0	0	0	0	N/A	N/A	2694
Huber, Jon RP LA	Free Agent	0.0	0	0	0	0	0	0	0	0	0	0	N/A	N/A	2696
Kopp, David RP STL	Free Agent	0.0	0	0	0	0	0	0	0	0	0	0	N/A	N/A	2698
De Jong, Jordan RP TOR	Free Agent	0.0	0	0	0	0	0	0	0	0	0	0	N/A	N/A	2700
Burke, Greg RP SD	Free Agent	0.0	0	0	0	0	0	0	0	0	0	0	N/A	N/A	2703
Tucker, Glenn RP ATL	Free Agent	0.0	0	0	0	0	0	0	0	0	0	0	N/A	N/A	2707
Krebs, Joseph P CIN	Free Agent	0.0	0	0	0	0	0	0	0	0	0	0	N/A	N/A	2715
Patterson, Scott RP SEA	Free Agent	0.0	0	0	0	0	0	0	0	0	0	0	N/A	N/A	2716
Smith, Carlton RP CLE	Free Agent	0.0	0	0	0	0	0	0	0	0	0	0	N/A	N/A	2717
Fortunato, Bartolome RP SF	Free Agent	0.0	0	0	0	0	0	0	0	0	0	0	N/A	N/A	2727
Tsao, Chin-Hui RP KC	Free Agent	0.0	0	0	0	0	0	0	0	0	0	0	N/A	N/A	2728
Anderson, Brian RP SF	Free Agent	0.0	0	0	0	0	0	0	0	0	0	0	N/A	N/A	2730
Tomoro, Denny RP BOS	Free Agent	0.0	0	0	0	0	0	0	0	0	0	0	N/A	N/A	2734
Castellanos, Hugo RP STL	Free Agent	0.0	0	0	0	0	0	0	0	0	0	0	N/A	N/A	2736
Rodriguez, Orlando RP LA	Free Agent	0.0	0	0	0	0	0	0	0	0	0	0	N/A	N/A	2738
Hutchinson, Trevor RP FLA	Free Agent	0.0	0	0	0	0	0	0	0	0	0	0	N/A	N/A	2741
Clarke, Darren RP COL	Free Agent	0.0	0	0	0	0	0	0	0	0	0	0	N/A	N/A	2744
Muniz, Carlos RP NYM	Free Agent	0.0	0	0	0	0	0	0	0	0	0	0	N/A	N/A	2750
Jamison, Neil RP SD	Free Agent	0.0	0	0	0	0	0	0	0	0	0	0	N/A	N/A	2751
Mills, Adam RP BOS	Free Agent	0.0	0	0	0	0	0	0	0	0	0	0	N/A	N/A	2754
Casilla, Jose RP SF	Free Agent	0.0	0	0	0	0	0	0	0	0	0	0	N/A	N/A	2757
Arredondo, Jose RP CIN 	Free Agent	0.0	0	0	0	0	0	0	0	0	0	0	N/A	N/A	2763
Spottiswood, William RP ARI	Free Agent	0.0	0	0	0	0	0	0	0	0	0	0	N/A	N/A	2767
Valentine, Joe RP MIL	Free Agent	0.0	0	0	0	0	0	0	0	0	0	0	N/A	N/A	2771
Cabral, Cesar RP TB 	Free Agent	0.0	0	0	0	0	0	0	0	0	0	0	N/A	N/A	2773
Wagner, Ryan RP WAS	Free Agent	0.0	0	0	0	0	0	0	0	0	0	0	N/A	N/A	2774
Reckling, Trevor RP ANA	Free Agent	0.0	0	0	0	0	0	0	0	0	0	0	N/A	N/A	2778
Hagerty, Luke RP FLA	Free Agent	0.0	0	0	0	0	0	0	0	0	0	0	N/A	N/A	2779
Watson, Sean RP CIN	Free Agent	0.0	0	0	0	0	0	0	0	0	0	0	N/A	N/A	2780
Hottovy, Tommy RP BOS	Free Agent	0.0	0	0	0	0	0	0	0	0	0	0	N/A	N/A	2788
Knotts, Gary RP PHI	Free Agent	0.0	0	0	0	0	0	0	0	0	0	0	N/A	N/A	2799
Miller, Jeff RP SF	Free Agent	0.0	0	0	0	0	0	0	0	0	0	0	N/A	N/A	2801
Begg, Chris RP SF	Free Agent	0.0	0	0	0	0	0	0	0	0	0	0	N/A	N/A	2802
Garcia, Anderson RP SEA	Free Agent	0.0	0	0	0	0	0	0	0	0	0	0	N/A	N/A	2803
Tracey, Sean RP CHW	Free Agent	0.0	0	0	0	0	0	0	0	0	0	0	N/A	N/A	2808
Tovar, Angel RP SD	Free Agent	0.0	0	0	0	0	0	0	0	0	0	0	N/A	N/A	2809
Huerta, Edgar RP SD	Free Agent	0.0	0	0	0	0	0	0	0	0	0	0	N/A	N/A	2810
Ortega, Jose RP DET	Free Agent	0.0	0	0	0	0	0	0	0	0	0	0	N/A	N/A	2812
Sierra, Eduardo RP LA	Free Agent	0.0	0	0	0	0	0	0	0	0	0	0	N/A	N/A	2813
Stutes, Michael P PHI	Free Agent	0.0	0	0	0	0	0	0	0	0	0	0	N/A	N/A	2815
Shoemaker, Scott RP TEX	Free Agent	0.0	0	0	0	0	0	0	0	0	0	0	N/A	N/A	2820
Schmidt, Nick RP SD	Free Agent	0.0	0	0	0	0	0	0	0	0	0	0	N/A	N/A	2821
Mullins, Ryan RP MIN	Free Agent	0.0	0	0	0	0	0	0	0	0	0	0	N/A	N/A	2823
Matumoto, Jo RP TOR	Free Agent	0.0	0	0	0	0	0	0	0	0	0	0	N/A	N/A	2824
Barry, Kevin RP ATL	Free Agent	0.0	0	0	0	0	0	0	0	0	0	0	N/A	N/A	2825
Hines, Carlos RP HOU	Free Agent	0.0	0	0	0	0	0	0	0	0	0	0	N/A	N/A	2836
Overholt, Patrick RP PHI	Free Agent	0.0	0	0	0	0	0	0	0	0	0	0	N/A	N/A	2837
Laughter, Andrew RP TEX	Free Agent	0.0	0	0	0	0	0	0	0	0	0	0	N/A	N/A	2847
Oldham, Thomas RP SEA	Free Agent	0.0	0	0	0	0	0	0	0	0	0	0	N/A	N/A	2848
Egbert, Jack RP NYM	Free Agent	0.0	0	0	0	0	0	0	0	0	0	0	N/A	N/A	2850
Rall, Tim RP SEA	Free Agent	0.0	0	0	0	0	0	0	0	0	0	0	N/A	N/A	2851
Trolia, Aaron RP SEA	Free Agent	0.0	0	0	0	0	0	0	0	0	0	0	N/A	N/A	2854
Hedrick, Justin RP SF	Free Agent	0.0	0	0	0	0	0	0	0	0	0	0	N/A	N/A	2856
Richards, Garrett P ANA	Free Agent	0.0	0	0	0	0	0	0	0	0	0	0	N/A	N/A	2858
Basner, Ryan RP ATL	Free Agent	0.0	0	0	0	0	0	0	0	0	0	0	N/A	N/A	2860
Houlton, D.J. RP LA	Free Agent	0.0	0	0	0	0	0	0	0	0	0	0	N/A	N/A	2872
Cate, Troy RP OAK	Free Agent	0.0	0	0	0	0	0	0	0	0	0	0	N/A	N/A	2874
Shipman, Andrew RP OAK	Free Agent	0.0	0	0	0	0	0	0	0	0	0	0	N/A	N/A	2877
Ray, Jason P OAK	Free Agent	0.0	0	0	0	0	0	0	0	0	0	0	N/A	N/A	2882
Shinskie, David RP TOR	Free Agent	0.0	0	0	0	0	0	0	0	0	0	0	N/A	N/A	2886
Fukumori, Kazuo RP TEX	Free Agent	0.0	0	0	0	0	0	0	0	0	0	0	N/A	N/A	2888
McLemore, Mark S. RP MIN	Free Agent	0.0	0	0	0	0	0	0	0	0	0	0	N/A	N/A	2890
Edwards, Bryan RP NYM	Free Agent	0.0	0	0	0	0	0	0	0	0	0	0	N/A	N/A	2893
Wing, Ryan RP OAK	Free Agent	0.0	0	0	0	0	0	0	0	0	0	0	N/A	N/A	2899
Santos, Reid RP MIN	Free Agent	0.0	0	0	0	0	0	0	0	0	0	0	N/A	N/A	2902
Novinsky, John RP MIL	Free Agent	0.0	0	0	0	0	0	0	0	0	0	0	N/A	N/A	2904
DeSalvo, Matt RP FLA	Free Agent	0.0	0	0	0	0	0	0	0	0	0	0	N/A	N/A	2906
Geronimo, Ramon P CIN	Free Agent	0.0	0	0	0	0	0	0	0	0	0	0	N/A	N/A	2908
Serrano, Jimmy RP FLA	Free Agent	0.0	0	0	0	0	0	0	0	0	0	0	N/A	N/A	2909
Simmons, James J. RP OAK	Free Agent	0.0	0	0	0	0	0	0	0	0	0	0	N/A	N/A	2914
Sharpless, Josh RP PIT	Free Agent	0.0	0	0	0	0	0	0	0	0	0	0	N/A	N/A	2917
Bean, Colter RP ATL	Free Agent	0.0	0	0	0	0	0	0	0	0	0	0	N/A	N/A	2918
Haines, Talley RP BOS	Free Agent	0.0	0	0	0	0	0	0	0	0	0	0	N/A	N/A	2924
Norderum, Jason RP WAS	Free Agent	0.0	0	0	0	0	0	0	0	0	0	0	N/A	N/A	2929
Garate, Victor RP WAS	Free Agent	0.0	0	0	0	0	0	0	0	0	0	0	N/A	N/A	2935
Bucktrot, Keith RP PHI	Free Agent	0.0	0	0	0	0	0	0	0	0	0	0	N/A	N/A	2941
Young, Terrell RP CIN	Free Agent	0.0	0	0	0	0	0	0	0	0	0	0	N/A	N/A	2943
Gomez, Mariano RP ATL	Free Agent	0.0	0	0	0	0	0	0	0	0	0	0	N/A	N/A	2944
Whelan, Kevin RP NYY	Free Agent	0.0	0	0	0	0	0	0	0	0	0	0	N/A	N/A	2947
Barzilla, Philip RP SD	Free Agent	0.0	0	0	0	0	0	0	0	0	0	0	N/A	N/A	2952
Duff, Grant RP NYY	Free Agent	0.0	0	0	0	0	0	0	0	0	0	0	N/A	N/A	2955
Ruelas, Heriberto RP NYM	Free Agent	0.0	0	0	0	0	0	0	0	0	0	0	N/A	N/A	2958
Morris, Dallas RP ANA	Free Agent	0.0	0	0	0	0	0	0	0	0	0	0	N/A	N/A	2963
Kuwata, Masumi RP PIT	Free Agent	0.0	0	0	0	0	0	0	0	0	0	0	N/A	N/A	2971
Castillo, Fabio RP TEX 	Free Agent	0.0	0	0	0	0	0	0	0	0	0	0	N/A	N/A	2972
Thorpe, Tracy RP SEA	Free Agent	0.0	0	0	0	0	0	0	0	0	0	0	N/A	N/A	2974
Franco, Martire RP PHI	Free Agent	0.0	0	0	0	0	0	0	0	0	0	0	N/A	N/A	2975
Rustich, Brant RP NYM	Free Agent	0.0	0	0	0	0	0	0	0	0	0	0	N/A	N/A	2977
Littleton, Wes RP SEA	Free Agent	0.0	0	0	0	0	0	0	0	0	0	0	N/A	N/A	2981
Broshuis, Garrett RP SF	Free Agent	0.0	0	0	0	0	0	0	0	0	0	0	N/A	N/A	2988
Peterson, Matt RP FLA	Free Agent	0.0	0	0	0	0	0	0	0	0	0	0	N/A	N/A	2994
Perez, Marcelo RP DET	Free Agent	0.0	0	0	0	0	0	0	0	0	0	0	N/A	N/A	2997
Nall, Brandon RP NYM	Free Agent	0.0	0	0	0	0	0	0	0	0	0	0	N/A	N/A	3004
McGinley, Blake RP NYM	Free Agent	0.0	0	0	0	0	0	0	0	0	0	0	N/A	N/A	3007
Brothers, Rex RP COL	Free Agent	0.0	0	0	0	0	0	0	0	0	0	0	N/A	N/A	3009
Wassermann, Ehren RP PHI	Free Agent	0.0	0	0	0	0	0	0	0	0	0	0	N/A	N/A	3016
Ridgway, Jeff RP ATL	Free Agent	0.0	0	0	0	0	0	0	0	0	0	0	N/A	N/A	3017
Pope, Justin RP PHI	Free Agent	0.0	0	0	0	0	0	0	0	0	0	0	N/A	N/A	3020
Bowie, Micah RP COL	Free Agent	0.0	0	0	0	0	0	0	0	0	0	0	N/A	N/A	3021
Cromer, Jason RP TB	Free Agent	0.0	0	0	0	0	0	0	0	0	0	0	N/A	N/A	3023
Waechter, Doug RP KC	Free Agent	0.0	0	0	0	0	0	0	0	0	0	0	N/A	N/A	3033
Lara, Juan RP CLE	Free Agent	0.0	0	0	0	0	0	0	0	0	0	0	N/A	N/A	3040
Ramirez, Elizardo RP TEX	Free Agent	0.0	0	0	0	0	0	0	0	0	0	0	N/A	N/A	3043
Fields, Josh D. RP SEA	Free Agent	0.0	0	0	0	0	0	0	0	0	0	0	N/A	N/A	3045
Mallette, Brian RP PIT	Free Agent	0.0	0	0	0	0	0	0	0	0	0	0	N/A	N/A	3046
Bowyer, Travis RP FLA	Free Agent	0.0	0	0	0	0	0	0	0	0	0	0	N/A	N/A	3050
Jennings, Dan RP FLA	Free Agent	0.0	0	0	0	0	0	0	0	0	0	0	N/A	N/A	3051
Carter, Brenton RP SD	Free Agent	0.0	0	0	0	0	0	0	0	0	0	0	N/A	N/A	3052
Slocum, Brian RP PIT	Free Agent	0.0	0	0	0	0	0	0	0	0	0	0	N/A	N/A	3057
Seanez, Rudy RP ANA	Free Agent	0.0	0	0	0	0	0	0	0	0	0	0	N/A	N/A	3067
Judy, Josh RP CLE	Free Agent	0.0	0	0	0	0	0	0	0	0	0	0	N/A	N/A	3068
Miller, Matt J. RP PIT	Free Agent	0.0	0	0	0	0	0	0	0	0	0	0	N/A	N/A	3069
Bootcheck, Chris RP PIT	Free Agent	0.0	0	0	0	0	0	0	0	0	0	0	N/A	N/A	3071
Cullen, Ryan RP NYM	Free Agent	0.0	0	0	0	0	0	0	0	0	0	0	N/A	N/A	3072
Simons, Zach RP DET	Free Agent	0.0	0	0	0	0	0	0	0	0	0	0	N/A	N/A	3076
Carrasco, Hector RP PIT	Free Agent	0.0	0	0	0	0	0	0	0	0	0	0	N/A	N/A	3077
Rohlicek, Russel RP CHC	Free Agent	0.0	0	0	0	0	0	0	0	0	0	0	N/A	N/A	3080
Astacio, Ezequiel RP CHC	Free Agent	0.0	0	0	0	0	0	0	0	0	0	0	N/A	N/A	3086
Parise, Pete RP STL	Free Agent	0.0	0	0	0	0	0	0	0	0	0	0	N/A	N/A	3094
Calero, Kiko RP LA	Free Agent	0.0	0	0	0	0	0	0	0	0	0	0	N/A	N/A	3097
Bachanov, Jon RP ANA	Free Agent	0.0	0	0	0	0	0	0	0	0	0	0	N/A	N/A	3104
Walton, Sam RP STL	Free Agent	0.0	0	0	0	0	0	0	0	0	0	0	N/A	N/A	3109
Harikkala, Tim RP OAK	Free Agent	0.0	0	0	0	0	0	0	0	0	0	0	N/A	N/A	3112
Lambert, Chris RP BAL	Free Agent	0.0	0	0	0	0	0	0	0	0	0	0	N/A	N/A	3120
Gordon, Derrick RP OAK	Free Agent	0.0	0	0	0	0	0	0	0	0	0	0	N/A	N/A	3125
Wilkerson, George RP CIN	Free Agent	0.0	0	0	0	0	0	0	0	0	0	0	N/A	N/A	3128
Smith, Mike RP CHC	Free Agent	0.0	0	0	0	0	0	0	0	0	0	0	N/A	N/A	3130
Gardner, Michael RP SD	Free Agent	0.0	0	0	0	0	0	0	0	0	0	0	N/A	N/A	3137
Egan, Pat RP MIL 	Free Agent	0.0	0	0	0	0	0	0	0	0	0	0	N/A	N/A	3138
McClellan, Zach RP COL	Free Agent	0.0	0	0	0	0	0	0	0	0	0	0	N/A	N/A	3144
McBeth, Marcus RP OAK	Free Agent	0.0	0	0	0	0	0	0	0	0	0	0	N/A	N/A	3145
Roquet, Rocky RP CHC	Free Agent	0.0	0	0	0	0	0	0	0	0	0	0	N/A	N/A	3149
Novoa, Roberto RP BAL	Free Agent	0.0	0	0	0	0	0	0	0	0	0	0	N/A	N/A	3150
Guttormson, Rick RP SEA	Free Agent	0.0	0	0	0	0	0	0	0	0	0	0	N/A	N/A	3158
Brown, Andrew RP OAK	Free Agent	0.0	0	0	0	0	0	0	0	0	0	0	N/A	N/A	3160
Julio, Jorge RP PIT	Free Agent	0.0	0	0	0	0	0	0	0	0	0	0	N/A	N/A	3163
Hardy, Blaine P KC	Free Agent	0.0	0	0	0	0	0	0	0	0	0	0	N/A	N/A	3166
Cedeno, Juan RP DET	Free Agent	0.0	0	0	0	0	0	0	0	0	0	0	N/A	N/A	3167
Lueke, Josh RP SEA 	Free Agent	0.0	0	0	0	0	0	0	0	0	0	0	N/A	N/A	3172
Ellis, Jonathon RP SD	Free Agent	0.0	0	0	0	0	0	0	0	0	0	0	N/A	N/A	3174
McCrory, Bob RP BAL	Free Agent	0.0	0	0	0	0	0	0	0	0	0	0	N/A	N/A	3176
Eckert, Harold RP LA	Free Agent	0.0	0	0	0	0	0	0	0	0	0	0	N/A	N/A	3190
Mitchell, Andy RP BAL	Free Agent	0.0	0	0	0	0	0	0	0	0	0	0	N/A	N/A	3191
Davidson, Daniel RP ANA	Free Agent	0.0	0	0	0	0	0	0	0	0	0	0	N/A	N/A	3194
Cruceta, Francisco RP DET	Free Agent	0.0	0	0	0	0	0	0	0	0	0	0	N/A	N/A	3198
Carter, Anthony RP CHW	Free Agent	0.0	0	0	0	0	0	0	0	0	0	0	N/A	N/A	3201
Corcoran, Roy RP HOU	Free Agent	0.0	0	0	0	0	0	0	0	0	0	0	N/A	N/A	3202
Caminero, Arquimedes RP FLA	Free Agent	0.0	0	0	0	0	0	0	0	0	0	0	N/A	N/A	3205
Housman, Jeff RP MIL	Free Agent	0.0	0	0	0	0	0	0	0	0	0	0	N/A	N/A	3206
Pomeranz, Stuart RP COL	Free Agent	0.0	0	0	0	0	0	0	0	0	0	0	N/A	N/A	3207
Towers, Josh RP LA	Free Agent	0.0	0	0	0	0	0	0	0	0	0	0	N/A	N/A	3209
Timlin, Mike RP COL	Free Agent	0.0	0	0	0	0	0	0	0	0	0	0	N/A	N/A	3210
Santos, Arthur RP KC	Free Agent	0.0	0	0	0	0	0	0	0	0	0	0	N/A	N/A	3214
Ventura, Ronnie RP HOU	Free Agent	0.0	0	0	0	0	0	0	0	0	0	0	N/A	N/A	3216
Stockman, Phil RP ATL	Free Agent	0.0	0	0	0	0	0	0	0	0	0	0	N/A	N/A	3219
Jung, Sung RP ATL	Free Agent	0.0	0	0	0	0	0	0	0	0	0	0	N/A	N/A	3221
Ellis, Josh RP ARI	Free Agent	0.0	0	0	0	0	0	0	0	0	0	0	N/A	N/A	3224
Childress, Daylan RP MIN	Free Agent	0.0	0	0	0	0	0	0	0	0	0	0	N/A	N/A	3228
Ingram, Jesse RP TEX	Free Agent	0.0	0	0	0	0	0	0	0	0	0	0	N/A	N/A	3230
Carvajal, Marcos RP FLA	Free Agent	0.0	0	0	0	0	0	0	0	0	0	0	N/A	N/A	3232
Nall, T.J. RP WAS	Free Agent	0.0	0	0	0	0	0	0	0	0	0	0	N/A	N/A	3235
Cody, Christopher RP MIL	Free Agent	0.0	0	0	0	0	0	0	0	0	0	0	N/A	N/A	3240
Snyder, Kyle RP NYM	Free Agent	0.0	0	0	0	0	0	0	0	0	0	0	N/A	N/A	3242
Bennett, Jeff RP MIL	Free Agent	0.0	0	0	0	0	0	0	0	0	0	0	N/A	N/A	3243
Fiers, Michael RP MIL	Free Agent	0.0	0	0	0	0	0	0	0	0	0	0	N/A	N/A	3244
Arias, Wilkins RP NYY	Free Agent	0.0	0	0	0	0	0	0	0	0	0	0	N/A	N/A	3245
Ryu, Jae-Kuk RP SD	Free Agent	0.0	0	0	0	0	0	0	0	0	0	0	N/A	N/A	3246
Field, Nate RP FLA	Free Agent	0.0	0	0	0	0	0	0	0	0	0	0	N/A	N/A	3250
Bradford, Chad RP TB	Free Agent	0.0	0	0	0	0	0	0	0	0	0	0	N/A	N/A	3253
Dillard, Tim RP MIL 	Free Agent	0.0	0	0	0	0	0	0	0	0	0	0	N/A	N/A	3255
Cyr, Eric RP TEX	Free Agent	0.0	0	0	0	0	0	0	0	0	0	0	N/A	N/A	3257
Beltran, Francis RP SF	Free Agent	0.0	0	0	0	0	0	0	0	0	0	0	N/A	N/A	3265
Lamura, B.J. P TOR	Free Agent	0.0	0	0	0	0	0	0	0	0	0	0	N/A	N/A	3267
Bryson, Robert RP CLE	Free Agent	0.0	0	0	0	0	0	0	0	0	0	0	N/A	N/A	3268
Rosario, Francisco A. RP KC	Free Agent	0.0	0	0	0	0	0	0	0	0	0	0	N/A	N/A	3270
