Escalona, Sergio RP PHI	Free Agent	0.0	0	0	0	0	0	0	0	0	0	0	N/A	N/A	1039
Madrigal, Warner RP TEX	Free Agent	0.0	0	0	0	0	0	0	0	0	0	0	N/A	N/A	1041
Hyde, Lee RP ATL	Free Agent	0.0	0	0	0	0	0	0	0	0	0	0	N/A	N/A	1043
Hayhurst, Dirk RP TOR 	Free Agent	0.0	0	0	0	0	0	0	0	0	0	0	N/A	N/A	1045
Howell, J.P. RP TB 	Free Agent	0.0	0	0	0	0	0	0	0	0	0	0	N/A	N/A	1046
De Los Santos, Fautino RP OAK	Free Agent	0.0	0	0	0	0	0	0	0	0	0	0	N/A	N/A	1047
Nathan, Joe RP MIN 	Free Agent	0.0	0	0	0	0	0	0	0	0	0	0	N/A	N/A	1051
Perez, Wilfrido RP BAL	Free Agent	0.0	0	0	0	0	0	0	0	0	0	0	N/A	N/A	1052
Mosebach, Bobby RP ANA	Free Agent	0.0	0	0	0	0	0	0	0	0	0	0	N/A	N/A	1053
Rodriguez, Fernando RP HOU	Free Agent	0.0	0	0	0	0	0	0	0	0	0	0	N/A	N/A	1054
Dolsi, Freddy RP CHW	Free Agent	0.0	0	0	0	0	0	0	0	0	0	0	N/A	N/A	1056
Valdez, Jose RP HOU	Free Agent	0.0	0	0	0	0	0	0	0	0	0	0	N/A	N/A	1062
Uviedo, Ronald RP TOR	Free Agent	0.0	0	0	0	0	0	0	0	0	0	0	N/A	N/A	1064
Coello, Robert RP BOS	Free Agent	5.7	0	0	0	0	0	0	0	5	5	4	4.765	1.5882	1071
Fox, Matt RP BOS	Free Agent	7.3	1	0	0	0	0	0	0	0	2	8	4.909	1.3636	1076
Fisher, Carlos RP CIN	Free Agent	22.3	0	0	0	1	1	0	0	21	13	22	5.642	1.5672	1077
Wood, Blake RP KC	Free Agent	49.7	0	0	0	1	3	0	4	31	22	54	5.074	1.5302	1078
Colome, Jesus RP TEX	Free Agent	17.0	0	0	0	0	1	0	0	16	11	15	5.294	1.5294	1079
Marinez, Jhan RP FLA	Free Agent	2.7	0	0	0	1	1	0	2	3	3	3	6.750	2.2500	1080
Proctor, Scott RP ATL 	Free Agent	5.7	0	0	0	0	0	0	0	6	4	4	6.353	1.4118	1082
Patton, Troy RP BAL	Free Agent	0.7	0	0	0	0	0	0	0	1	1	1	0.000	3.0000	1083
English, Jesse RP WAS 	Free Agent	7.0	0	0	0	0	0	0	0	4	2	10	3.857	1.7143	1084
Perdomo, Luis RP SD 	Free Agent	1.0	0	0	0	0	0	0	0	0	0	1	9.000	1.0000	1085
Stoner, Tobi RP NYM	Free Agent	2.3	0	0	0	0	1	0	0	0	1	3	3.857	1.7143	1088
Wright, Wesley RP HOU	Free Agent	33.0	4	1	0	1	2	0	0	29	13	37	5.727	1.5152	1094
Neshek, Pat RP MIN 	Free Agent	9.0	0	0	0	0	1	0	1	9	8	7	5.000	1.6667	1099
Roenicke, Josh RP TOR	Free Agent	19.0	0	0	0	1	0	0	0	18	13	18	5.684	1.6316	1111
Bulger, Jason RP ANA	Free Agent	24.0	0	0	0	0	0	0	0	25	15	25	4.875	1.6667	1116
MacLane, Evan RP STL	Free Agent	1.0	0	0	0	0	1	0	0	0	1	1	9.000	2.0000	1118
Rosa, Carlos RP ARI	Free Agent	20.0	0	0	0	0	2	0	1	9	12	20	4.500	1.6000	1119
Viola, Pedro RP BAL	Free Agent	1.3	0	0	0	0	0	0	0	3	1	1	13.500	1.5000	1121
Benson, Kris RP ARI 	SA`s	14.0	3	2	0	1	1	0	0	8	6	18	5.143	1.7143	1122
Rincon, Juan RP COL	Free Agent	2.0	0	0	0	0	0	0	0	3	2	3	4.500	2.5000	1123
Hawksworth, Blake RP LA 	Free Agent	90.3	8	1	0	4	8	0	0	61	35	113	4.981	1.6384	1128
Rodriguez, Rafael RP ARI	Free Agent	4.7	0	0	0	0	0	0	0	3	3	5	5.786	1.7143	1131
Lowe, Mark RP TEX 	Free Agent	13.3	0	0	0	1	3	0	0	12	6	18	5.400	1.8000	1138
Gaudin, Chad RP WAS 	Free Agent	65.3	0	0	0	1	4	0	1	53	25	73	5.648	1.5000	1142
Link, Jon RP LA	Free Agent	8.7	0	0	0	0	0	0	0	4	4	12	4.154	1.8462	1147
Perkins, Glen RP MIN	Free Agent	21.7	1	0	0	1	1	0	0	14	5	29	5.815	1.5692	1151
Delaney, Rob RP MIN	Free Agent	1.0	0	0	0	0	0	0	0	0	1	2	9.000	3.0000	1152
Carpenter, Andrew RP PHI	Free Agent	3.0	0	0	0	0	1	0	0	2	0	5	9.000	1.6667	1158
Cruz, Juan RP KC	Free Agent	5.3	0	0	0	0	0	0	1	7	4	9	3.375	2.4375	1162
Fien, Casey RP DET	Free Agent	2.7	0	0	0	0	0	0	0	0	0	4	10.125	1.5000	1164
Chacin, Gustavo RP HOU 	Free Agent	38.3	0	0	0	2	2	1	0	31	20	51	4.696	1.8522	1167
Marquez, Jeff RP CHW	Free Agent	1.0	0	0	0	0	0	0	0	0	0	2	18.000	2.0000	1169
Hendrickson, Mark RP BAL 	Free Agent	75.3	1	0	0	1	6	0	2	55	20	97	5.257	1.5531	1171
Cordero, Chad RP NYM	Free Agent	9.7	0	0	0	0	1	0	0	6	5	10	6.517	1.5517	1173
Mulvey, Kevin RP ARI	Free Agent	3.0	0	0	0	0	0	0	0	1	2	5	6.000	2.3333	1179
Kroenke, Zach RP ARI	Free Agent	6.7	1	0	0	1	0	0	0	2	4	9	6.750	1.9500	1184
Del Rosario, Enerio RP HOU	Free Agent	10.0	0	0	0	1	1	0	2	4	4	17	4.500	2.1000	1188
Martinez, Joe RP PIT 	Free Agent	19.7	1	0	0	0	1	0	0	9	9	26	4.119	1.7797	1189
Texeira, Kanekoa RP KC	Free Agent	61.3	0	0	0	1	1	0	0	33	25	73	4.842	1.5978	1191
Mickolio, Kam RP ARI 	Free Agent	3.7	0	0	0	0	0	0	0	4	3	5	7.364	2.1818	1193
Palmer, Matt RP ANA	Free Agent	33.7	1	0	0	1	2	0	0	17	20	38	4.545	1.7228	1201
Gray, Jeff RP CHC	Free Agent	9.3	0	0	0	1	0	0	0	4	5	12	6.750	1.8214	1206
Baez, Danys RP PHI	Free Agent	47.7	0	0	0	3	4	0	2	28	23	55	5.476	1.6364	1207
Elbert, Scott RP LA	Grape Apes	0.7	0	0	0	0	0	0	0	0	3	1	13.500	6.0000	1208
James, Justin RP MIL 	Free Agent	4.0	0	0	0	0	0	0	1	5	4	7	4.500	2.7500	1209
Todd, Jess RP CLE	Free Agent	6.0	0	0	0	0	0	0	0	9	3	9	7.500	2.0000	1212
Atkins, Mitch RP CHC 	Free Agent	10.0	0	0	0	0	0	0	0	10	6	12	6.300	1.8000	1213
Bergmann, Jason RP BOS	Free Agent	2.3	0	0	0	0	1	0	0	2	1	3	15.429	1.7143	1214
Weinhardt, Robbie RP DET	Free Agent	29.3	0	0	0	2	2	0	2	21	8	40	6.136	1.6364	1215
Strickland, Scott RP FLA	Free Agent	2.0	0	0	0	0	0	0	0	0	1	5	9.000	3.0000	1216
Rupe, Josh RP KC	Free Agent	9.7	0	0	0	1	1	0	0	8	7	14	5.586	2.1724	1218
Lewis, Rommie RP TOR	Free Agent	18.7	0	0	0	0	0	0	0	15	8	20	6.750	1.5000	1220
Thompson, Brad RP HOU	Free Agent	19.7	0	0	0	0	4	0	1	10	4	25	6.407	1.4746	1223
Kintzler, Brandon RP MIL	Free Agent	7.3	0	0	0	0	1	0	0	9	4	10	7.364	1.9091	1225
Moscoso, Guillermo RP TEX 	Free Agent	0.7	0	0	0	0	0	0	0	2	2	2	27.000	6.0000	1227
Morales, Franklin RP COL	Free Agent	28.7	0	0	0	0	4	3	3	27	24	28	6.279	1.8140	1228
Houser, James RP FLA	Free Agent	1.3	0	0	0	0	0	0	0	1	1	3	20.250	3.0000	1231
Ceda, Jose RP FLA	Free Agent	8.7	0	0	0	0	0	0	0	9	11	8	5.192	2.1923	1232
Ledezma, Wil RP PIT 	Free Agent	19.7	0	0	0	0	3	0	0	22	6	25	6.864	1.5763	1233
Ring, Royce RP SEA 	Free Agent	2.3	0	0	0	0	0	0	0	2	2	3	15.429	2.1429	1234
Cabrera, Fernando RP BOS	Free Agent	1.3	0	0	0	0	0	0	0	0	2	2	20.250	3.0000	1236
Slama, Anthony RP MIN	Free Agent	4.7	0	0	0	0	1	0	1	5	5	6	7.714	2.3571	1237
Mejia, Jenrry RP NYM 	Free Agent	39.0	3	0	0	0	4	0	1	22	20	46	4.615	1.6923	1239
Bonser, Boof RP OAK 	Free Agent	25.0	0	0	0	1	0	0	0	17	8	33	6.120	1.6400	1240
Taschner, Jack RP LA	Free Agent	19.7	0	0	0	1	0	0	1	17	11	23	6.407	1.7288	1244
Holland, Greg RP KC	Free Agent	18.7	0	0	0	0	1	0	0	23	8	23	6.750	1.6607	1245
Moehler, Brian RP HOU 	Free Agent	56.7	8	2	0	1	4	0	0	28	26	66	4.923	1.6235	1246
Mathieson, Scott RP PHI 	Free Agent	1.7	0	0	0	0	0	0	0	1	2	5	10.800	4.2000	1247
Tankersley, Taylor RP FLA	Free Agent	12.0	0	0	0	0	0	0	3	7	7	12	7.500	1.5833	1249
Valdez, Merkin RP TOR	Free Agent	1.3	0	0	0	0	0	0	0	0	3	2	20.250	3.7500	1253
Richardson, Dustin RP FLA 	Free Agent	13.0	0	0	0	0	0	0	0	12	14	15	4.154	2.2308	1254
Caridad, Esmailin RP CHC	Free Agent	4.0	0	0	0	0	1	0	2	4	5	4	11.250	2.2500	1258
Sinkbeil, Brett RP FLA	Free Agent	2.0	0	0	0	0	0	0	0	1	5	2	13.500	3.5000	1259
Stevens, Jeff RP CHC	Free Agent	17.7	0	0	0	0	0	0	1	15	10	21	6.113	1.7547	1260
Zagurski, Mike RP PHI	Free Agent	7.0	0	0	0	0	0	0	0	11	5	8	10.286	1.8571	1264
White, Sean RP SEA 	Free Agent	34.3	0	0	0	0	1	0	3	15	11	45	5.243	1.6311	1265
Gervacio, Sammy RP HOU 	Free Agent	3.7	0	0	0	0	1	0	0	3	5	4	12.273	2.4545	1267
Ortiz, Ramon RP TB	Free Agent	30.0	2	0	0	1	2	0	0	21	16	33	6.300	1.6333	1268
Bisenius, Joe RP WAS 	Free Agent	4.7	0	0	0	0	0	0	0	5	6	6	9.643	2.5714	1270
Wood, Tim RP WAS	Free Agent	27.7	0	0	0	0	1	1	2	10	15	33	5.530	1.7349	1271
Colon, Roman RP KC	Free Agent	2.0	0	0	0	0	0	0	0	1	2	5	18.000	3.5000	1272
Igarashi, Ryota RP NYM	Free Agent	30.3	0	0	0	1	1	0	0	25	18	29	7.121	1.5495	1273
Accardo, Jeremy RP BAL 	Free Agent	6.7	0	0	0	0	1	0	0	3	3	12	8.100	2.2500	1274
Sampson, Chris RP HOU	Free Agent	30.3	0	0	0	1	0	0	2	16	8	43	5.934	1.6813	1276
Sborz, Jay RP ATL	Free Agent	0.7	0	0	0	0	0	0	0	1	0	3	67.500	4.5000	1278
Berg, Justin RP CHC	Free Agent	40.0	0	0	0	0	1	0	0	14	20	45	5.175	1.6250	1280
Majewski, Gary RP HOU	Free Agent	2.0	0	0	0	0	0	0	0	1	1	5	22.500	3.0000	1281
Beltre, Omar RP TEX 	Free Agent	7.0	2	0	0	0	1	0	0	9	7	9	9.000	2.2857	1282
Bullington, Bryan SP KC 	Free Agent	42.7	5	2	0	1	4	0	0	29	17	51	6.117	1.5938	1283
Figaro, Alfredo RP DET 	Free Agent	14.7	1	0	0	0	2	0	0	5	8	18	6.750	1.7727	1285
Varvaro, Anthony RP SEA	Free Agent	4.0	0	0	0	0	1	0	0	5	6	6	11.250	3.0000	1287
Shields, Scot RP ANA 	Free Agent	46.0	1	0	0	0	3	0	1	39	34	45	5.283	1.7174	1288
Feldman, Scott SP TEX 	Free Agent	141.3	22	6	0	7	11	0	0	75	45	181	5.476	1.5991	1289
Diamond, Thomas RP CHC	Free Agent	29.0	3	1	0	1	3	0	0	36	18	33	6.828	1.7586	1290
Stange, Daniel RP ARI	Free Agent	4.0	0	0	0	0	0	0	0	2	6	4	13.500	2.5000	1291
Joaquin, Waldis RP CHW 	Free Agent	4.7	0	0	0	0	0	0	0	2	7	6	9.643	2.7857	1292
Thomas, Justin RP PIT 	Free Agent	13.0	0	0	0	0	1	0	0	5	5	21	6.231	2.0000	1293
Mathis, Doug RP TEX 	Free Agent	22.3	0	0	0	1	1	0	0	10	11	30	6.045	1.8358	1294
Estrada, Marco RP MIL 	Free Agent	11.3	1	0	0	0	0	0	0	13	6	14	9.529	1.7647	1296
Norberto, Jordan RP ARI	Free Agent	20.0	0	0	0	0	2	0	1	15	22	16	5.850	1.9000	1297
Stetter, Mitch RP MIL	Free Agent	3.7	0	0	0	0	0	0	0	3	3	7	14.727	2.7273	1298
Ortiz, Russ RP LA	Free Agent	7.0	0	0	0	0	1	0	0	6	5	10	10.286	2.1429	1299
Hawkins, LaTroy RP MIL 	Free Agent	16.0	0	0	0	0	3	0	2	18	6	21	8.438	1.6875	1300
Rosales, Leo RP ARI	Free Agent	16.3	0	0	0	2	0	0	0	12	9	25	7.163	2.0816	1301
Lincoln, Mike RP CIN 	Free Agent	19.7	0	0	0	1	0	0	0	12	10	25	7.322	1.7797	1303
Suppan, Jeff SP STL	Sofa Kings	101.3	15	2	0	3	8	0	0	51	37	130	5.062	1.6480	1304
MacDougal, Mike RP STL	Free Agent	18.7	0	0	0	1	1	0	1	14	12	23	7.232	1.8750	1306
Thayer, Dale RP TB	Free Agent	2.0	0	0	0	0	0	0	0	2	0	7	27.000	3.5000	1307
Schoeneweis, Scott RP BOS	Free Agent	13.7	0	0	0	1	0	0	0	13	10	19	7.902	2.1220	1308
Gabino, Armando RP BAL	Free Agent	4.7	0	0	0	0	0	0	0	2	3	9	13.500	2.5714	1309
Castillo, Alberto RP BAL	Free Agent	10.7	0	0	0	1	0	0	0	11	6	16	10.125	2.0625	1310
Harrell, Lucas RP CHW	Free Agent	24.0	3	1	0	1	0	0	0	15	17	34	4.875	2.1250	1313
Vargas, Claudio RP LA	Free Agent	19.7	0	0	0	1	0	0	0	18	10	28	7.322	1.9322	1314
Leroux, Chris RP PIT	Free Agent	22.7	0	0	0	0	1	0	2	22	14	28	6.750	1.8529	1315
Buente, Jay RP FLA	Free Agent	11.0	0	0	0	0	0	0	0	9	11	16	6.545	2.4545	1316
Jackson, Steven RP PIT	Free Agent	11.3	0	0	0	0	1	0	0	7	6	17	8.735	2.0294	1317
Nelson, Joe RP SEA	Free Agent	8.3	0	0	0	0	0	0	0	9	6	14	9.720	2.4000	1319
Mata, Frank RP BAL	Free Agent	17.3	0	0	0	0	0	0	0	9	8	24	7.788	1.8462	1325
Rogers, Esmil RP COL	Free Agent	72.0	8	3	0	2	3	0	1	66	26	94	6.125	1.6667	1326
Ambriz, Hector RP CLE 	Free Agent	48.3	0	0	0	0	2	0	0	37	17	68	5.586	1.7586	1327
Medders, Brandon RP SF	Free Agent	15.0	0	0	0	0	0	0	0	8	6	26	7.200	2.1333	1328
Valdez, Cesar RP ARI 	Free Agent	20.0	2	0	0	1	2	0	0	13	10	29	7.650	1.9500	1329
Ni, Fu-Te RP DET 	Free Agent	23.0	0	0	0	0	1	0	0	22	19	27	6.652	2.0000	1330
Grabow, John RP CHC 	Free Agent	25.7	0	0	0	1	3	0	1	20	13	35	7.364	1.8701	1332
Meche, Gil RP KC	Free Agent	61.7	9	2	1	0	5	0	0	41	38	65	5.692	1.6703	1334
Bass, Brian RP PIT 	Free Agent	7.3	0	0	0	0	0	0	0	5	10	9	12.273	2.5909	1335
Rosario, Sandy RP FLA	Free Agent	1.0	0	0	0	0	0	0	0	0	1	9	54.000	10.0000	1336
Gallagher, Sean RP PIT	Free Agent	57.7	0	0	0	2	1	0	0	43	41	62	5.775	1.7861	1337
Tallet, Brian RP STL 	Free Agent	77.3	5	1	0	2	6	0	2	53	38	84	6.401	1.5776	1338
McCutchen, Daniel RP PIT	Free Agent	67.7	9	1	0	2	5	0	0	38	28	83	6.118	1.6404	1339
Penn, Hayden RP PIT	Free Agent	2.3	0	0	0	0	0	0	0	0	3	8	30.857	4.7143	1340
Ramos, Cesar RP TB 	Free Agent	8.3	0	0	0	0	1	0	0	9	4	18	11.880	2.6400	1341
Torres, Carlos RP CHW	Free Agent	13.7	1	0	0	0	1	0	0	13	9	23	8.561	2.3415	1343
Bruney, Brian RP NYM 	Free Agent	17.7	0	0	0	1	2	0	0	16	20	21	7.641	2.3208	1344
Reyes, Jo-Jo RP TOR	Free Agent	3.3	0	0	0	0	0	0	0	2	3	10	24.300	3.9000	1345
Samardzija, Jeff RP CHC	Free Agent	19.3	3	1	0	2	2	0	0	9	20	21	8.379	2.1207	1346
Mendoza, Luis RP KC	Free Agent	4.0	0	0	0	0	1	0	1	1	3	10	22.500	3.2500	1347
Rivera, Saul RP CLE	Free Agent	3.7	0	0	0	0	0	0	0	1	3	11	22.091	3.8182	1348
Strop, Pedro RP TEX	Free Agent	10.7	0	0	0	0	0	0	0	11	11	17	10.125	2.6250	1349
Sherrill, George RP ATL 	Free Agent	36.3	0	0	0	2	2	0	4	25	24	46	6.688	1.9266	1350
Williams, Randy RP BOS	Free Agent	25.0	0	0	0	0	1	0	1	22	21	37	5.400	2.3200	1351
Schlitter, Brian RP CHC	Free Agent	8.0	0	0	0	0	1	0	0	7	5	18	12.375	2.8750	1352
Meyer, Dan RP PHI 	Free Agent	9.3	0	0	0	0	1	0	1	4	12	15	9.643	2.8929	1354
Howry, Bob RP CHC	Free Agent	35.0	0	0	0	1	3	0	1	14	13	47	7.714	1.7143	1355
Stokes, Brian RP TOR 	Free Agent	16.7	0	0	0	0	0	0	0	16	16	26	8.100	2.5200	1358
Daigle, Casey RP HOU	Free Agent	10.3	0	0	0	1	1	0	0	6	6	25	11.323	3.0000	1359
Marte, Victor RP KC 	Free Agent	27.7	0	0	0	3	0	0	0	19	15	38	9.759	1.9157	1363
Perez, Oliver RP NYM	Free Agent	46.3	7	2	0	0	5	0	0	37	42	54	6.799	2.0719	1370
Rowland-Smith, Ryan SP HOU 	Free Agent	109.3	20	4	0	1	10	0	0	49	44	141	6.750	1.6921	1374
Smith, Matt A. RP CHW	Free Agent	0.0	0	0	0	0	0	0	0	0	0	0	N/A	N/A	1378
Shiell, Jason RP MIL	Free Agent	0.0	0	0	0	0	0	0	0	0	0	0	N/A	N/A	1380
Gordon, Tom RP ARI	Free Agent	0.0	0	0	0	0	0	0	0	0	0	0	N/A	N/A	1381
Leon, Arnold RP OAK	Free Agent	0.0	0	0	0	0	0	0	0	0	0	0	N/A	N/A	1382
Peguero, Jailen RP HOU	Free Agent	0.0	0	0	0	0	0	0	0	0	0	0	N/A	N/A	1390
Long, Matt RP CHW	Free Agent	0.0	0	0	0	0	0	0	0	0	0	0	N/A	N/A	1392
Rainville, Jay RP MIN	Free Agent	0.0	0	0	0	0	0	0	0	0	0	0	N/A	N/A	1398
Jones, Jason M. RP WAS	Free Agent	0.0	0	0	0	0	0	0	0	0	0	0	N/A	N/A	1405
Parisi, Mike RP CHC	Free Agent	0.0	0	0	0	0	0	0	0	0	0	0	N/A	N/A	1407
Turpen, Dan RP NYY 	Free Agent	0.0	0	0	0	0	0	0	0	0	0	0	N/A	N/A	1408
Banks, Demetrius RP CHW	Free Agent	0.0	0	0	0	0	0	0	0	0	0	0	N/A	N/A	1412
Weathers, David RP MIL	Free Agent	0.0	0	0	0	0	0	0	0	0	0	0	N/A	N/A	1421
Johnson, Tyler J. RP SEA	Free Agent	0.0	0	0	0	0	0	0	0	0	0	0	N/A	N/A	1425
Kensing, Logan RP TB	Free Agent	0.0	0	0	0	0	0	0	0	0	0	0	N/A	N/A	1428
Nabors, Kevin RP ANA	Free Agent	0.0	0	0	0	0	0	0	0	0	0	0	N/A	N/A	1432
Carignan, Andrew RP OAK	Free Agent	0.0	0	0	0	0	0	0	0	0	0	0	N/A	N/A	1433
Ramirez, Erasmo RP MIL	Free Agent	0.0	0	0	0	0	0	0	0	0	0	0	N/A	N/A	1436
Ramos, Mario RP OAK	Free Agent	0.0	0	0	0	0	0	0	0	0	0	0	N/A	N/A	1438
Mitchell, Mike RP OAK	Free Agent	0.0	0	0	0	0	0	0	0	0	0	0	N/A	N/A	1439
De La Cruz, Jose RP SEA	Free Agent	0.0	0	0	0	0	0	0	0	0	0	0	N/A	N/A	1441
McLeary, Marty RP MIL	Free Agent	0.0	0	0	0	0	0	0	0	0	0	0	N/A	N/A	1445
Muecke, Josh RP COL	Free Agent	0.0	0	0	0	0	0	0	0	0	0	0	N/A	N/A	1449
Cameron, Kevin RP OAK	Free Agent	0.0	0	0	0	0	0	0	0	0	0	0	N/A	N/A	1452
Wlodarczyk, Michael RP TB	Free Agent	0.0	0	0	0	0	0	0	0	0	0	0	N/A	N/A	1453
Embree, Alan RP CHW	Free Agent	0.0	0	0	0	0	0	0	0	0	0	0	N/A	N/A	1458
Barnette, Tony RP ARI	Free Agent	0.0	0	0	0	0	0	0	0	0	0	0	N/A	N/A	1460
Alvarez, Carlos RP LA	Free Agent	0.0	0	0	0	0	0	0	0	0	0	0	N/A	N/A	1461
Sillman, Mike RP STL	Free Agent	0.0	0	0	0	0	0	0	0	0	0	0	N/A	N/A	1463
Santiago, Julio RP SEA	Free Agent	0.0	0	0	0	0	0	0	0	0	0	0	N/A	N/A	1467
Zinicola, Zech RP TOR	Free Agent	0.0	0	0	0	0	0	0	0	0	0	0	N/A	N/A	1469
Borrell, Danny RP NYY	Free Agent	0.0	0	0	0	0	0	0	0	0	0	0	N/A	N/A	1470
Maekawa, Katsuhiko RP STL	Free Agent	0.0	0	0	0	0	0	0	0	0	0	0	N/A	N/A	1476
Hoorelbeke, Casey RP LA	Free Agent	0.0	0	0	0	0	0	0	0	0	0	0	N/A	N/A	1477
Maust, David RP WAS	Free Agent	0.0	0	0	0	0	0	0	0	0	0	0	N/A	N/A	1483
Curreri, Frank RP ARI	Free Agent	0.0	0	0	0	0	0	0	0	0	0	0	N/A	N/A	1487
Koplove, Mike RP SD	Free Agent	0.0	0	0	0	0	0	0	0	0	0	0	N/A	N/A	1488
Malaska, Mark RP TB	Free Agent	0.0	0	0	0	0	0	0	0	0	0	0	N/A	N/A	1489
Testa, Joe RP WAS	Free Agent	0.0	0	0	0	0	0	0	0	0	0	0	N/A	N/A	1496
Davidson, Dave RP BAL	Free Agent	0.0	0	0	0	0	0	0	0	0	0	0	N/A	N/A	1497
Macdonald, Mike RP TOR	Free Agent	0.0	0	0	0	0	0	0	0	0	0	0	N/A	N/A	1500
Gosling, Mike RP CLE	Free Agent	0.0	0	0	0	0	0	0	0	0	0	0	N/A	N/A	1504
Houston, Ryan RP ANA	Free Agent	0.0	0	0	0	0	0	0	0	0	0	0	N/A	N/A	1505
Mendoza, Tommy RP ANA	Free Agent	0.0	0	0	0	0	0	0	0	0	0	0	N/A	N/A	1508
Yates, Tyler RP PIT	Free Agent	0.0	0	0	0	0	0	0	0	0	0	0	N/A	N/A	1511
Campos, Machado RP NYM	Free Agent	0.0	0	0	0	0	0	0	0	0	0	0	N/A	N/A	1514
Marte, Jose RP ARI	Free Agent	0.0	0	0	0	0	0	0	0	0	0	0	N/A	N/A	1515
Oliveros, Lester RP DET	Free Agent	0.0	0	0	0	0	0	0	0	0	0	0	N/A	N/A	1520
Hennessey, Brad RP MIN	Free Agent	0.0	0	0	0	0	0	0	0	0	0	0	N/A	N/A	1526
Fossum, Casey RP CHC	Free Agent	0.0	0	0	0	0	0	0	0	0	0	0	N/A	N/A	1528
Cavazos, Andy RP NYM	Free Agent	0.0	0	0	0	0	0	0	0	0	0	0	N/A	N/A	1531
Pereira, Nick RP SF	Free Agent	0.0	0	0	0	0	0	0	0	0	0	0	N/A	N/A	1533
Vasquez, Luis RP LA	Free Agent	0.0	0	0	0	0	0	0	0	0	0	0	N/A	N/A	1535
Capellan, Jose F. RP HOU	Free Agent	0.0	0	0	0	0	0	0	0	0	0	0	N/A	N/A	1547
Gearrin, Cory RP ATL	Free Agent	0.0	0	0	0	0	0	0	0	0	0	0	N/A	N/A	1552
Rleal, Sendy RP BAL	Free Agent	0.0	0	0	0	0	0	0	0	0	0	0	N/A	N/A	1555
Hayes, Christopher RP KC	Free Agent	0.0	0	0	0	0	0	0	0	0	0	0	N/A	N/A	1558
Paulk, Robert RP NYM	Free Agent	0.0	0	0	0	0	0	0	0	0	0	0	N/A	N/A	1561
Newby, Kyler RP ARI	Free Agent	0.0	0	0	0	0	0	0	0	0	0	0	N/A	N/A	1566
Olson, Justin RP MIN	Free Agent	0.0	0	0	0	0	0	0	0	0	0	0	N/A	N/A	1569
Weis, Brad RP OAK	Free Agent	0.0	0	0	0	0	0	0	0	0	0	0	N/A	N/A	1570
Sanit, Amaury RP NYY	Free Agent	0.0	0	0	0	0	0	0	0	0	0	0	N/A	N/A	1573
Sarfate, Dennis RP BAL	Free Agent	0.0	0	0	0	0	0	0	0	0	0	0	N/A	N/A	1574
Sisco, Andrew RP NYY 	Free Agent	0.0	0	0	0	0	0	0	0	0	0	0	N/A	N/A	1576
Wayne, Justin RP FLA	Free Agent	0.0	0	0	0	0	0	0	0	0	0	0	N/A	N/A	1582
Gobble, Jimmy RP COL	Free Agent	0.0	0	0	0	0	0	0	0	0	0	0	N/A	N/A	1585
Hull, Eric RP SEA	Free Agent	0.0	0	0	0	0	0	0	0	0	0	0	N/A	N/A	1586
Salas, Marino RP PIT	Free Agent	0.0	0	0	0	0	0	0	0	0	0	0	N/A	N/A	1590
Julianel, Ben RP MIN	Free Agent	0.0	0	0	0	0	0	0	0	0	0	0	N/A	N/A	1595
Herges, Matt RP KC	Free Agent	0.0	0	0	0	0	0	0	0	0	0	0	N/A	N/A	1598
Blevins, Steven RP MIN	Free Agent	0.0	0	0	0	0	0	0	0	0	0	0	N/A	N/A	1599
De La Cruz, Frankie RP SD	Free Agent	0.0	0	0	0	0	0	0	0	0	0	0	N/A	N/A	1600
Mabeus, Chris RP MIL	Free Agent	0.0	0	0	0	0	0	0	0	0	0	0	N/A	N/A	1603
Glover, Gary RP FLA	Free Agent	0.0	0	0	0	0	0	0	0	0	0	0	N/A	N/A	1608
Malone, Christopher RP LA	Free Agent	0.0	0	0	0	0	0	0	0	0	0	0	N/A	N/A	1613
Howard, Ben RP BOS	Free Agent	0.0	0	0	0	0	0	0	0	0	0	0	N/A	N/A	1617
Dials, Zachary RP TOR	Free Agent	0.0	0	0	0	0	0	0	0	0	0	0	N/A	N/A	1619
Fahrner, Evan RP OAK	Free Agent	0.0	0	0	0	0	0	0	0	0	0	0	N/A	N/A	1622
Gonzalez, Aguido P CIN	Free Agent	0.0	0	0	0	0	0	0	0	0	0	0	N/A	N/A	1624
Aldridge, Richard RP ANA	Free Agent	0.0	0	0	0	0	0	0	0	0	0	0	N/A	N/A	1625
Booker, Chris RP WAS	Free Agent	0.0	0	0	0	0	0	0	0	0	0	0	N/A	N/A	1626
Gardner, Lee RP FLA	Free Agent	0.0	0	0	0	0	0	0	0	0	0	0	N/A	N/A	1627
Broadway, Lance RP TOR	Free Agent	0.0	0	0	0	0	0	0	0	0	0	0	N/A	N/A	1629
Register, Steven RP TOR	Free Agent	0.0	0	0	0	0	0	0	0	0	0	0	N/A	N/A	1630
Roberts, Kevin RP PIT	Free Agent	0.0	0	0	0	0	0	0	0	0	0	0	N/A	N/A	1634
Zarate, Mauro RP SD	Free Agent	0.0	0	0	0	0	0	0	0	0	0	0	N/A	N/A	1641
Traber, Billy RP BOS	Free Agent	0.0	0	0	0	0	0	0	0	0	0	0	N/A	N/A	1644
Colyer, Steve RP ATL	Free Agent	0.0	0	0	0	0	0	0	0	0	0	0	N/A	N/A	1649
Nunez, Vladimir RP ATL	Free Agent	0.0	0	0	0	0	0	0	0	0	0	0	N/A	N/A	1651
Phillips, P.J. RP ANA	Free Agent	0.0	0	0	0	0	0	0	0	0	0	0	N/A	N/A	1653
Bland, Nate RP ANA	Free Agent	0.0	0	0	0	0	0	0	0	0	0	0	N/A	N/A	1661
Wear, Gregory RP SEA	Free Agent	0.0	0	0	0	0	0	0	0	0	0	0	N/A	N/A	1663
Abreu, Winston RP TOR 	Free Agent	0.0	0	0	0	0	0	0	0	0	0	0	N/A	N/A	1665
Kennard, Jeff RP CHC	Free Agent	0.0	0	0	0	0	0	0	0	0	0	0	N/A	N/A	1666
Moreno, Anthony RP SF	Free Agent	0.0	0	0	0	0	0	0	0	0	0	0	N/A	N/A	1673
Wechsler, Justin RP ARI	Free Agent	0.0	0	0	0	0	0	0	0	0	0	0	N/A	N/A	1676
Spiehs, R.D. RP SEA	Free Agent	0.0	0	0	0	0	0	0	0	0	0	0	N/A	N/A	1677
DeMark, Mike RP SD	Free Agent	0.0	0	0	0	0	0	0	0	0	0	0	N/A	N/A	1680
Burke, Erick RP SD	Free Agent	0.0	0	0	0	0	0	0	0	0	0	0	N/A	N/A	1681
Yabu, Keiichi RP SF	Free Agent	0.0	0	0	0	0	0	0	0	0	0	0	N/A	N/A	1683
Baker, Craig RP COL	Free Agent	0.0	0	0	0	0	0	0	0	0	0	0	N/A	N/A	1685
Campbell, Matt RP KC	Free Agent	0.0	0	0	0	0	0	0	0	0	0	0	N/A	N/A	1687
Yates, Kyle RP TOR	Free Agent	0.0	0	0	0	0	0	0	0	0	0	0	N/A	N/A	1690
Herrera, Alex RP ATL	Free Agent	0.0	0	0	0	0	0	0	0	0	0	0	N/A	N/A	1693
Kobayashi, Masa RP CLE	Free Agent	0.0	0	0	0	0	0	0	0	0	0	0	N/A	N/A	1694
Schwimer, Michael P PHI	Free Agent	0.0	0	0	0	0	0	0	0	0	0	0	N/A	N/A	1695
Rodriguez, Eddy RP FLA	Free Agent	0.0	0	0	0	0	0	0	0	0	0	0	N/A	N/A	1696
Embry, Byron RP SEA	Free Agent	0.0	0	0	0	0	0	0	0	0	0	0	N/A	N/A	1697
Bass, Adam RP SD	Free Agent	0.0	0	0	0	0	0	0	0	0	0	0	N/A	N/A	1698
Barber, Scott RP ARI	Free Agent	0.0	0	0	0	0	0	0	0	0	0	0	N/A	N/A	1701
Corey, Bryan RP SD	Free Agent	0.0	0	0	0	0	0	0	0	0	0	0	N/A	N/A	1702
Diaz, Jose R. RP LA	Free Agent	0.0	0	0	0	0	0	0	0	0	0	0	N/A	N/A	1705
Bush, Paul RP ATL	Free Agent	0.0	0	0	0	0	0	0	0	0	0	0	N/A	N/A	1707
Alexander, Mark RP LA	Free Agent	0.0	0	0	0	0	0	0	0	0	0	0	N/A	N/A	1712
Ramirez, Santiago RP WAS	Free Agent	0.0	0	0	0	0	0	0	0	0	0	0	N/A	N/A	1714
Ennis, John RP PHI	Free Agent	0.0	0	0	0	0	0	0	0	0	0	0	N/A	N/A	1717
Stamler, Keith RP TEX	Free Agent	0.0	0	0	0	0	0	0	0	0	0	0	N/A	N/A	1718
Carmona, Ysmael RP ANA	Free Agent	0.0	0	0	0	0	0	0	0	0	0	0	N/A	N/A	1722
Bayliss, Jonah RP TOR 	Free Agent	0.0	0	0	0	0	0	0	0	0	0	0	N/A	N/A	1727
Nestor, Scott RP PHI	Free Agent	0.0	0	0	0	0	0	0	0	0	0	0	N/A	N/A	1738
Pullin, Aaron RP ANA	Free Agent	0.0	0	0	0	0	0	0	0	0	0	0	N/A	N/A	1745
McClung, Seth RP TEX	Free Agent	0.0	0	0	0	0	0	0	0	0	0	0	N/A	N/A	1746
Pugliese, Nick RP ANA	Free Agent	0.0	0	0	0	0	0	0	0	0	0	0	N/A	N/A	1748
James, Craig RP SEA	Free Agent	0.0	0	0	0	0	0	0	0	0	0	0	N/A	N/A	1751
Bazzell, Shane RP TEX	Free Agent	0.0	0	0	0	0	0	0	0	0	0	0	N/A	N/A	1756
Petersen, Jeffrey RP SF	Free Agent	0.0	0	0	0	0	0	0	0	0	0	0	N/A	N/A	1758
Merritt, Roydrick RP NYM	Free Agent	0.0	0	0	0	0	0	0	0	0	0	0	N/A	N/A	1761
Roark, Tanner RP WAS	Free Agent	0.0	0	0	0	0	0	0	0	0	0	0	N/A	N/A	1763
Yourkin, Matt RP SF	Free Agent	0.0	0	0	0	0	0	0	0	0	0	0	N/A	N/A	1767
Quezada, Jackson RP SD	Free Agent	0.0	0	0	0	0	0	0	0	0	0	0	N/A	N/A	1775
Johnston, Andrew RP COL	Free Agent	0.0	0	0	0	0	0	0	0	0	0	0	N/A	N/A	1777
Bibens-Dirkx, Austin RP SEA	Free Agent	0.0	0	0	0	0	0	0	0	0	0	0	N/A	N/A	1779
Kenney, Michael RP ANA	Free Agent	0.0	0	0	0	0	0	0	0	0	0	0	N/A	N/A	1781
Vasquez, Carlos RP FLA	Free Agent	0.0	0	0	0	0	0	0	0	0	0	0	N/A	N/A	1784
Vaclavik, Justin RP PIT	Free Agent	0.0	0	0	0	0	0	0	0	0	0	0	N/A	N/A	1785
Robertson, Connor RP NYM	Free Agent	0.0	0	0	0	0	0	0	0	0	0	0	N/A	N/A	1792
Hamulack, Tim RP KC	Free Agent	0.0	0	0	0	0	0	0	0	0	0	0	N/A	N/A	1793
Steele, Mike RP SEA	Free Agent	0.0	0	0	0	0	0	0	0	0	0	0	N/A	N/A	1794
Keefer, Ryan RP BAL	Free Agent	0.0	0	0	0	0	0	0	0	0	0	0	N/A	N/A	1797
Villacis, Eduardo E. RP CHW	Free Agent	0.0	0	0	0	0	0	0	0	0	0	0	N/A	N/A	1801
Gordon, Brian RP PHI	Free Agent	0.0	0	0	0	0	0	0	0	0	0	0	N/A	N/A	1804
Adkins, James RP LA	Free Agent	0.0	0	0	0	0	0	0	0	0	0	0	N/A	N/A	1806
Walrond, Les RP TOR	Free Agent	0.0	0	0	0	0	0	0	0	0	0	0	N/A	N/A	1809
Valdez, Jose A. RP NYY	Free Agent	0.0	0	0	0	0	0	0	0	0	0	0	N/A	N/A	1810
Zell, Danny RP DET	Free Agent	0.0	0	0	0	0	0	0	0	0	0	0	N/A	N/A	1814
Estrada, Jesus RP CHC	Free Agent	0.0	0	0	0	0	0	0	0	0	0	0	N/A	N/A	1822
Schoening, Brent RP MIN	Free Agent	0.0	0	0	0	0	0	0	0	0	0	0	N/A	N/A	1823
Hill, Jeremy RP ANA	Free Agent	0.0	0	0	0	0	0	0	0	0	0	0	N/A	N/A	1826
Thorne, Jeremy RP ANA	Free Agent	0.0	0	0	0	0	0	0	0	0	0	0	N/A	N/A	1829
Bauer, Rick RP COL	Free Agent	0.0	0	0	0	0	0	0	0	0	0	0	N/A	N/A	1831
Sullivan, Brad RP OAK	Free Agent	0.0	0	0	0	0	0	0	0	0	0	0	N/A	N/A	1833
Garr, Brennan RP TEX	Free Agent	0.0	0	0	0	0	0	0	0	0	0	0	N/A	N/A	1841
Bright, Adam J. RP COL	Free Agent	0.0	0	0	0	0	0	0	0	0	0	0	N/A	N/A	1842
Cassel, Justin RP CHW	Free Agent	0.0	0	0	0	0	0	0	0	0	0	0	N/A	N/A	1846
Minix, Travis RP PHI	Free Agent	0.0	0	0	0	0	0	0	0	0	0	0	N/A	N/A	1851
Blanco, Ivan RP SEA	Free Agent	0.0	0	0	0	0	0	0	0	0	0	0	N/A	N/A	1859
McNabb, Tim RP NYM	Free Agent	0.0	0	0	0	0	0	0	0	0	0	0	N/A	N/A	1862
Pino, Yohan RP CLE	Free Agent	0.0	0	0	0	0	0	0	0	0	0	0	N/A	N/A	1863
Gissell, Chris RP COL	Free Agent	0.0	0	0	0	0	0	0	0	0	0	0	N/A	N/A	1865
Adams, Mike T. RP CLE	Free Agent	0.0	0	0	0	0	0	0	0	0	0	0	N/A	N/A	1866
Stewart, Cory RP PIT	Free Agent	0.0	0	0	0	0	0	0	0	0	0	0	N/A	N/A	1868
Tavarez, Julian RP WAS	Free Agent	0.0	0	0	0	0	0	0	0	0	0	0	N/A	N/A	1872
Molldrem, Craig RP FLA	Free Agent	0.0	0	0	0	0	0	0	0	0	0	0	N/A	N/A	1874
de los Santos, Richard RP TB	Free Agent	0.0	0	0	0	0	0	0	0	0	0	0	N/A	N/A	1877
Reed, Evan RP FLA	Free Agent	0.0	0	0	0	0	0	0	0	0	0	0	N/A	N/A	1879
Santiago, Jose RP NYM	Free Agent	0.0	0	0	0	0	0	0	0	0	0	0	N/A	N/A	1881
Reid, Justin RP PIT	Free Agent	0.0	0	0	0	0	0	0	0	0	0	0	N/A	N/A	1890
Arakawa, Yusuke RP COL	Free Agent	0.0	0	0	0	0	0	0	0	0	0	0	N/A	N/A	1896
Percival, Troy RP TB	Free Agent	0.0	0	0	0	0	0	0	0	0	0	0	N/A	N/A	1899
Bukvich, Ryan RP BAL	Free Agent	0.0	0	0	0	0	0	0	0	0	0	0	N/A	N/A	1900
Pennington, Todd RP CLE	Free Agent	0.0	0	0	0	0	0	0	0	0	0	0	N/A	N/A	1903
Plexico, Gerald RP WAS	Free Agent	0.0	0	0	0	0	0	0	0	0	0	0	N/A	N/A	1906
Payano, Nelson RP KC	Free Agent	0.0	0	0	0	0	0	0	0	0	0	0	N/A	N/A	1907
Smoker, Josh RP WAS	Free Agent	0.0	0	0	0	0	0	0	0	0	0	0	N/A	N/A	1913
Romero, Davis RP TOR	Free Agent	0.0	0	0	0	0	0	0	0	0	0	0	N/A	N/A	1915
Wilhite, Matt RP ANA	Free Agent	0.0	0	0	0	0	0	0	0	0	0	0	N/A	N/A	1916
Squires, Matt RP PHI	Free Agent	0.0	0	0	0	0	0	0	0	0	0	0	N/A	N/A	1921
Hefner, Jeremy P SD	Free Agent	0.0	0	0	0	0	0	0	0	0	0	0	N/A	N/A	1924
Bonilla, Henry RP ANA	Free Agent	0.0	0	0	0	0	0	0	0	0	0	0	N/A	N/A	1931
Hamman, Corey RP PIT	Free Agent	0.0	0	0	0	0	0	0	0	0	0	0	N/A	N/A	1934
Hill, Nick RP SEA	Free Agent	0.0	0	0	0	0	0	0	0	0	0	0	N/A	N/A	1937
Alvarez, Manny RP NYM	Free Agent	0.0	0	0	0	0	0	0	0	0	0	0	N/A	N/A	1945
Martinez, Edgar R. RP LA	Free Agent	0.0	0	0	0	0	0	0	0	0	0	0	N/A	N/A	1951
Lowery, Devon RP KC	Free Agent	0.0	0	0	0	0	0	0	0	0	0	0	N/A	N/A	1952
Rakers, Aaron J. RP HOU	Free Agent	0.0	0	0	0	0	0	0	0	0	0	0	N/A	N/A	1953
Woodyard, Mark RP DET	Free Agent	0.0	0	0	0	0	0	0	0	0	0	0	N/A	N/A	1954
Fruto, Emiliano RP ATL	Free Agent	0.0	0	0	0	0	0	0	0	0	0	0	N/A	N/A	1957
Baez, Federico RP CIN	Free Agent	0.0	0	0	0	0	0	0	0	0	0	0	N/A	N/A	1958
Garcia, Jose L. RP OAK	Free Agent	0.0	0	0	0	0	0	0	0	0	0	0	N/A	N/A	1959
Flores, Jose RP SEA 	Free Agent	0.0	0	0	0	0	0	0	0	0	0	0	N/A	N/A	1960
Quinonez, Rudolph RP ATL	Free Agent	0.0	0	0	0	0	0	0	0	0	0	0	N/A	N/A	1964
Tomey, Anthony RP DET	Free Agent	0.0	0	0	0	0	0	0	0	0	0	0	N/A	N/A	1970
Vaquedano, Jose RP BOS	Free Agent	0.0	0	0	0	0	0	0	0	0	0	0	N/A	N/A	1971
Rusch, Glendon RP COL	Free Agent	0.0	0	0	0	0	0	0	0	0	0	0	N/A	N/A	1972
Jackson, Kyle RP BOS	Free Agent	0.0	0	0	0	0	0	0	0	0	0	0	N/A	N/A	1976
Woods, Jake RP PHI	Free Agent	0.0	0	0	0	0	0	0	0	0	0	0	N/A	N/A	1978
