Iglesias, Jose SS BOS	Free Agent	0	0	0	0	0	0	0	0	0	0	0	0	0.0000	0.0000	0.0000	3195
Contreras, Anthony SS SD	Free Agent	0	0	0	0	0	0	0	0	0	0	0	0	0.0000	0.0000	0.0000	3211
Leahy, Ryan SS ANA	Free Agent	0	0	0	0	0	0	0	0	0	0	0	0	0.0000	0.0000	0.0000	3217
Ciriaco, Juan SS SF	Free Agent	0	0	0	0	0	0	0	0	0	0	0	0	0.0000	0.0000	0.0000	3227
Gutierrez, Christopher SS TOR	Free Agent	0	0	0	0	0	0	0	0	0	0	0	0	0.0000	0.0000	0.0000	3237
Boyer, Kyle SS CHC	Free Agent	0	0	0	0	0	0	0	0	0	0	0	0	0.0000	0.0000	0.0000	3238
Chiang, Chih-Hsien SS BOS	Free Agent	0	0	0	0	0	0	0	0	0	0	0	0	0.0000	0.0000	0.0000	3256
Tweedy, Jason SS TB	Free Agent	0	0	0	0	0	0	0	0	0	0	0	0	0.0000	0.0000	0.0000	3264
Wayment, Kory SS OAK	Free Agent	0	0	0	0	0	0	0	0	0	0	0	0	0.0000	0.0000	0.0000	3296
Rivero, Carlos SS PHI 	Free Agent	0	0	0	0	0	0	0	0	0	0	0	0	0.0000	0.0000	0.0000	3303
Fuller, Justin SS CHW	Free Agent	0	0	0	0	0	0	0	0	0	0	0	0	0.0000	0.0000	0.0000	3308
Rivera, Luis A. SS NYM	Free Agent	0	0	0	0	0	0	0	0	0	0	0	0	0.0000	0.0000	0.0000	3315
Marte, Victor SS CHW	Free Agent	0	0	0	0	0	0	0	0	0	0	0	0	0.0000	0.0000	0.0000	3324
Ciriaco, Audy SS DET	Free Agent	0	0	0	0	0	0	0	0	0	0	0	0	0.0000	0.0000	0.0000	3325
Cannizaro, Andy SS CHW	Free Agent	0	0	0	0	0	0	0	0	0	0	0	0	0.0000	0.0000	0.0000	3327
Martinez, Jose G. SS STL	Free Agent	0	0	0	0	0	0	0	0	0	0	0	0	0.0000	0.0000	0.0000	3334
Alvarez, Victor R. SS PIT	Free Agent	0	0	0	0	0	0	0	0	0	0	0	0	0.0000	0.0000	0.0000	3344
Pastornicky, Tyler SS ATL	Free Agent	0	0	0	0	0	0	0	0	0	0	0	0	0.0000	0.0000	0.0000	3348
Chaves, Brandon SS CLE	Free Agent	0	0	0	0	0	0	0	0	0	0	0	0	0.0000	0.0000	0.0000	3352
Harbin, Taylor SS ARI	Free Agent	0	0	0	0	0	0	0	0	0	0	0	0	0.0000	0.0000	0.0000	3369
Boran, Pat SS BOS	Free Agent	0	0	0	0	0	0	0	0	0	0	0	0	0.0000	0.0000	0.0000	3386
Ciofrone, Peter SS SD	Free Agent	0	0	0	0	0	0	0	0	0	0	0	0	0.0000	0.0000	0.0000	3390
Jones, Mycal SS ATL	Free Agent	0	0	0	0	0	0	0	0	0	0	0	0	0.0000	0.0000	0.0000	3409
Torres, Eider SS COL	Free Agent	0	0	0	0	0	0	0	0	0	0	0	0	0.0000	0.0000	0.0000	3418
Garcia, Leury SS TEX	Free Agent	0	0	0	0	0	0	0	0	0	0	0	0	0.0000	0.0000	0.0000	3434
Oxendine, Matthew SS ARI	Free Agent	0	0	0	0	0	0	0	0	0	0	0	0	0.0000	0.0000	0.0000	3441
Ott, Louis SS DET	Free Agent	0	0	0	0	0	0	0	0	0	0	0	0	0.0000	0.0000	0.0000	3442
Mattingly, Preston SS LA	Free Agent	0	0	0	0	0	0	0	0	0	0	0	0	0.0000	0.0000	0.0000	3449
Machado, Manny SS BAL	Free Agent	0	0	0	0	0	0	0	0	0	0	0	0	0.0000	0.0000	0.0000	3453
Johnston, Dylan SS CHC	Free Agent	0	0	0	0	0	0	0	0	0	0	0	0	0.0000	0.0000	0.0000	3461
Chavez, Ozzie SS PHI	Free Agent	0	0	0	0	0	0	0	0	0	0	0	0	0.0000	0.0000	0.0000	3467
Brewer, Brent SS MIL	Free Agent	0	0	0	0	0	0	0	0	0	0	0	0	0.0000	0.0000	0.0000	3481
Prince, Joshua SS MIL	Free Agent	0	0	0	0	0	0	0	0	0	0	0	0	0.0000	0.0000	0.0000	3492
Kozma, Pete SS STL	Free Agent	0	0	0	0	0	0	0	0	0	0	0	0	0.0000	0.0000	0.0000	3508
De Los Santos, Estarlin SS MIN	Free Agent	0	0	0	0	0	0	0	0	0	0	0	0	0.0000	0.0000	0.0000	3522
Crew, Ryan SS MIL	Free Agent	0	0	0	0	0	0	0	0	0	0	0	0	0.0000	0.0000	0.0000	3543
Rivas, Luis SS CHC	Free Agent	0	0	0	0	0	0	0	0	0	0	0	0	0.0000	0.0000	0.0000	3550
Sanchez, Yunesky SS ARI	Free Agent	0	0	0	0	0	0	0	0	0	0	0	0	0.0000	0.0000	0.0000	3561
Crawford, Brandon SS SF	Free Agent	0	0	0	0	0	0	0	0	0	0	0	0	0.0000	0.0000	0.0000	3591
Cosby, Rob SS HOU	Free Agent	0	0	0	0	0	0	0	0	0	0	0	0	0.0000	0.0000	0.0000	3611
Tiburcio, Hector SS CIN	Free Agent	0	0	0	0	0	0	0	0	0	0	0	0	0.0000	0.0000	0.0000	3637
De Leon, Santo SS DET	Free Agent	0	0	0	0	0	0	0	0	0	0	0	0	0.0000	0.0000	0.0000	3643
Meyer, Drew SS ANA	Free Agent	0	0	0	0	0	0	0	0	0	0	0	0	0.0000	0.0000	0.0000	3665
Feiner, Kevyn SS CIN	Free Agent	0	0	0	0	0	0	0	0	0	0	0	0	0.0000	0.0000	0.0000	3669
Schwartzbauer, Daniel SS PIT	Free Agent	0	0	0	0	0	0	0	0	0	0	0	0	0.0000	0.0000	0.0000	3670
De La Rosa, Jairo SS TB	Free Agent	0	0	0	0	0	0	0	0	0	0	0	0	0.0000	0.0000	0.0000	3671
Palacios, Luis SS DET	Free Agent	0	0	0	0	0	0	0	0	0	0	0	0	0.0000	0.0000	0.0000	3673
Velazquez, Gil A. SS BOS	Free Agent	0	0	0	0	0	0	0	0	0	0	0	0	0.0000	0.0000	0.0000	3674
Field, Thomas SS COL	Free Agent	0	0	0	0	0	0	0	0	0	0	0	0	0.0000	0.0000	0.0000	3678
Angelini, Carmen SS NYY	Free Agent	0	0	0	0	0	0	0	0	0	0	0	0	0.0000	0.0000	0.0000	3702
Anna, Dean SS SD	Free Agent	0	0	0	0	0	0	0	0	0	0	0	0	0.0000	0.0000	0.0000	3705
Bass, Bryan SS BAL	Free Agent	0	0	0	0	0	0	0	0	0	0	0	0	0.0000	0.0000	0.0000	3723
Cumberland, Andrew SS SD	Free Agent	0	0	0	0	0	0	0	0	0	0	0	0	0.0000	0.0000	0.0000	3724
Bynum, Freddie SS CHW	Free Agent	0	0	0	0	0	0	0	0	0	0	0	0	0.0000	0.0000	0.0000	3736
Rogers, Ed SS ARI	Free Agent	0	0	0	0	0	0	0	0	0	0	0	0	0.0000	0.0000	0.0000	3762
Perez, Darwin SS ANA	Free Agent	0	0	0	0	0	0	0	0	0	0	0	0	0.0000	0.0000	0.0000	3767
Goelz, Jim SS FLA	Free Agent	0	0	0	0	0	0	0	0	0	0	0	0	0.0000	0.0000	0.0000	3768
Adrianza, Ehire SS SF	Free Agent	0	0	0	0	0	0	0	0	0	0	0	0	0.0000	0.0000	0.0000	3787
Colon, Christian SS KC	Free Agent	0	0	0	0	0	0	0	0	0	0	0	0	0.0000	0.0000	0.0000	3819
Ortiz, Yancarlos SS MIN	Free Agent	0	0	0	0	0	0	0	0	0	0	0	0	0.0000	0.0000	0.0000	3838
Weems, Beamer SS SD	Free Agent	0	0	0	0	0	0	0	0	0	0	0	0	0.0000	0.0000	0.0000	3851
Whiteman, Tommy SS HOU	Free Agent	0	0	0	0	0	0	0	0	0	0	0	0	0.0000	0.0000	0.0000	3857
Maruszak, Addison SS NYY	Free Agent	0	0	0	0	0	0	0	0	0	0	0	0	0.0000	0.0000	0.0000	3858
Lampe, Rayon SS SEA	Free Agent	0	0	0	0	0	0	0	0	0	0	0	0	0.0000	0.0000	0.0000	3864
Suarez, Ignacio SS BOS	Free Agent	0	0	0	0	0	0	0	0	0	0	0	0	0.0000	0.0000	0.0000	3921
Dorta, Melvin SS PIT	Free Agent	0	0	0	0	0	0	0	0	0	0	0	0	0.0000	0.0000	0.0000	3949
Niles, Drew SS FLA	Free Agent	0	0	0	0	0	0	0	0	0	0	0	0	0.0000	0.0000	0.0000	3951
Taylor, J.R. SS MIN	Free Agent	0	0	0	0	0	0	0	0	0	0	0	0	0.0000	0.0000	0.0000	3961
Coronado, Jose SS NYM	Free Agent	0	0	0	0	0	0	0	0	0	0	0	0	0.0000	0.0000	0.0000	3967
Garcia, Joantoni SS BOS	Free Agent	0	0	0	0	0	0	0	0	0	0	0	0	0.0000	0.0000	0.0000	3991
Douglas, Brandon SS DET	Free Agent	0	0	0	0	0	0	0	0	0	0	0	0	0.0000	0.0000	0.0000	4022
Vallejo, Jose SS HOU	Free Agent	0	0	0	0	0	0	0	0	0	0	0	0	0.0000	0.0000	0.0000	4039
Figueroa, Correy SS SD	Free Agent	0	0	0	0	0	0	0	0	0	0	0	0	0.0000	0.0000	0.0000	4073
Fulton, Jon SS FLA	Free Agent	0	0	0	0	0	0	0	0	0	0	0	0	0.0000	0.0000	0.0000	4120
Borowiak, Zach SS BOS	Free Agent	0	0	0	0	0	0	0	0	0	0	0	0	0.0000	0.0000	0.0000	4134
Emaus, Brad SS NYM 	Free Agent	0	0	0	0	0	0	0	0	0	0	0	0	0.0000	0.0000	0.0000	4144
Havens, Reese SS NYM	Free Agent	0	0	0	0	0	0	0	0	0	0	0	0	0.0000	0.0000	0.0000	4157
Culver, Cito SS NYY	Free Agent	0	0	0	0	0	0	0	0	0	0	0	0	0.0000	0.0000	0.0000	4166
Wald, Jake SS ARI	Free Agent	0	0	0	0	0	0	0	0	0	0	0	0	0.0000	0.0000	0.0000	4172
Rojas, Miguel SS CIN	Free Agent	0	0	0	0	0	0	0	0	0	0	0	0	0.0000	0.0000	0.0000	4174
Spearman, Jemel SS CHC	Free Agent	0	0	0	0	0	0	0	0	0	0	0	0	0.0000	0.0000	0.0000	4188
Keough, Shane SS OAK	Free Agent	0	0	0	0	0	0	0	0	0	0	0	0	0.0000	0.0000	0.0000	4192
Seratelli, Anthony SS KC	Free Agent	0	0	0	0	0	0	0	0	0	0	0	0	0.0000	0.0000	0.0000	4198
Robinson, Wade SS HOU	Free Agent	0	0	0	0	0	0	0	0	0	0	0	0	0.0000	0.0000	0.0000	4201
Lemon, Marcus SS TEX	Free Agent	0	0	0	0	0	0	0	0	0	0	0	0	0.0000	0.0000	0.0000	4214
Alvarez, Carlos SS WAS	Free Agent	0	0	0	0	0	0	0	0	0	0	0	0	0.0000	0.0000	0.0000	4217
Tejeda, Oscar SS BOS	Free Agent	0	0	0	0	0	0	0	0	0	0	0	0	0.0000	0.0000	0.0000	4228
Diaz, Jonathan SS TOR	Free Agent	0	0	0	0	0	0	0	0	0	0	0	0	0.0000	0.0000	0.0000	4231
Maniscalco, Matthew SS TB	Free Agent	0	0	0	0	0	0	0	0	0	0	0	0	0.0000	0.0000	0.0000	4240
Diaz, Juan H. SS CLE	Free Agent	0	0	0	0	0	0	0	0	0	0	0	0	0.0000	0.0000	0.0000	4254
