Schoening, Brent RP MIN	-	Free Agent	0.0	0	0	0	0	0	0	0	0	0	0	N/A	N/A	1918
Hill, Jeremy RP LAA	-	Free Agent	0.0	0	0	0	0	0	0	0	0	0	0	N/A	N/A	1921
Thorne, Jeremy RP LAA	-	Free Agent	0.0	0	0	0	0	0	0	0	0	0	0	N/A	N/A	1924
Bauer, Rick RP COL	-	Free Agent	0.0	0	0	0	0	0	0	0	0	0	0	N/A	N/A	1926
Sullivan, Brad RP OAK	-	Free Agent	0.0	0	0	0	0	0	0	0	0	0	0	N/A	N/A	1928
Pfeiffer, David P LAD	-	Free Agent	0.0	0	0	0	0	0	0	0	0	0	0	N/A	N/A	1931
Fernandes, Kyle P BOS	-	Free Agent	0.0	0	0	0	0	0	0	0	0	0	0	N/A	N/A	1933
Garr, Brennan RP TEX	-	Free Agent	0.0	0	0	0	0	0	0	0	0	0	0	N/A	N/A	1938
Bright, Adam J. RP COL	-	Free Agent	0.0	0	0	0	0	0	0	0	0	0	0	N/A	N/A	1939
Cassel, Justin RP CHW	-	Free Agent	0.0	0	0	0	0	0	0	0	0	0	0	N/A	N/A	1943
Minix, Travis RP PHI	-	Free Agent	0.0	0	0	0	0	0	0	0	0	0	0	N/A	N/A	1948
Richard, Steven RP SEA	-	Free Agent	0.0	0	0	0	0	0	0	0	0	0	0	N/A	N/A	1950
Blanco, Ivan RP SEA	-	Free Agent	0.0	0	0	0	0	0	0	0	0	0	0	N/A	N/A	1957
McNabb, Tim RP NYM	-	Free Agent	0.0	0	0	0	0	0	0	0	0	0	0	N/A	N/A	1960
Pino, Yohan RP CLE	-	Free Agent	0.0	0	0	0	0	0	0	0	0	0	0	N/A	N/A	1961
Gissell, Chris RP COL	-	Free Agent	0.0	0	0	0	0	0	0	0	0	0	0	N/A	N/A	1963
Adams, Mike T. RP CLE	-	Free Agent	0.0	0	0	0	0	0	0	0	0	0	0	N/A	N/A	1964
Stewart, Cory RP PIT	-	Free Agent	0.0	0	0	0	0	0	0	0	0	0	0	N/A	N/A	1966
Moehler, Brian RP HOU	-	Free Agent	0.0	0	0	0	0	0	0	0	0	0	0	N/A	N/A	1968
Tavarez, Julian RP WAS	-	Free Agent	0.0	0	0	0	0	0	0	0	0	0	0	N/A	N/A	1971
Englebrook, Evan RP HOU	-	Free Agent	0.0	0	0	0	0	0	0	0	0	0	0	N/A	N/A	1974
Molldrem, Craig RP MIA	-	Free Agent	0.0	0	0	0	0	0	0	0	0	0	0	N/A	N/A	1975
de los Santos, Richard RP TB	-	Free Agent	0.0	0	0	0	0	0	0	0	0	0	0	N/A	N/A	1979
Santiago, Jose RP NYM	-	Free Agent	0.0	0	0	0	0	0	0	0	0	0	0	N/A	N/A	1982
Reid, Justin RP PIT	-	Free Agent	0.0	0	0	0	0	0	0	0	0	0	0	N/A	N/A	1990
Loop, Derrick P PHI	-	Free Agent	0.0	0	0	0	0	0	0	0	0	0	0	N/A	N/A	1995
Arakawa, Yusuke RP COL	-	Free Agent	0.0	0	0	0	0	0	0	0	0	0	0	N/A	N/A	1997
Percival, Troy RP TB	-	Free Agent	0.0	0	0	0	0	0	0	0	0	0	0	N/A	N/A	2002
Bukvich, Ryan RP BAL	-	Free Agent	0.0	0	0	0	0	0	0	0	0	0	0	N/A	N/A	2003
Smith, Chris RP SEA	-	Free Agent	0.0	0	0	0	0	0	0	0	0	0	0	N/A	N/A	2005
Pennington, Todd RP CLE	-	Free Agent	0.0	0	0	0	0	0	0	0	0	0	0	N/A	N/A	2009
Schenk, Neil P TB	-	Free Agent	0.0	0	0	0	0	0	0	0	0	0	0	N/A	N/A	2010
Plexico, Gerald RP WAS	-	Free Agent	0.0	0	0	0	0	0	0	0	0	0	0	N/A	N/A	2013
Payano, Nelson RP KC	-	Free Agent	0.0	0	0	0	0	0	0	0	0	0	0	N/A	N/A	2014
Downs, Darin RP MIA	-	Free Agent	0.0	0	0	0	0	0	0	0	0	0	0	N/A	N/A	2015
Smoker, Josh RP WAS	-	Free Agent	0.0	0	0	0	0	0	0	0	0	0	0	N/A	N/A	2022
Romero, Davis RP TOR	-	Free Agent	0.0	0	0	0	0	0	0	0	0	0	0	N/A	N/A	2024
Wilhite, Matt RP LAA	-	Free Agent	0.0	0	0	0	0	0	0	0	0	0	0	N/A	N/A	2025
Thomas, Justin RP BOS	-	Free Agent	0.0	0	0	0	0	0	0	0	0	0	0	N/A	N/A	2027
Squires, Matt RP PHI	-	Free Agent	0.0	0	0	0	0	0	0	0	0	0	0	N/A	N/A	2032
Freeman, Sam RP STL	-	Free Agent	0.0	0	0	0	0	0	0	0	0	0	0	N/A	N/A	2034
Bowers, Cedrick RP OAK	-	Free Agent	0.0	0	0	0	0	0	0	0	0	0	0	N/A	N/A	2037
Bonilla, Henry RP LAA	-	Free Agent	0.0	0	0	0	0	0	0	0	0	0	0	N/A	N/A	2042
Hamman, Corey RP PIT	-	Free Agent	0.0	0	0	0	0	0	0	0	0	0	0	N/A	N/A	2044
Hill, Nick RP SEA	-	Free Agent	0.0	0	0	0	0	0	0	0	0	0	0	N/A	N/A	2048
Beckman, Ryan P PIT	-	Free Agent	0.0	0	0	0	0	0	0	0	0	0	0	N/A	N/A	2055
Boxberger, Bradley P CIN 	-	Free Agent	0.0	0	0	0	0	0	0	0	0	0	0	N/A	N/A	2060
Martinez, Edgar R. RP LAD	-	Free Agent	0.0	0	0	0	0	0	0	0	0	0	0	N/A	N/A	2066
Lowery, Devon RP KC	-	Free Agent	0.0	0	0	0	0	0	0	0	0	0	0	N/A	N/A	2067
Anderson, Tyler P COL	-	Free Agent	0.0	0	0	0	0	0	0	0	0	0	0	N/A	N/A	2068
Rakers, Aaron J. RP HOU	-	Free Agent	0.0	0	0	0	0	0	0	0	0	0	0	N/A	N/A	2069
Woodyard, Mark RP DET	-	Free Agent	0.0	0	0	0	0	0	0	0	0	0	0	N/A	N/A	2070
Strickland, Scott RP MIA	-	Free Agent	0.0	0	0	0	0	0	0	0	0	0	0	N/A	N/A	2072
Fruto, Emiliano RP ATL	-	Free Agent	0.0	0	0	0	0	0	0	0	0	0	0	N/A	N/A	2074
Baez, Federico RP CIN	-	Free Agent	0.0	0	0	0	0	0	0	0	0	0	0	N/A	N/A	2075
Garcia, Jose L. RP OAK	-	Free Agent	0.0	0	0	0	0	0	0	0	0	0	0	N/A	N/A	2076
Flores, Jose RP CLE	-	Free Agent	0.0	0	0	0	0	0	0	0	0	0	0	N/A	N/A	2078
Quinonez, Rudolph RP ATL	-	Free Agent	0.0	0	0	0	0	0	0	0	0	0	0	N/A	N/A	2080
Tomey, Anthony RP DET	-	Free Agent	0.0	0	0	0	0	0	0	0	0	0	0	N/A	N/A	2087
Vaquedano, Jose RP BOS	-	Free Agent	0.0	0	0	0	0	0	0	0	0	0	0	N/A	N/A	2088
Santeliz, Clevelan RP BOS	-	Free Agent	0.0	0	0	0	0	0	0	0	0	0	0	N/A	N/A	2089
Hampton, Mike RP ARI	-	Free Agent	0.0	0	0	0	0	0	0	0	0	0	0	N/A	N/A	2090
Rusch, Glendon RP COL	-	Free Agent	0.0	0	0	0	0	0	0	0	0	0	0	N/A	N/A	2091
Jackson, Kyle RP BOS	-	Free Agent	0.0	0	0	0	0	0	0	0	0	0	0	N/A	N/A	2094
Woods, Jake RP PHI	-	Free Agent	0.0	0	0	0	0	0	0	0	0	0	0	N/A	N/A	2096
Hovis, Jonathan RP NYY	-	Free Agent	0.0	0	0	0	0	0	0	0	0	0	0	N/A	N/A	2101
Flores, Randy RP SD	-	Free Agent	0.0	0	0	0	0	0	0	0	0	0	0	N/A	N/A	2102
Geary, Geoff RP LAD	-	Free Agent	0.0	0	0	0	0	0	0	0	0	0	0	N/A	N/A	2105
Hunton, Jon RP OAK	-	Free Agent	0.0	0	0	0	0	0	0	0	0	0	0	N/A	N/A	2106
Cave, Kevin RP MIA	-	Free Agent	0.0	0	0	0	0	0	0	0	0	0	0	N/A	N/A	2115
Britton, Chris RP SD	-	Free Agent	0.0	0	0	0	0	0	0	0	0	0	0	N/A	N/A	2117
Morlan, Eduardo RP TB	-	Free Agent	0.0	0	0	0	0	0	0	0	0	0	0	N/A	N/A	2119
Zumwalt, Alec RP MIL	-	Free Agent	0.0	0	0	0	0	0	0	0	0	0	0	N/A	N/A	2124
Wilson, Kris RP PHI	-	Free Agent	0.0	0	0	0	0	0	0	0	0	0	0	N/A	N/A	2135
Manon, Julio RP OAK	-	Free Agent	0.0	0	0	0	0	0	0	0	0	0	0	N/A	N/A	2146
Gast, John P STL	-	Free Agent	0.0	0	0	0	0	0	0	0	0	0	0	N/A	N/A	2147
McConnell, Sam RP ATL	-	Free Agent	0.0	0	0	0	0	0	0	0	0	0	0	N/A	N/A	2148
Saenz, Chris RP MIL	-	Free Agent	0.0	0	0	0	0	0	0	0	0	0	0	N/A	N/A	2153
Currin, Patrick RP OAK	-	Free Agent	0.0	0	0	0	0	0	0	0	0	0	0	N/A	N/A	2162
Whisler, Wesley RP CHW	-	Free Agent	0.0	0	0	0	0	0	0	0	0	0	0	N/A	N/A	2163
Voyles, Brad RP MIN	-	Free Agent	0.0	0	0	0	0	0	0	0	0	0	0	N/A	N/A	2171
Avery, Matthew RP WAS	-	Free Agent	0.0	0	0	0	0	0	0	0	0	0	0	N/A	N/A	2174
Pichardo, Kelvin RP SF	-	Free Agent	0.0	0	0	0	0	0	0	0	0	0	0	N/A	N/A	2175
Portice, Eammon P BOS	-	Free Agent	0.0	0	0	0	0	0	0	0	0	0	0	N/A	N/A	2177
Hoffman, Trevor RP MIL	-	Free Agent	0.0	0	0	0	0	0	0	0	0	0	0	N/A	N/A	2178
Curtis, Dan RP ATL	-	Free Agent	0.0	0	0	0	0	0	0	0	0	0	0	N/A	N/A	2179
Omogrosso, Brian RP CHW	-	Free Agent	0.0	0	0	0	0	0	0	0	0	0	0	N/A	N/A	2180
Bellamy, Kyle RP CHW	-	Free Agent	0.0	0	0	0	0	0	0	0	0	0	0	N/A	N/A	2188
Howard, Adam RP ARI	-	Free Agent	0.0	0	0	0	0	0	0	0	0	0	0	N/A	N/A	2189
Hensley, Matt RP TOR	-	Free Agent	0.0	0	0	0	0	0	0	0	0	0	0	N/A	N/A	2193
Hurd, John RP CHW	-	Free Agent	0.0	0	0	0	0	0	0	0	0	0	0	N/A	N/A	2195
Dingman, Craig RP DET	-	Free Agent	0.0	0	0	0	0	0	0	0	0	0	0	N/A	N/A	2201
Sampson, Chris RP HOU	-	Free Agent	0.0	0	0	0	0	0	0	0	0	0	0	N/A	N/A	2206
Ormond, Rodney RP TOR	-	Free Agent	0.0	0	0	0	0	0	0	0	0	0	0	N/A	N/A	2218
Takahashi, Ken RP NYM	-	Free Agent	0.0	0	0	0	0	0	0	0	0	0	0	N/A	N/A	2219
Robbins, Jake RP CIN	-	Free Agent	0.0	0	0	0	0	0	0	0	0	0	0	N/A	N/A	2224
Gunderson, Kevin RP ATL	-	Free Agent	0.0	0	0	0	0	0	0	0	0	0	0	N/A	N/A	2230
De La Cruz, Julio RP KC	-	Free Agent	0.0	0	0	0	0	0	0	0	0	0	0	N/A	N/A	2231
Smith, Matt J. RP CHC	-	Free Agent	0.0	0	0	0	0	0	0	0	0	0	0	N/A	N/A	2232
Gonzalez, Luis E. RP SEA	-	Free Agent	0.0	0	0	0	0	0	0	0	0	0	0	N/A	N/A	2233
Speier, Justin RP COL	-	Free Agent	0.0	0	0	0	0	0	0	0	0	0	0	N/A	N/A	2235
Green, Matthew RP ARI	-	Free Agent	0.0	0	0	0	0	0	0	0	0	0	0	N/A	N/A	2239
Perdomo, Luis RP MIN	-	Free Agent	0.0	0	0	0	0	0	0	0	0	0	0	N/A	N/A	2240
Valenzuela, Sergio RP CIN	-	Free Agent	0.0	0	0	0	0	0	0	0	0	0	0	N/A	N/A	2243
Tankersley, Taylor RP NYM	-	Free Agent	0.0	0	0	0	0	0	0	0	0	0	0	N/A	N/A	2244
DePaula, Julio RP TB	-	Free Agent	0.0	0	0	0	0	0	0	0	0	0	0	N/A	N/A	2253
Manuel, Robert RP BOS	-	Free Agent	0.0	0	0	0	0	0	0	0	0	0	0	N/A	N/A	2256
Downs, Brodie RP SEA	-	Free Agent	0.0	0	0	0	0	0	0	0	0	0	0	N/A	N/A	2260
Klatt, Ryan RP SD	-	Free Agent	0.0	0	0	0	0	0	0	0	0	0	0	N/A	N/A	2267
Sanchez, Duaner RP SD	-	Free Agent	0.0	0	0	0	0	0	0	0	0	0	0	N/A	N/A	2274
Guevara, Carlos RP SD	-	Free Agent	0.0	0	0	0	0	0	0	0	0	0	0	N/A	N/A	2275
Mathis, Doug RP BOS 	-	Free Agent	0.0	0	0	0	0	0	0	0	0	0	0	N/A	N/A	2277
Miller, Ryne RP BOS	-	Free Agent	0.0	0	0	0	0	0	0	0	0	0	0	N/A	N/A	2279
Guzman, Angel RP LAD 	-	Free Agent	0.0	0	0	0	0	0	0	0	0	0	0	N/A	N/A	2283
Martin, Adrian RP SF	-	Free Agent	0.0	0	0	0	0	0	0	0	0	0	0	N/A	N/A	2286
Warden, Jim Ed RP WAS	-	Free Agent	0.0	0	0	0	0	0	0	0	0	0	0	N/A	N/A	2287
Wild, Jacob RP SEA	-	Free Agent	0.0	0	0	0	0	0	0	0	0	0	0	N/A	N/A	2288
Brunet, Michael RP SD	-	Free Agent	0.0	0	0	0	0	0	0	0	0	0	0	N/A	N/A	2292
Jan, Carlos RP BAL	-	Free Agent	0.0	0	0	0	0	0	0	0	0	0	0	N/A	N/A	2293
Ovalles, Juan RP CHW	-	Free Agent	0.0	0	0	0	0	0	0	0	0	0	0	N/A	N/A	2307
Mateo, Julio RP SF	-	Free Agent	0.0	0	0	0	0	0	0	0	0	0	0	N/A	N/A	2312
Muessig, Jeff RP OAK	-	Free Agent	0.0	0	0	0	0	0	0	0	0	0	0	N/A	N/A	2315
Ambriz, Hector RP CLE	-	Free Agent	0.0	0	0	0	0	0	0	0	0	0	0	N/A	N/A	2326
De La Vara, Gilbert RP CIN	-	Free Agent	0.0	0	0	0	0	0	0	0	0	0	0	N/A	N/A	2328
Delcarmen, Manny RP SEA	-	Free Agent	0.0	0	0	0	0	0	0	0	0	0	0	N/A	N/A	2333
White, Bill RP PHI	-	Free Agent	0.0	0	0	0	0	0	0	0	0	0	0	N/A	N/A	2336
Garcia, Rosman RP TEX	-	Free Agent	0.0	0	0	0	0	0	0	0	0	0	0	N/A	N/A	2337
Asencio, Miguel RP BOS	-	Free Agent	0.0	0	0	0	0	0	0	0	0	0	0	N/A	N/A	2338
Delgado, Jesus RP CIN	-	Free Agent	0.0	0	0	0	0	0	0	0	0	0	0	N/A	N/A	2339
Brewer, Charles P ARI	-	Free Agent	0.0	0	0	0	0	0	0	0	0	0	0	N/A	N/A	2341
Parrott, Rhett RP STL	-	Free Agent	0.0	0	0	0	0	0	0	0	0	0	0	N/A	N/A	2343
Ross, Joe P SD	-	Free Agent	0.0	0	0	0	0	0	0	0	0	0	0	N/A	N/A	2349
Spurling, Chris RP MIL	-	Free Agent	0.0	0	0	0	0	0	0	0	0	0	0	N/A	N/A	2350
Ellis, Jordan P PHI	-	Free Agent	0.0	0	0	0	0	0	0	0	0	0	0	N/A	N/A	2351
Cherry, Rocky RP SD	-	Free Agent	0.0	0	0	0	0	0	0	0	0	0	0	N/A	N/A	2357
Dowdy, Justin RP SF	-	Free Agent	0.0	0	0	0	0	0	0	0	0	0	0	N/A	N/A	2359
Baumann, George P KC	-	Free Agent	0.0	0	0	0	0	0	0	0	0	0	0	N/A	N/A	2362
Thomas, Jared RP SEA	-	Free Agent	0.0	0	0	0	0	0	0	0	0	0	0	N/A	N/A	2366
Akin, Brian RP LAD	-	Free Agent	0.0	0	0	0	0	0	0	0	0	0	0	N/A	N/A	2367
Braun, Ryan RP LAA	-	Free Agent	0.0	0	0	0	0	0	0	0	0	0	0	N/A	N/A	2370
Henn, Sean RP SEA	-	Free Agent	0.0	0	0	0	0	0	0	0	0	0	0	N/A	N/A	2371
Roach, Donn P LAA	-	Free Agent	0.0	0	0	0	0	0	0	0	0	0	0	N/A	N/A	2375
Osoria, Franquelis RP KC	-	Free Agent	0.0	0	0	0	0	0	0	0	0	0	0	N/A	N/A	2376
Rincon, Ricardo RP NYM	-	Free Agent	0.0	0	0	0	0	0	0	0	0	0	0	N/A	N/A	2380
Gutierrez, Carlos RP MIN	-	Free Agent	0.0	0	0	0	0	0	0	0	0	0	0	N/A	N/A	2381
McDade, Neal RP PIT	-	Free Agent	0.0	0	0	0	0	0	0	0	0	0	0	N/A	N/A	2390
Startup, Will RP ATL	-	Free Agent	0.0	0	0	0	0	0	0	0	0	0	0	N/A	N/A	2391
Juarez, William RP LAD	-	Free Agent	0.0	0	0	0	0	0	0	0	0	0	0	N/A	N/A	2393
Jones, Mike RP MIL	-	Free Agent	0.0	0	0	0	0	0	0	0	0	0	0	N/A	N/A	2396
Camacho, Eddie RP NYM	-	Free Agent	0.0	0	0	0	0	0	0	0	0	0	0	N/A	N/A	2397
Avilan, Luis P ATL	-	Free Agent	0.0	0	0	0	0	0	0	0	0	0	0	N/A	N/A	2399
Correa, Hector RP SF	-	Free Agent	0.0	0	0	0	0	0	0	0	0	0	0	N/A	N/A	2400
Honel, Kris RP STL	-	Free Agent	0.0	0	0	0	0	0	0	0	0	0	0	N/A	N/A	2401
Machi, Jean RP PIT	-	Free Agent	0.0	0	0	0	0	0	0	0	0	0	0	N/A	N/A	2406
Shackelford, Brian RP LAD	-	Free Agent	0.0	0	0	0	0	0	0	0	0	0	0	N/A	N/A	2407
Jimenez, Kelvin RP CHW	-	Free Agent	0.0	0	0	0	0	0	0	0	0	0	0	N/A	N/A	2408
Tanaka, Ryohei P BAL	-	Free Agent	0.0	0	0	0	0	0	0	0	0	0	0	N/A	N/A	2409
Hughes, Travis RP BOS	-	Free Agent	0.0	0	0	0	0	0	0	0	0	0	0	N/A	N/A	2414
Martin, Rafael RP WAS	-	Free Agent	0.0	0	0	0	0	0	0	0	0	0	0	N/A	N/A	2415
Salas, Juan RP CLE	-	Free Agent	0.0	0	0	0	0	0	0	0	0	0	0	N/A	N/A	2419
Peterson, Adam RP DET	-	Free Agent	0.0	0	0	0	0	0	0	0	0	0	0	N/A	N/A	2422
Manzanillo, Santo RP MIL 	-	Free Agent	0.0	0	0	0	0	0	0	0	0	0	0	N/A	N/A	2428
James, Michael RP BOS	-	Free Agent	0.0	0	0	0	0	0	0	0	0	0	0	N/A	N/A	2430
Sisk, Brandon RP KC	-	Free Agent	0.0	0	0	0	0	0	0	0	0	0	0	N/A	N/A	2437
Threets, Erick RP CHW	-	Free Agent	0.0	0	0	0	0	0	0	0	0	0	0	N/A	N/A	2441
Michalak, Chris RP WAS	-	Free Agent	0.0	0	0	0	0	0	0	0	0	0	0	N/A	N/A	2442
Gayhart, Jared RP DET	-	Free Agent	0.0	0	0	0	0	0	0	0	0	0	0	N/A	N/A	2443
Salmon, Brad RP LAA	-	Free Agent	0.0	0	0	0	0	0	0	0	0	0	0	N/A	N/A	2448
Goocher, Clint RP ARI	-	Free Agent	0.0	0	0	0	0	0	0	0	0	0	0	N/A	N/A	2458
Schreiber, Zach RP ATL	-	Free Agent	0.0	0	0	0	0	0	0	0	0	0	0	N/A	N/A	2460
Butler, Josh RP MIL	-	Free Agent	0.0	0	0	0	0	0	0	0	0	0	0	N/A	N/A	2465
Gryboski, Kevin RP SF	-	Free Agent	0.0	0	0	0	0	0	0	0	0	0	0	N/A	N/A	2475
Montero, Agustin RP LAD	-	Free Agent	0.0	0	0	0	0	0	0	0	0	0	0	N/A	N/A	2477
Buckwalter, Ross P TOR	-	Free Agent	0.0	0	0	0	0	0	0	0	0	0	0	N/A	N/A	2478
Graves, Danny RP HOU	-	Free Agent	0.0	0	0	0	0	0	0	0	0	0	0	N/A	N/A	2488
Gulin, Lindsay RP MIL	-	Free Agent	0.0	0	0	0	0	0	0	0	0	0	0	N/A	N/A	2493
Papelbon, Jeremy RP CHC	-	Free Agent	0.0	0	0	0	0	0	0	0	0	0	0	N/A	N/A	2504
Sadler, Billy RP HOU	-	Free Agent	0.0	0	0	0	0	0	0	0	0	0	0	N/A	N/A	2510
Collazo, Willie RP TOR	-	Free Agent	0.0	0	0	0	0	0	0	0	0	0	0	N/A	N/A	2512
Rowe, Steven RP TEX	-	Free Agent	0.0	0	0	0	0	0	0	0	0	0	0	N/A	N/A	2513
Stoner, Tobi RP NYM	-	Free Agent	0.0	0	0	0	0	0	0	0	0	0	0	N/A	N/A	2515
Anderson, Jason RP PHI	-	Free Agent	0.0	0	0	0	0	0	0	0	0	0	0	N/A	N/A	2530
Young, Corey P TEX	-	Free Agent	0.0	0	0	0	0	0	0	0	0	0	0	N/A	N/A	2533
Starner, Nathan RP TOR	-	Free Agent	0.0	0	0	0	0	0	0	0	0	0	0	N/A	N/A	2539
Gogal, Jeffrey RP MIA	-	Free Agent	0.0	0	0	0	0	0	0	0	0	0	0	N/A	N/A	2547
Gronkiewicz, Lee RP BOS	-	Free Agent	0.0	0	0	0	0	0	0	0	0	0	0	N/A	N/A	2550
Hertzler, Barry RP BOS	-	Free Agent	0.0	0	0	0	0	0	0	0	0	0	0	N/A	N/A	2571
Bynum, Mike RP DET	-	Free Agent	0.0	0	0	0	0	0	0	0	0	0	0	N/A	N/A	2572
Brooks, Richard RP CHW	-	Free Agent	0.0	0	0	0	0	0	0	0	0	0	0	N/A	N/A	2575
Bowles, Brian RP SF	-	Free Agent	0.0	0	0	0	0	0	0	0	0	0	0	N/A	N/A	2577
Regilio, Nick RP TEX	-	Free Agent	0.0	0	0	0	0	0	0	0	0	0	0	N/A	N/A	2580
Meszaros, Daniel RP HOU	-	Free Agent	0.0	0	0	0	0	0	0	0	0	0	0	N/A	N/A	2584
Childers, Matt RP PHI	-	Free Agent	0.0	0	0	0	0	0	0	0	0	0	0	N/A	N/A	2585
Forystek, Brian RP BAL	-	Free Agent	0.0	0	0	0	0	0	0	0	0	0	0	N/A	N/A	2586
Massaro, Michael RP OAK	-	Free Agent	0.0	0	0	0	0	0	0	0	0	0	0	N/A	N/A	2592
Dohmann, Scott RP LAD	-	Free Agent	0.0	0	0	0	0	0	0	0	0	0	0	N/A	N/A	2594
Gonzalez, Marco RP STL	-	Free Agent	0.0	0	0	0	0	0	0	0	0	0	0	N/A	N/A	2595
Smith, Dan B. RP ATL	-	Free Agent	0.0	0	0	0	0	0	0	0	0	0	0	N/A	N/A	2596
Meredith, Cla RP WAS	-	Free Agent	0.0	0	0	0	0	0	0	0	0	0	0	N/A	N/A	2600
Schmoll, Steve RP NYM	-	Free Agent	0.0	0	0	0	0	0	0	0	0	0	0	N/A	N/A	2606
Lugo, Jose RP MIN	-	Free Agent	0.0	0	0	0	0	0	0	0	0	0	0	N/A	N/A	2609
Nannini, Mike RP TOR	-	Free Agent	0.0	0	0	0	0	0	0	0	0	0	0	N/A	N/A	2611
Pinto, Renyel RP STL	-	Free Agent	0.0	0	0	0	0	0	0	0	0	0	0	N/A	N/A	2617
Huisman, Justin RP KC	-	Free Agent	0.0	0	0	0	0	0	0	0	0	0	0	N/A	N/A	2624
Wolfe, Brian RP TOR	-	Free Agent	0.0	0	0	0	0	0	0	0	0	0	0	N/A	N/A	2625
Nix, Michael RP ATL	-	Free Agent	0.0	0	0	0	0	0	0	0	0	0	0	N/A	N/A	2626
Gustafson, Timothy P ATL	-	Free Agent	0.0	0	0	0	0	0	0	0	0	0	0	N/A	N/A	2627
Johnson, Jeremy RP DET	-	Free Agent	0.0	0	0	0	0	0	0	0	0	0	0	N/A	N/A	2630
Searles, Jonathan RP BOS	-	Free Agent	0.0	0	0	0	0	0	0	0	0	0	0	N/A	N/A	2634
Cali, Carmen RP LAD	-	Free Agent	0.0	0	0	0	0	0	0	0	0	0	0	N/A	N/A	2638
Woody, Abraham RP ARI	-	Free Agent	0.0	0	0	0	0	0	0	0	0	0	0	N/A	N/A	2641
Donnelly, Brendan RP PIT	-	Free Agent	0.0	0	0	0	0	0	0	0	0	0	0	N/A	N/A	2644
Garcia, Angel RP OAK	-	Free Agent	0.0	0	0	0	0	0	0	0	0	0	0	N/A	N/A	2645
Shields, Scot RP LAA	-	Free Agent	0.0	0	0	0	0	0	0	0	0	0	0	N/A	N/A	2646
Smith, Jesse RP LAA	-	Free Agent	0.0	0	0	0	0	0	0	0	0	0	0	N/A	N/A	2652
Fish, Robert RP ATL 	-	Free Agent	0.0	0	0	0	0	0	0	0	0	0	0	N/A	N/A	2653
Bell, Rob RP WAS	-	Free Agent	0.0	0	0	0	0	0	0	0	0	0	0	N/A	N/A	2657
Ring, Royce RP SEA	-	Free Agent	0.0	0	0	0	0	0	0	0	0	0	0	N/A	N/A	2662
Albaladejo, Jonathan RP NYY 	-	Free Agent	0.0	0	0	0	0	0	0	0	0	0	0	N/A	N/A	2663
Glant, Dustin RP ARI	-	Free Agent	0.0	0	0	0	0	0	0	0	0	0	0	N/A	N/A	2665
Garcia, Harvey RP LAD	-	Free Agent	0.0	0	0	0	0	0	0	0	0	0	0	N/A	N/A	2667
Chiavacci, Ron RP PHI	-	Free Agent	0.0	0	0	0	0	0	0	0	0	0	0	N/A	N/A	2670
Figaro, Alfredo RP DET	-	Free Agent	0.0	0	0	0	0	0	0	0	0	0	0	N/A	N/A	2671
Yabuta, Yasuhiko RP KC	-	Free Agent	0.0	0	0	0	0	0	0	0	0	0	0	N/A	N/A	2679
Rust, Evan RP STL	-	Free Agent	0.0	0	0	0	0	0	0	0	0	0	0	N/A	N/A	2680
Buglovsky, Christopher RP SEA	-	Free Agent	0.0	0	0	0	0	0	0	0	0	0	0	N/A	N/A	2681
Nevarez, Matt RP HOU	-	Free Agent	0.0	0	0	0	0	0	0	0	0	0	0	N/A	N/A	2685
Whitaker, Craig RP SF	-	Free Agent	0.0	0	0	0	0	0	0	0	0	0	0	N/A	N/A	2686
Vaughan, Beau RP OAK	-	Free Agent	0.0	0	0	0	0	0	0	0	0	0	0	N/A	N/A	2689
Rice, Scott RP LAD	-	Free Agent	0.0	0	0	0	0	0	0	0	0	0	0	N/A	N/A	2691
Brown, Brooks RP DET	-	Free Agent	0.0	0	0	0	0	0	0	0	0	0	0	N/A	N/A	2695
Aquino, Greg RP CHW	-	Free Agent	0.0	0	0	0	0	0	0	0	0	0	0	N/A	N/A	2701
Rivera, Mumba RP SEA	-	Free Agent	0.0	0	0	0	0	0	0	0	0	0	0	N/A	N/A	2704
Mastny, Thomas RP CLE	-	Free Agent	0.0	0	0	0	0	0	0	0	0	0	0	N/A	N/A	2708
Songster, Jud RP COL	-	Free Agent	0.0	0	0	0	0	0	0	0	0	0	0	N/A	N/A	2710
Moss, Damian RP COL	-	Free Agent	0.0	0	0	0	0	0	0	0	0	0	0	N/A	N/A	2712
McKiernan, Eddie RP LAA	-	Free Agent	0.0	0	0	0	0	0	0	0	0	0	0	N/A	N/A	2714
Moreno, Edwin RP BOS	-	Free Agent	0.0	0	0	0	0	0	0	0	0	0	0	N/A	N/A	2715
Mattioni, Nick RP OAK	-	Free Agent	0.0	0	0	0	0	0	0	0	0	0	0	N/A	N/A	2716
Dunn, Scott RP OAK	-	Free Agent	0.0	0	0	0	0	0	0	0	0	0	0	N/A	N/A	2721
Fogg, Josh RP PHI	-	Free Agent	0.0	0	0	0	0	0	0	0	0	0	0	N/A	N/A	2723
Stewart, Scott E. RP NYM	-	Free Agent	0.0	0	0	0	0	0	0	0	0	0	0	N/A	N/A	2725
Henderson, Jim P MIL	-	Free Agent	0.0	0	0	0	0	0	0	0	0	0	0	N/A	N/A	2729
Jones, Beau P TEX	-	Free Agent	0.0	0	0	0	0	0	0	0	0	0	0	N/A	N/A	2734
Martinez, Joe RP CLE	-	Free Agent	0.0	0	0	0	0	0	0	0	0	0	0	N/A	N/A	2739
Maxwell, Blake RP BOS	-	Free Agent	0.0	0	0	0	0	0	0	0	0	0	0	N/A	N/A	2740
Musser, Neal RP NYM	-	Free Agent	0.0	0	0	0	0	0	0	0	0	0	0	N/A	N/A	2746
Benitez, Armando RP MIA	-	Free Agent	0.0	0	0	0	0	0	0	0	0	0	0	N/A	N/A	2747
Diaz, Felix RP WAS	-	Free Agent	0.0	0	0	0	0	0	0	0	0	0	0	N/A	N/A	2758
Crawford, Tristan RP WAS	-	Free Agent	0.0	0	0	0	0	0	0	0	0	0	0	N/A	N/A	2762
Campusano, Ed RP CHC	-	Free Agent	0.0	0	0	0	0	0	0	0	0	0	0	N/A	N/A	2765
Schoeneweis, Scott RP BOS	-	Free Agent	0.0	0	0	0	0	0	0	0	0	0	0	N/A	N/A	2771
Waddell, Jason RP DET	-	Free Agent	0.0	0	0	0	0	0	0	0	0	0	0	N/A	N/A	2774
Hernandez, Fernando RP OAK	-	Free Agent	0.0	0	0	0	0	0	0	0	0	0	0	N/A	N/A	2777
Rundles, Richard RP STL	-	Free Agent	0.0	0	0	0	0	0	0	0	0	0	0	N/A	N/A	2783
Rogers, Brian A. RP PIT	-	Free Agent	0.0	0	0	0	0	0	0	0	0	0	0	N/A	N/A	2785
Turnbow, Derrick RP MIA	-	Free Agent	0.0	0	0	0	0	0	0	0	0	0	0	N/A	N/A	2787
Walker, Tyler RP WAS	-	Free Agent	0.0	0	0	0	0	0	0	0	0	0	0	N/A	N/A	2790
Murphy, Bill RP TOR	-	Free Agent	0.0	0	0	0	0	0	0	0	0	0	0	N/A	N/A	2795
Urquidez, Jason RP ARI	-	Free Agent	0.0	0	0	0	0	0	0	0	0	0	0	N/A	N/A	2797
Ray, Ronald RP SF	-	Free Agent	0.0	0	0	0	0	0	0	0	0	0	0	N/A	N/A	2800
Vargas, Jose RP TEX	-	Free Agent	0.0	0	0	0	0	0	0	0	0	0	0	N/A	N/A	2802
Gallagher, Sean RP CIN	-	Free Agent	0.0	0	0	0	0	0	0	0	0	0	0	N/A	N/A	2803
Atlee, Thomas RP MIL	-	Free Agent	0.0	0	0	0	0	0	0	0	0	0	0	N/A	N/A	2806
Lewis, Jensen RP CLE	-	Free Agent	0.0	0	0	0	0	0	0	0	0	0	0	N/A	N/A	2807
Beam, T.J. RP ARI	-	Free Agent	0.0	0	0	0	0	0	0	0	0	0	0	N/A	N/A	2810
Wilkie, Josh RP WAS	-	Free Agent	0.0	0	0	0	0	0	0	0	0	0	0	N/A	N/A	2820
Bongiovanni, Vincent RP TOR	-	Free Agent	0.0	0	0	0	0	0	0	0	0	0	0	N/A	N/A	2822
Taylor, Andrew RP LAA	-	Free Agent	0.0	0	0	0	0	0	0	0	0	0	0	N/A	N/A	2825
Pote, Lou RP TEX	-	Free Agent	0.0	0	0	0	0	0	0	0	0	0	0	N/A	N/A	2828
Shappi, A.J. RP ARI	-	Free Agent	0.0	0	0	0	0	0	0	0	0	0	0	N/A	N/A	2837
Christiani, Nick P CIN	-	Free Agent	0.0	0	0	0	0	0	0	0	0	0	0	N/A	N/A	2838
Felix, Francisco RP LAD	-	Free Agent	0.0	0	0	0	0	0	0	0	0	0	0	N/A	N/A	2843
Condrey, Clay RP MIN	-	Free Agent	0.0	0	0	0	0	0	0	0	0	0	0	N/A	N/A	2846
Fox, Chad RP CHC	-	Free Agent	0.0	0	0	0	0	0	0	0	0	0	0	N/A	N/A	2848
Gray, Sonny P OAK	-	Free Agent	0.0	0	0	0	0	0	0	0	0	0	0	N/A	N/A	2853
Bateman, Joe RP OAK	-	Free Agent	0.0	0	0	0	0	0	0	0	0	0	0	N/A	N/A	2854
Moreno, Victor RP BAL	-	Free Agent	0.0	0	0	0	0	0	0	0	0	0	0	N/A	N/A	2855
Miller, Greg D. RP LAD	-	Free Agent	0.0	0	0	0	0	0	0	0	0	0	0	N/A	N/A	2861
Butto, Francisco RP PHI	-	Free Agent	0.0	0	0	0	0	0	0	0	0	0	0	N/A	N/A	2868
Province, Christopher RP MIN	-	Free Agent	0.0	0	0	0	0	0	0	0	0	0	0	N/A	N/A	2872
Cox, Bryson RP BOS	-	Free Agent	0.0	0	0	0	0	0	0	0	0	0	0	N/A	N/A	2873
Smith, Cody RP KC	-	Free Agent	0.0	0	0	0	0	0	0	0	0	0	0	N/A	N/A	2876
Rueckel, Danny RP WAS	-	Free Agent	0.0	0	0	0	0	0	0	0	0	0	0	N/A	N/A	2879
Hoover, J.J. RP ATL	-	Free Agent	0.0	0	0	0	0	0	0	0	0	0	0	N/A	N/A	2880
Campbell, Brett B. RP MIL	-	Free Agent	0.0	0	0	0	0	0	0	0	0	0	0	N/A	N/A	2882
Gorgen, Matt RP ARI	-	Free Agent	0.0	0	0	0	0	0	0	0	0	0	0	N/A	N/A	2883
Furnish, Brad RP STL	-	Free Agent	0.0	0	0	0	0	0	0	0	0	0	0	N/A	N/A	2891
Lujan, John RP NYM	-	Free Agent	0.0	0	0	0	0	0	0	0	0	0	0	N/A	N/A	2893
Lyman, Jeff RP OAK	-	Free Agent	0.0	0	0	0	0	0	0	0	0	0	0	N/A	N/A	2904
Core, Danny RP TOR	-	Free Agent	0.0	0	0	0	0	0	0	0	0	0	0	N/A	N/A	2906
Smith, Sean H. RP COL	-	Free Agent	0.0	0	0	0	0	0	0	0	0	0	0	N/A	N/A	2907
Segovia, Zack RP MIL	-	Free Agent	0.0	0	0	0	0	0	0	0	0	0	0	N/A	N/A	2912
Huber, Jon RP LAD	-	Free Agent	0.0	0	0	0	0	0	0	0	0	0	0	N/A	N/A	2915
De Jong, Jordan RP TOR	-	Free Agent	0.0	0	0	0	0	0	0	0	0	0	0	N/A	N/A	2919
Hutchison, Drew P TOR	-	Free Agent	0.0	0	0	0	0	0	0	0	0	0	0	N/A	N/A	2921
Burke, Greg RP SD	-	Free Agent	0.0	0	0	0	0	0	0	0	0	0	0	N/A	N/A	2923
Tucker, Glenn RP ATL	-	Free Agent	0.0	0	0	0	0	0	0	0	0	0	0	N/A	N/A	2927
Krebs, Joseph RP CIN	-	Free Agent	0.0	0	0	0	0	0	0	0	0	0	0	N/A	N/A	2939
Patterson, Scott RP SEA 	-	Free Agent	0.0	0	0	0	0	0	0	0	0	0	0	N/A	N/A	2940
Smith, Carlton RP CLE	-	Free Agent	0.0	0	0	0	0	0	0	0	0	0	0	N/A	N/A	2941
Seddon, Chris RP SEA	-	Free Agent	0.0	0	0	0	0	0	0	0	0	0	0	N/A	N/A	2944
Rodriguez, Wilmin RP SF	-	Free Agent	0.0	0	0	0	0	0	0	0	0	0	0	N/A	N/A	2945
Fortunato, Bartolome RP SF	-	Free Agent	0.0	0	0	0	0	0	0	0	0	0	0	N/A	N/A	2954
Tsao, Chin-Hui RP KC	-	Free Agent	0.0	0	0	0	0	0	0	0	0	0	0	N/A	N/A	2955
Seay, Bobby RP DET	-	Free Agent	0.0	0	0	0	0	0	0	0	0	0	0	N/A	N/A	2957
Anderson, Brian RP SF	-	Free Agent	0.0	0	0	0	0	0	0	0	0	0	0	N/A	N/A	2958
Tomoro, Denny RP BOS	-	Free Agent	0.0	0	0	0	0	0	0	0	0	0	0	N/A	N/A	2963
Castellanos, Hugo RP STL	-	Free Agent	0.0	0	0	0	0	0	0	0	0	0	0	N/A	N/A	2965
Rodriguez, Orlando RP LAD	-	Free Agent	0.0	0	0	0	0	0	0	0	0	0	0	N/A	N/A	2967
Hoffman, Matt P DET	-	Free Agent	0.0	0	0	0	0	0	0	0	0	0	0	N/A	N/A	2969
Hutchinson, Trevor RP MIA	-	Free Agent	0.0	0	0	0	0	0	0	0	0	0	0	N/A	N/A	2971
Norrick, Tyler RP STL	-	Free Agent	0.0	0	0	0	0	0	0	0	0	0	0	N/A	N/A	2973
Meyer, Matt RP LAA	-	Free Agent	0.0	0	0	0	0	0	0	0	0	0	0	N/A	N/A	2975
Clarke, Darren RP COL	-	Free Agent	0.0	0	0	0	0	0	0	0	0	0	0	N/A	N/A	2976
Wise, Brendan RP MIN	-	Free Agent	0.0	0	0	0	0	0	0	0	0	0	0	N/A	N/A	2980
Muniz, Carlos RP NYM	-	Free Agent	0.0	0	0	0	0	0	0	0	0	0	0	N/A	N/A	2984
Jamison, Neil RP SD	-	Free Agent	0.0	0	0	0	0	0	0	0	0	0	0	N/A	N/A	2985
Mills, Adam RP BOS	-	Free Agent	0.0	0	0	0	0	0	0	0	0	0	0	N/A	N/A	2987
Rincon, Juan RP LAD	-	Free Agent	0.0	0	0	0	0	0	0	0	0	0	0	N/A	N/A	2994
Chapman, Chance P PHI	-	Free Agent	0.0	0	0	0	0	0	0	0	0	0	0	N/A	N/A	2996
Klein, Daniel P BAL	-	Free Agent	0.0	0	0	0	0	0	0	0	0	0	0	N/A	N/A	2997
Spottiswood, William RP ARI	-	Free Agent	0.0	0	0	0	0	0	0	0	0	0	0	N/A	N/A	3002
Gervacio, Sammy RP HOU	-	Free Agent	0.0	0	0	0	0	0	0	0	0	0	0	N/A	N/A	3003
Dessens, Elmer RP NYM	-	Free Agent	0.0	0	0	0	0	0	0	0	0	0	0	N/A	N/A	3007
Majewski, Gary RP HOU	-	Free Agent	0.0	0	0	0	0	0	0	0	0	0	0	N/A	N/A	3008
Valentine, Joe RP MIL	-	Free Agent	0.0	0	0	0	0	0	0	0	0	0	0	N/A	N/A	3010
Cabral, Cesar RP NYY 	-	Free Agent	0.0	0	0	0	0	0	0	0	0	0	0	N/A	N/A	3012
Wagner, Ryan RP WAS	-	Free Agent	0.0	0	0	0	0	0	0	0	0	0	0	N/A	N/A	3013
Reckling, Trevor RP LAA	-	Free Agent	0.0	0	0	0	0	0	0	0	0	0	0	N/A	N/A	3018
Hagerty, Luke RP MIA	-	Free Agent	0.0	0	0	0	0	0	0	0	0	0	0	N/A	N/A	3019
Watson, Sean RP CIN	-	Free Agent	0.0	0	0	0	0	0	0	0	0	0	0	N/A	N/A	3020
Berg, Jeremy P LAA	-	Free Agent	0.0	0	0	0	0	0	0	0	0	0	0	N/A	N/A	3029
Miller, Justin P TEX	-	Free Agent	0.0	0	0	0	0	0	0	0	0	0	0	N/A	N/A	3038
Knotts, Gary RP PHI	-	Free Agent	0.0	0	0	0	0	0	0	0	0	0	0	N/A	N/A	3040
Miller, Jeff RP SF	-	Free Agent	0.0	0	0	0	0	0	0	0	0	0	0	N/A	N/A	3042
Begg, Chris RP SF	-	Free Agent	0.0	0	0	0	0	0	0	0	0	0	0	N/A	N/A	3043
Garcia, Anderson RP SEA	-	Free Agent	0.0	0	0	0	0	0	0	0	0	0	0	N/A	N/A	3044
Tracey, Sean RP CHW	-	Free Agent	0.0	0	0	0	0	0	0	0	0	0	0	N/A	N/A	3050
Tovar, Angel RP SD	-	Free Agent	0.0	0	0	0	0	0	0	0	0	0	0	N/A	N/A	3051
Huerta, Edgar RP SD	-	Free Agent	0.0	0	0	0	0	0	0	0	0	0	0	N/A	N/A	3052
Sierra, Eduardo RP LAD	-	Free Agent	0.0	0	0	0	0	0	0	0	0	0	0	N/A	N/A	3054
Shoemaker, Scott RP TEX	-	Free Agent	0.0	0	0	0	0	0	0	0	0	0	0	N/A	N/A	3060
Schmidt, Nick RP SD 	-	Free Agent	0.0	0	0	0	0	0	0	0	0	0	0	N/A	N/A	3061
Mullins, Ryan RP MIN	-	Free Agent	0.0	0	0	0	0	0	0	0	0	0	0	N/A	N/A	3063
Matumoto, Jo RP TOR	-	Free Agent	0.0	0	0	0	0	0	0	0	0	0	0	N/A	N/A	3064
Barry, Kevin RP ATL	-	Free Agent	0.0	0	0	0	0	0	0	0	0	0	0	N/A	N/A	3065
Bonser, Boof RP NYM 	-	Free Agent	0.0	0	0	0	0	0	0	0	0	0	0	N/A	N/A	3073
Hines, Carlos RP HOU	-	Free Agent	0.0	0	0	0	0	0	0	0	0	0	0	N/A	N/A	3075
Overholt, Patrick RP PHI	-	Free Agent	0.0	0	0	0	0	0	0	0	0	0	0	N/A	N/A	3076
Parr, James R. RP ATL	-	Free Agent	0.0	0	0	0	0	0	0	0	0	0	0	N/A	N/A	3078
Laughter, Andrew RP TEX	-	Free Agent	0.0	0	0	0	0	0	0	0	0	0	0	N/A	N/A	3083
Lowey, Josh P ATL	-	Free Agent	0.0	0	0	0	0	0	0	0	0	0	0	N/A	N/A	3084
Oldham, Thomas RP SEA	-	Free Agent	0.0	0	0	0	0	0	0	0	0	0	0	N/A	N/A	3085
Egbert, Jack RP NYM	-	Free Agent	0.0	0	0	0	0	0	0	0	0	0	0	N/A	N/A	3089
Rall, Tim RP SEA	-	Free Agent	0.0	0	0	0	0	0	0	0	0	0	0	N/A	N/A	3090
Trolia, Aaron RP SEA	-	Free Agent	0.0	0	0	0	0	0	0	0	0	0	0	N/A	N/A	3094
Hedrick, Justin RP SF	-	Free Agent	0.0	0	0	0	0	0	0	0	0	0	0	N/A	N/A	3096
Basner, Ryan RP ATL	-	Free Agent	0.0	0	0	0	0	0	0	0	0	0	0	N/A	N/A	3100
Houlton, D.J. RP LAD	-	Free Agent	0.0	0	0	0	0	0	0	0	0	0	0	N/A	N/A	3111
Cate, Troy RP OAK	-	Free Agent	0.0	0	0	0	0	0	0	0	0	0	0	N/A	N/A	3114
Shipman, Andrew RP OAK	-	Free Agent	0.0	0	0	0	0	0	0	0	0	0	0	N/A	N/A	3116
Torres, Carlos RP CHW 	-	Free Agent	0.0	0	0	0	0	0	0	0	0	0	0	N/A	N/A	3118
