Ray, Jason RP OAK	-	Free Agent	0.0	0	0	0	0	0	0	0	0	0	0	N/A	N/A	3122
Shinskie, David RP TOR	-	Free Agent	0.0	0	0	0	0	0	0	0	0	0	0	N/A	N/A	3126
Fukumori, Kazuo RP TEX	-	Free Agent	0.0	0	0	0	0	0	0	0	0	0	0	N/A	N/A	3128
McLemore, Mark S. RP MIN	-	Free Agent	0.0	0	0	0	0	0	0	0	0	0	0	N/A	N/A	3132
Stohr, Tyler RP DET	-	Free Agent	0.0	0	0	0	0	0	0	0	0	0	0	N/A	N/A	3134
Edwards, Bryan RP NYM	-	Free Agent	0.0	0	0	0	0	0	0	0	0	0	0	N/A	N/A	3136
English, Jesse RP WAS	-	Free Agent	0.0	0	0	0	0	0	0	0	0	0	0	N/A	N/A	3139
Wing, Ryan RP OAK	-	Free Agent	0.0	0	0	0	0	0	0	0	0	0	0	N/A	N/A	3143
Santos, Reid RP MIN	-	Free Agent	0.0	0	0	0	0	0	0	0	0	0	0	N/A	N/A	3146
Novinsky, John RP MIL	-	Free Agent	0.0	0	0	0	0	0	0	0	0	0	0	N/A	N/A	3147
Chacin, Gustavo RP HOU	-	Free Agent	0.0	0	0	0	0	0	0	0	0	0	0	N/A	N/A	3152
Daigle, Casey RP SF	-	Free Agent	0.0	0	0	0	0	0	0	0	0	0	0	N/A	N/A	3153
DeSalvo, Matt RP MIA	-	Free Agent	0.0	0	0	0	0	0	0	0	0	0	0	N/A	N/A	3154
Geronimo, Ramon RP CIN	-	Free Agent	0.0	0	0	0	0	0	0	0	0	0	0	N/A	N/A	3157
Serrano, Jimmy RP MIA	-	Free Agent	0.0	0	0	0	0	0	0	0	0	0	0	N/A	N/A	3158
Simmons, James J. RP OAK	-	Free Agent	0.0	0	0	0	0	0	0	0	0	0	0	N/A	N/A	3162
Sharpless, Josh RP PIT	-	Free Agent	0.0	0	0	0	0	0	0	0	0	0	0	N/A	N/A	3165
Bean, Colter RP ATL	-	Free Agent	0.0	0	0	0	0	0	0	0	0	0	0	N/A	N/A	3167
Munson, Kevin RP ARI	-	Free Agent	0.0	0	0	0	0	0	0	0	0	0	0	N/A	N/A	3174
Haines, Talley RP BOS	-	Free Agent	0.0	0	0	0	0	0	0	0	0	0	0	N/A	N/A	3176
Norderum, Jason RP WAS	-	Free Agent	0.0	0	0	0	0	0	0	0	0	0	0	N/A	N/A	3181
Garate, Victor RP MIA	-	Free Agent	0.0	0	0	0	0	0	0	0	0	0	0	N/A	N/A	3187
Bucktrot, Keith RP PHI	-	Free Agent	0.0	0	0	0	0	0	0	0	0	0	0	N/A	N/A	3193
Young, Terrell RP CIN	-	Free Agent	0.0	0	0	0	0	0	0	0	0	0	0	N/A	N/A	3196
Gomez, Mariano RP ATL	-	Free Agent	0.0	0	0	0	0	0	0	0	0	0	0	N/A	N/A	3197
Flores, Adalberto P TEX	-	Free Agent	0.0	0	0	0	0	0	0	0	0	0	0	N/A	N/A	3199
Barzilla, Philip RP SD	-	Free Agent	0.0	0	0	0	0	0	0	0	0	0	0	N/A	N/A	3206
Duff, Grant RP NYY	-	Free Agent	0.0	0	0	0	0	0	0	0	0	0	0	N/A	N/A	3209
Ruelas, Heriberto RP NYM	-	Free Agent	0.0	0	0	0	0	0	0	0	0	0	0	N/A	N/A	3212
Reed, Chris P LAD	-	Free Agent	0.0	0	0	0	0	0	0	0	0	0	0	N/A	N/A	3215
Morris, Dallas RP LAA	-	Free Agent	0.0	0	0	0	0	0	0	0	0	0	0	N/A	N/A	3219
Ramirez, Neil P TEX	-	Free Agent	0.0	0	0	0	0	0	0	0	0	0	0	N/A	N/A	3223
Miller, Justin RP SEA	-	Free Agent	0.0	0	0	0	0	0	0	0	0	0	0	N/A	N/A	3230
Kuwata, Masumi RP PIT	-	Free Agent	0.0	0	0	0	0	0	0	0	0	0	0	N/A	N/A	3232
De La Rosa, Wilkin RP LAD	-	Free Agent	0.0	0	0	0	0	0	0	0	0	0	0	N/A	N/A	3234
Andujar, Christopher P TB	-	Free Agent	0.0	0	0	0	0	0	0	0	0	0	0	N/A	N/A	3236
Thorpe, Tracy RP SEA	-	Free Agent	0.0	0	0	0	0	0	0	0	0	0	0	N/A	N/A	3237
Franco, Martire RP PHI	-	Free Agent	0.0	0	0	0	0	0	0	0	0	0	0	N/A	N/A	3238
Rustich, Brant RP NYM	-	Free Agent	0.0	0	0	0	0	0	0	0	0	0	0	N/A	N/A	3241
Littleton, Wes RP SEA	-	Free Agent	0.0	0	0	0	0	0	0	0	0	0	0	N/A	N/A	3246
Espinosa, Sergio P TB	-	Free Agent	0.0	0	0	0	0	0	0	0	0	0	0	N/A	N/A	3255
Broshuis, Garrett RP SF	-	Free Agent	0.0	0	0	0	0	0	0	0	0	0	0	N/A	N/A	3256
Peterson, Matt RP MIA	-	Free Agent	0.0	0	0	0	0	0	0	0	0	0	0	N/A	N/A	3263
Perez, Marcelo RP DET	-	Free Agent	0.0	0	0	0	0	0	0	0	0	0	0	N/A	N/A	3266
Nall, Brandon RP NYM	-	Free Agent	0.0	0	0	0	0	0	0	0	0	0	0	N/A	N/A	3274
Jones, Hunter RP CLE	-	Free Agent	0.0	0	0	0	0	0	0	0	0	0	0	N/A	N/A	3276
McGinley, Blake RP NYM	-	Free Agent	0.0	0	0	0	0	0	0	0	0	0	0	N/A	N/A	3278
Wassermann, Ehren RP PHI	-	Free Agent	0.0	0	0	0	0	0	0	0	0	0	0	N/A	N/A	3287
Ridgway, Jeff RP ATL	-	Free Agent	0.0	0	0	0	0	0	0	0	0	0	0	N/A	N/A	3288
Pope, Justin RP PHI	-	Free Agent	0.0	0	0	0	0	0	0	0	0	0	0	N/A	N/A	3290
Bowie, Micah RP COL	-	Free Agent	0.0	0	0	0	0	0	0	0	0	0	0	N/A	N/A	3292
Cromer, Jason RP TB	-	Free Agent	0.0	0	0	0	0	0	0	0	0	0	0	N/A	N/A	3294
Rivera, Saul RP CLE	-	Free Agent	0.0	0	0	0	0	0	0	0	0	0	0	N/A	N/A	3298
Waechter, Doug RP KC	-	Free Agent	0.0	0	0	0	0	0	0	0	0	0	0	N/A	N/A	3307
Kunz, Eddie RP NYM	-	Free Agent	0.0	0	0	0	0	0	0	0	0	0	0	N/A	N/A	3314
Lara, Juan RP CLE	-	Free Agent	0.0	0	0	0	0	0	0	0	0	0	0	N/A	N/A	3316
Kilby, Brad RP OAK	-	Free Agent	0.0	0	0	0	0	0	0	0	0	0	0	N/A	N/A	3317
Ramirez, Elizardo RP TEX	-	Free Agent	0.0	0	0	0	0	0	0	0	0	0	0	N/A	N/A	3320
Fields, Josh D. RP SEA	-	Free Agent	0.0	0	0	0	0	0	0	0	0	0	0	N/A	N/A	3322
Mallette, Brian RP PIT	-	Free Agent	0.0	0	0	0	0	0	0	0	0	0	0	N/A	N/A	3323
Sosa, Jorge RP MIA	-	Free Agent	0.0	0	0	0	0	0	0	0	0	0	0	N/A	N/A	3324
Bowyer, Travis RP MIA	-	Free Agent	0.0	0	0	0	0	0	0	0	0	0	0	N/A	N/A	3327
Jennings, Dan RP MIA	-	Free Agent	0.0	0	0	0	0	0	0	0	0	0	0	N/A	N/A	3329
Carter, Brenton RP SD	-	Free Agent	0.0	0	0	0	0	0	0	0	0	0	0	N/A	N/A	3330
Liz, Radhames RP SD	-	Free Agent	0.0	0	0	0	0	0	0	0	0	0	0	N/A	N/A	3331
Nelson, Joe RP SEA	-	Free Agent	0.0	0	0	0	0	0	0	0	0	0	0	N/A	N/A	3335
Slocum, Brian RP PIT	-	Free Agent	0.0	0	0	0	0	0	0	0	0	0	0	N/A	N/A	3340
Stephenson, Robert P CIN	-	Free Agent	0.0	0	0	0	0	0	0	0	0	0	0	N/A	N/A	3344
Seanez, Rudy RP LAA	-	Free Agent	0.0	0	0	0	0	0	0	0	0	0	0	N/A	N/A	3350
Miller, Matt J. RP PIT	-	Free Agent	0.0	0	0	0	0	0	0	0	0	0	0	N/A	N/A	3351
Bootcheck, Chris RP TB 	-	Free Agent	0.0	0	0	0	0	0	0	0	0	0	0	N/A	N/A	3353
Cullen, Ryan RP NYM	-	Free Agent	0.0	0	0	0	0	0	0	0	0	0	0	N/A	N/A	3355
Gilmartin, Sean P ATL	-	Free Agent	0.0	0	0	0	0	0	0	0	0	0	0	N/A	N/A	3360
Jackson, Steven RP LAD	-	Free Agent	0.0	0	0	0	0	0	0	0	0	0	0	N/A	N/A	3361
Simons, Zach RP DET	-	Free Agent	0.0	0	0	0	0	0	0	0	0	0	0	N/A	N/A	3362
Carrasco, Hector RP PIT	-	Free Agent	0.0	0	0	0	0	0	0	0	0	0	0	N/A	N/A	3363
Rohlicek, Russel RP CHC	-	Free Agent	0.0	0	0	0	0	0	0	0	0	0	0	N/A	N/A	3365
Astacio, Ezequiel RP CHC	-	Free Agent	0.0	0	0	0	0	0	0	0	0	0	0	N/A	N/A	3371
Parise, Pete RP STL	-	Free Agent	0.0	0	0	0	0	0	0	0	0	0	0	N/A	N/A	3379
Calero, Kiko RP LAD	-	Free Agent	0.0	0	0	0	0	0	0	0	0	0	0	N/A	N/A	3382
Taschner, Jack RP LAD	-	Free Agent	0.0	0	0	0	0	0	0	0	0	0	0	N/A	N/A	3385
Corpas, Manny RP CHC 	-	Free Agent	0.0	0	0	0	0	0	0	0	0	0	0	N/A	N/A	3386
Bachanov, Jon RP LAA	-	Free Agent	0.0	0	0	0	0	0	0	0	0	0	0	N/A	N/A	3390
Walton, Sam RP STL	-	Free Agent	0.0	0	0	0	0	0	0	0	0	0	0	N/A	N/A	3396
Fox, Matt RP SEA	-	Free Agent	0.0	0	0	0	0	0	0	0	0	0	0	N/A	N/A	3399
Harikkala, Tim RP OAK	-	Free Agent	0.0	0	0	0	0	0	0	0	0	0	0	N/A	N/A	3401
Lambert, Chris RP BAL	-	Free Agent	0.0	0	0	0	0	0	0	0	0	0	0	N/A	N/A	3410
Gordon, Derrick RP OAK	-	Free Agent	0.0	0	0	0	0	0	0	0	0	0	0	N/A	N/A	3415
Wilkerson, George RP CIN	-	Free Agent	0.0	0	0	0	0	0	0	0	0	0	0	N/A	N/A	3420
Smith, Mike RP CHC	-	Free Agent	0.0	0	0	0	0	0	0	0	0	0	0	N/A	N/A	3422
Gardner, Michael RP SD	-	Free Agent	0.0	0	0	0	0	0	0	0	0	0	0	N/A	N/A	3430
Egan, Pat RP BAL	-	Free Agent	0.0	0	0	0	0	0	0	0	0	0	0	N/A	N/A	3432
McClellan, Zach RP COL	-	Free Agent	0.0	0	0	0	0	0	0	0	0	0	0	N/A	N/A	3440
McBeth, Marcus RP OAK	-	Free Agent	0.0	0	0	0	0	0	0	0	0	0	0	N/A	N/A	3441
Wood, Austin P DET	-	Free Agent	0.0	0	0	0	0	0	0	0	0	0	0	N/A	N/A	3444
Roquet, Rocky RP CHC	-	Free Agent	0.0	0	0	0	0	0	0	0	0	0	0	N/A	N/A	3447
Novoa, Roberto RP BAL	-	Free Agent	0.0	0	0	0	0	0	0	0	0	0	0	N/A	N/A	3448
Hernandez, Carlos P OAK	-	Free Agent	0.0	0	0	0	0	0	0	0	0	0	0	N/A	N/A	3451
Guttormson, Rick RP SEA	-	Free Agent	0.0	0	0	0	0	0	0	0	0	0	0	N/A	N/A	3454
Brown, Andrew RP OAK	-	Free Agent	0.0	0	0	0	0	0	0	0	0	0	0	N/A	N/A	3457
Julio, Jorge RP PIT	-	Free Agent	0.0	0	0	0	0	0	0	0	0	0	0	N/A	N/A	3460
Hardy, Blaine RP KC	-	Free Agent	0.0	0	0	0	0	0	0	0	0	0	0	N/A	N/A	3463
Cedeno, Juan RP DET	-	Free Agent	0.0	0	0	0	0	0	0	0	0	0	0	N/A	N/A	3465
Ellis, Jonathon RP SD	-	Free Agent	0.0	0	0	0	0	0	0	0	0	0	0	N/A	N/A	3471
McCrory, Bob RP BAL	-	Free Agent	0.0	0	0	0	0	0	0	0	0	0	0	N/A	N/A	3473
Gabino, Armando RP BAL	-	Free Agent	0.0	0	0	0	0	0	0	0	0	0	0	N/A	N/A	3479
Eckert, Harold RP LAD	-	Free Agent	0.0	0	0	0	0	0	0	0	0	0	0	N/A	N/A	3488
Mitchell, Andy RP BAL	-	Free Agent	0.0	0	0	0	0	0	0	0	0	0	0	N/A	N/A	3489
Davidson, Daniel RP LAA	-	Free Agent	0.0	0	0	0	0	0	0	0	0	0	0	N/A	N/A	3492
Kissock, Christopher P PHI	-	Free Agent	0.0	0	0	0	0	0	0	0	0	0	0	N/A	N/A	3494
Cruceta, Francisco RP DET	-	Free Agent	0.0	0	0	0	0	0	0	0	0	0	0	N/A	N/A	3499
Ramirez, Ramon RP BOS	-	Free Agent	0.0	0	0	0	0	0	0	0	0	0	0	N/A	N/A	3502
Corcoran, Roy RP HOU	-	Free Agent	0.0	0	0	0	0	0	0	0	0	0	0	N/A	N/A	3503
Housman, Jeff RP MIL	-	Free Agent	0.0	0	0	0	0	0	0	0	0	0	0	N/A	N/A	3504
Pomeranz, Stuart RP LAD	-	Free Agent	0.0	0	0	0	0	0	0	0	0	0	0	N/A	N/A	3506
Towers, Josh RP LAD	-	Free Agent	0.0	0	0	0	0	0	0	0	0	0	0	N/A	N/A	3507
Timlin, Mike RP COL	-	Free Agent	0.0	0	0	0	0	0	0	0	0	0	0	N/A	N/A	3508
Santos, Arthur RP KC	-	Free Agent	0.0	0	0	0	0	0	0	0	0	0	0	N/A	N/A	3512
Marbry, Michael P COL	-	Free Agent	0.0	0	0	0	0	0	0	0	0	0	0	N/A	N/A	3515
Ventura, Ronnie RP HOU	-	Free Agent	0.0	0	0	0	0	0	0	0	0	0	0	N/A	N/A	3516
Stockman, Phil RP ATL	-	Free Agent	0.0	0	0	0	0	0	0	0	0	0	0	N/A	N/A	3520
Jung, Sung RP ATL	-	Free Agent	0.0	0	0	0	0	0	0	0	0	0	0	N/A	N/A	3522
Ellis, Josh RP ARI	-	Free Agent	0.0	0	0	0	0	0	0	0	0	0	0	N/A	N/A	3525
Ingram, Jesse RP TEX	-	Free Agent	0.0	0	0	0	0	0	0	0	0	0	0	N/A	N/A	3530
Childress, Daylan RP MIN	-	Free Agent	0.0	0	0	0	0	0	0	0	0	0	0	N/A	N/A	3531
Carvajal, Marcos RP MIA	-	Free Agent	0.0	0	0	0	0	0	0	0	0	0	0	N/A	N/A	3534
Nall, T.J. RP WAS	-	Free Agent	0.0	0	0	0	0	0	0	0	0	0	0	N/A	N/A	3537
Medina, Ruben P CIN	-	Free Agent	0.0	0	0	0	0	0	0	0	0	0	0	N/A	N/A	3539
Cody, Christopher RP MIL	-	Free Agent	0.0	0	0	0	0	0	0	0	0	0	0	N/A	N/A	3543
Snyder, Kyle RP NYM	-	Free Agent	0.0	0	0	0	0	0	0	0	0	0	0	N/A	N/A	3545
Bennett, Jeff RP MIL	-	Free Agent	0.0	0	0	0	0	0	0	0	0	0	0	N/A	N/A	3546
Arias, Wilkins RP NYY	-	Free Agent	0.0	0	0	0	0	0	0	0	0	0	0	N/A	N/A	3547
Ryu, Jae-Kuk RP SD	-	Free Agent	0.0	0	0	0	0	0	0	0	0	0	0	N/A	N/A	3548
Field, Nate RP MIA	-	Free Agent	0.0	0	0	0	0	0	0	0	0	0	0	N/A	N/A	3551
Valdez, Cesar RP PIT	-	Free Agent	0.0	0	0	0	0	0	0	0	0	0	0	N/A	N/A	3553
Bradford, Chad RP TB	-	Free Agent	0.0	0	0	0	0	0	0	0	0	0	0	N/A	N/A	3556
Cyr, Eric RP TEX	-	Free Agent	0.0	0	0	0	0	0	0	0	0	0	0	N/A	N/A	3559
Beltran, Francis RP SF	-	Free Agent	0.0	0	0	0	0	0	0	0	0	0	0	N/A	N/A	3568
Lamura, B.J. RP TOR	-	Free Agent	0.0	0	0	0	0	0	0	0	0	0	0	N/A	N/A	3571
Bryson, Robert RP CLE	-	Free Agent	0.0	0	0	0	0	0	0	0	0	0	0	N/A	N/A	3572
Byrd, Darren P MIL	-	Free Agent	0.0	0	0	0	0	0	0	0	0	0	0	N/A	N/A	3573
Rosario, Francisco A. RP KC	-	Free Agent	0.0	0	0	0	0	0	0	0	0	0	0	N/A	N/A	3574
Munter, Scott RP SD	-	Free Agent	0.0	0	0	0	0	0	0	0	0	0	0	N/A	N/A	3575
Rosales, Leo RP ARI	-	Free Agent	0.0	0	0	0	0	0	0	0	0	0	0	N/A	N/A	3577
Merricks, Matt RP COL	-	Free Agent	0.0	0	0	0	0	0	0	0	0	0	0	N/A	N/A	3580
Gracesqui, Franklyn RP BAL	-	Free Agent	0.0	0	0	0	0	0	0	0	0	0	0	N/A	N/A	3581
Reed, Brian RP TOR	-	Free Agent	0.0	0	0	0	0	0	0	0	0	0	0	N/A	N/A	3584
Birkins, Kurt RP COL	-	Free Agent	0.0	0	0	0	0	0	0	0	0	0	0	N/A	N/A	3590
Lo, Chia-Jen RP HOU	-	Free Agent	0.0	0	0	0	0	0	0	0	0	0	0	N/A	N/A	3593
Flannery, Michael RP CIN	-	Free Agent	0.0	0	0	0	0	0	0	0	0	0	0	N/A	N/A	3595
Flinn, Chris RP TB	-	Free Agent	0.0	0	0	0	0	0	0	0	0	0	0	N/A	N/A	3596
Quintana, Jose RP CHW	-	Free Agent	0.0	0	0	0	0	0	0	0	0	0	0	N/A	N/A	3601
Hinton, Robert RP MIL	-	Free Agent	0.0	0	0	0	0	0	0	0	0	0	0	N/A	N/A	3609
Cox, J.B. RP NYY	-	Free Agent	0.0	0	0	0	0	0	0	0	0	0	0	N/A	N/A	3610
Tufts, Tyler RP TEX	-	Free Agent	0.0	0	0	0	0	0	0	0	0	0	0	N/A	N/A	3614
Lara, Alexis RP SD	-	Free Agent	0.0	0	0	0	0	0	0	0	0	0	0	N/A	N/A	3615
Perez, Oneli RP STL	-	Free Agent	0.0	0	0	0	0	0	0	0	0	0	0	N/A	N/A	3617
Kometani, Paul RP TEX	-	Free Agent	0.0	0	0	0	0	0	0	0	0	0	0	N/A	N/A	3619
Schmidt, Joshua RP NYY	-	Free Agent	0.0	0	0	0	0	0	0	0	0	0	0	N/A	N/A	3620
Wordekemper, Eric RP NYY	-	Free Agent	0.0	0	0	0	0	0	0	0	0	0	0	N/A	N/A	3621
Schroder, Chris RP MIA	-	Free Agent	0.0	0	0	0	0	0	0	0	0	0	0	N/A	N/A	3624
Stange, Daniel RP ARI	-	Free Agent	0.0	0	0	0	0	0	0	0	0	0	0	N/A	N/A	3628
Shouse, Brian RP TB	-	Free Agent	0.0	0	0	0	0	0	0	0	0	0	0	N/A	N/A	3632
Quezada, Elvys RP NYY	-	Free Agent	0.0	0	0	0	0	0	0	0	0	0	0	N/A	N/A	3636
Cooney, Brandon P BAL	-	Free Agent	0.0	0	0	0	0	0	0	0	0	0	0	N/A	N/A	3639
Castellanos, Jonathan RP ARI	-	Free Agent	0.0	0	0	0	0	0	0	0	0	0	0	N/A	N/A	3642
Heath, Deunte P CHW	-	Free Agent	0.0	0	0	0	0	0	0	0	0	0	0	N/A	N/A	3647
Villalona, Bryan RP NYY	-	Free Agent	0.0	0	0	0	0	0	0	0	0	0	0	N/A	N/A	3658
Corcoran, Tim RP LAD	-	Free Agent	0.0	0	0	0	0	0	0	0	0	0	0	N/A	N/A	3659
Hansen, Craig RP PIT	-	Free Agent	0.0	0	0	0	0	0	0	0	0	0	0	N/A	N/A	3661
Adkins, Jon RP CHW	-	Free Agent	0.0	0	0	0	0	0	0	0	0	0	0	N/A	N/A	3666
Bright, Adam RP COL	-	Free Agent	0.0	0	0	0	0	0	0	0	0	0	0	N/A	N/A	3667
Brocail, Doug RP HOU	-	Free Agent	0.0	0	0	0	0	0	0	0	0	0	0	N/A	N/A	3668
Boothe, Robert RP LAD	-	Free Agent	0.0	0	0	0	0	0	0	0	0	0	0	N/A	N/A	3671
Welker, Duke RP PIT	-	Free Agent	0.0	0	0	0	0	0	0	0	0	0	0	N/A	N/A	3672
Stokes, Brian RP TOR	-	Free Agent	0.0	0	0	0	0	0	0	0	0	0	0	N/A	N/A	3676
Rouwenhorst, Jonathon RP ATL	-	Free Agent	0.0	0	0	0	0	0	0	0	0	0	0	N/A	N/A	3682
Batista, Kendy RP TEX	-	Free Agent	0.0	0	0	0	0	0	0	0	0	0	0	N/A	N/A	3689
Thorne, David RP BOS	-	Free Agent	0.0	0	0	0	0	0	0	0	0	0	0	N/A	N/A	3690
Aselton, Kyle RP MIN	-	Free Agent	0.0	0	0	0	0	0	0	0	0	0	0	N/A	N/A	3691
Sawatski, Jay RP MIN	-	Free Agent	0.0	0	0	0	0	0	0	0	0	0	0	N/A	N/A	3692
Bumstead, Mike RP TEX	-	Free Agent	0.0	0	0	0	0	0	0	0	0	0	0	N/A	N/A	3696
Pollok, Dwayne RP LAD	-	Free Agent	0.0	0	0	0	0	0	0	0	0	0	0	N/A	N/A	3697
Cisco, Michael P PHI	-	Free Agent	0.0	0	0	0	0	0	0	0	0	0	0	N/A	N/A	3701
Campillo, Jorge RP KC	-	Free Agent	0.0	0	0	0	0	0	0	0	0	0	0	N/A	N/A	3702
Keating, Patrick RP KC	-	Free Agent	0.0	0	0	0	0	0	0	0	0	0	0	N/A	N/A	3704
Wilkinson, Matthew RP ARI	-	Free Agent	0.0	0	0	0	0	0	0	0	0	0	0	N/A	N/A	3707
Jorgenson, Adam RP COL	-	Free Agent	0.0	0	0	0	0	0	0	0	0	0	0	N/A	N/A	3708
Bittner, Tim RP LAA	-	Free Agent	0.0	0	0	0	0	0	0	0	0	0	0	N/A	N/A	3711
Lollis, Matt P SD	-	Free Agent	0.0	0	0	0	0	0	0	0	0	0	0	N/A	N/A	3716
Venditte, Patrick P NYY	-	Free Agent	0.0	0	0	0	0	0	0	0	0	0	0	N/A	N/A	3724
Santiago, Tomas RP COL	-	Free Agent	0.0	0	0	0	0	0	0	0	0	0	0	N/A	N/A	3725
Sanchez, Romulo RP NYY	-	Free Agent	0.0	0	0	0	0	0	0	0	0	0	0	N/A	N/A	3726
Davis, Jason T. RP PIT	-	Free Agent	0.0	0	0	0	0	0	0	0	0	0	0	N/A	N/A	3728
Walker, Jamie RP BAL	-	Free Agent	0.0	0	0	0	0	0	0	0	0	0	0	N/A	N/A	3735
Bajenaru, Jeff RP ARI	-	Free Agent	0.0	0	0	0	0	0	0	0	0	0	0	N/A	N/A	3738
Keppel, Bobby RP MIN	-	Free Agent	0.0	0	0	0	0	0	0	0	0	0	0	N/A	N/A	3742
Hansack, Devern RP BOS	-	Free Agent	0.0	0	0	0	0	0	0	0	0	0	0	N/A	N/A	3744
Muegge, Danny RP LAD	-	Free Agent	0.0	0	0	0	0	0	0	0	0	0	0	N/A	N/A	3746
Penn, Hayden RP PIT	-	Free Agent	0.0	0	0	0	0	0	0	0	0	0	0	N/A	N/A	3748
Urckfitz, Patrick RP HOU	-	Free Agent	0.0	0	0	0	0	0	0	0	0	0	0	N/A	N/A	3756
Rodriguez, Jose A. RP HOU	-	Free Agent	0.0	0	0	0	0	0	0	0	0	0	0	N/A	N/A	3759
Burnside, Adrian RP SD	-	Free Agent	0.0	0	0	0	0	0	0	0	0	0	0	N/A	N/A	3760
Barrett, Ricky RP MIN	-	Free Agent	0.0	0	0	0	0	0	0	0	0	0	0	N/A	N/A	3761
Meloan, Jon RP OAK	-	Free Agent	0.0	0	0	0	0	0	0	0	0	0	0	N/A	N/A	3763
Giese, Dan RP OAK	-	Free Agent	0.0	0	0	0	0	0	0	0	0	0	0	N/A	N/A	3765
Abraham, Paul RP SD	-	Free Agent	0.0	0	0	0	0	0	0	0	0	0	0	N/A	N/A	3766
Wells, Jared RP SEA	-	Free Agent	0.0	0	0	0	0	0	0	0	0	0	0	N/A	N/A	3767
Ramirez, Edwar RP OAK	-	Free Agent	0.0	0	0	0	0	0	0	0	0	0	0	N/A	N/A	3773
Voss, Jay RP DET	-	Free Agent	0.0	0	0	0	0	0	0	0	0	0	0	N/A	N/A	3779
Ni, Fu-Te RP DET	-	Free Agent	0.0	0	0	0	0	0	0	0	0	0	0	N/A	N/A	3788
Dubee, Michael P PIT	-	Free Agent	0.0	0	0	0	0	0	0	0	0	0	0	N/A	N/A	3790
Cortes, David RP SF	-	Free Agent	0.0	0	0	0	0	0	0	0	0	0	0	N/A	N/A	3794
Darrow, Rudy RP ATL	-	Free Agent	0.0	0	0	0	0	0	0	0	0	0	0	N/A	N/A	3797
Flores, Ron RP CIN	-	Free Agent	0.0	0	0	0	0	0	0	0	0	0	0	N/A	N/A	3801
Howry, Bob RP CHC	-	Free Agent	0.0	0	0	0	0	0	0	0	0	0	0	N/A	N/A	3803
Garman, Brian P MIL	-	Free Agent	0.0	0	0	0	0	0	0	0	0	0	0	N/A	N/A	3805
Desgue, Fernando RP LAD	-	Free Agent	0.0	0	0	0	0	0	0	0	0	0	0	N/A	N/A	3807
Coutlangus, Jon RP ARI	-	Free Agent	0.0	0	0	0	0	0	0	0	0	0	0	N/A	N/A	3810
Scholl, Chris P LAA	-	Free Agent	0.0	0	0	0	0	0	0	0	0	0	0	N/A	N/A	3814
Mercedes, Roque RP MIL	-	Free Agent	0.0	0	0	0	0	0	0	0	0	0	0	N/A	N/A	3822
Bonine, Eddie RP PHI	-	Free Agent	0.0	0	0	0	0	0	0	0	0	0	0	N/A	N/A	3823
Layne, Tommy RP ARI	-	Free Agent	0.0	0	0	0	0	0	0	0	0	0	0	N/A	N/A	3827
Doolittle, Michael P MIA	-	Free Agent	0.0	0	0	0	0	0	0	0	0	0	0	N/A	N/A	3828
Swindle, R.J. RP TB	-	Free Agent	0.0	0	0	0	0	0	0	0	0	0	0	N/A	N/A	3833
Munoz, Arnie RP WAS	-	Free Agent	0.0	0	0	0	0	0	0	0	0	0	0	N/A	N/A	3841
Korecky, Bobby RP LAA	-	Free Agent	0.0	0	0	0	0	0	0	0	0	0	0	N/A	N/A	3846
Austen, David RP LAA	-	Free Agent	0.0	0	0	0	0	0	0	0	0	0	0	N/A	N/A	3847
Diekman, Jacob RP PHI	-	Free Agent	0.0	0	0	0	0	0	0	0	0	0	0	N/A	N/A	3848
Thomas, Daniel RP OAK	-	Free Agent	0.0	0	0	0	0	0	0	0	0	0	0	N/A	N/A	3849
Sinkbeil, Brett RP MIA	-	Free Agent	0.0	0	0	0	0	0	0	0	0	0	0	N/A	N/A	3855
Springer, Russ RP CIN	-	Free Agent	0.0	0	0	0	0	0	0	0	0	0	0	N/A	N/A	3856
Marshall, Jay RP OAK	-	Free Agent	0.0	0	0	0	0	0	0	0	0	0	0	N/A	N/A	3858
Rosen, Mark RP ARI	-	Free Agent	0.0	0	0	0	0	0	0	0	0	0	0	N/A	N/A	3863
Astacio, Olivo RP PIT	-	Free Agent	0.0	0	0	0	0	0	0	0	0	0	0	N/A	N/A	3866
Herron, Tyler RP STL	-	Free Agent	0.0	0	0	0	0	0	0	0	0	0	0	N/A	N/A	3867
Zerpa, Armando RP BOS	-	Free Agent	0.0	0	0	0	0	0	0	0	0	0	0	N/A	N/A	3870
Pearson, Jason RP BAL	-	Free Agent	0.0	0	0	0	0	0	0	0	0	0	0	N/A	N/A	3875
Orta, Ricky RP TB	-	Free Agent	0.0	0	0	0	0	0	0	0	0	0	0	N/A	N/A	3878
Rosenberg, Brian RP PHI	-	Free Agent	0.0	0	0	0	0	0	0	0	0	0	0	N/A	N/A	3884
Birtwell, John RP DET	-	Free Agent	0.0	0	0	0	0	0	0	0	0	0	0	N/A	N/A	3886
Jennings, Jason RP OAK	-	Free Agent	0.0	0	0	0	0	0	0	0	0	0	0	N/A	N/A	3888
Bergmann, Jason RP BOS	-	Free Agent	0.0	0	0	0	0	0	0	0	0	0	0	N/A	N/A	3890
Frontz, Neal RP TB	-	Free Agent	0.0	0	0	0	0	0	0	0	0	0	0	N/A	N/A	3891
Sartor, Matthew RP LAD	-	Free Agent	0.0	0	0	0	0	0	0	0	0	0	0	N/A	N/A	3898
Doyle, Jared RP ARI	-	Free Agent	0.0	0	0	0	0	0	0	0	0	0	0	N/A	N/A	3901
Harker, Brett RP MIA	-	Free Agent	0.0	0	0	0	0	0	0	0	0	0	0	N/A	N/A	3903
Van Buren, Jermaine RP WAS	-	Free Agent	0.0	0	0	0	0	0	0	0	0	0	0	N/A	N/A	3904
Diaz, Amalio P LAA	-	Free Agent	0.0	0	0	0	0	0	0	0	0	0	0	N/A	N/A	3907
Wilson, Alex RP BOS	-	Free Agent	0.0	0	0	0	0	0	0	0	0	0	0	N/A	N/A	3913
Bale, John RP DET	-	Free Agent	0.0	0	0	0	0	0	0	0	0	0	0	N/A	N/A	3916
Parker, Blake RP CHC	-	Free Agent	0.0	0	0	0	0	0	0	0	0	0	0	N/A	N/A	3921
Veal, Donnie RP CHW	-	Free Agent	0.0	0	0	0	0	0	0	0	0	0	0	N/A	N/A	3928
Hynes, Colt RP SD	-	Free Agent	0.0	0	0	0	0	0	0	0	0	0	0	N/A	N/A	3933
Shell, Steven RP KC	-	Free Agent	0.0	0	0	0	0	0	0	0	0	0	0	N/A	N/A	3937
Stemle, Steve RP KC	-	Free Agent	0.0	0	0	0	0	0	0	0	0	0	0	N/A	N/A	3938
Bray, Steve RP SEA	-	Free Agent	0.0	0	0	0	0	0	0	0	0	0	0	N/A	N/A	3944
Pena, Tony RP BOS 	-	Free Agent	0.0	0	0	0	0	0	0	0	0	0	0	N/A	N/A	3948
Rice, Jason RP ATL	-	Free Agent	0.0	0	0	0	0	0	0	0	0	0	0	N/A	N/A	3949
Socolovich, Miguel RP CHW	-	Free Agent	0.0	0	0	0	0	0	0	0	0	0	0	N/A	N/A	3951
Villone, Ron RP WAS	-	Free Agent	0.0	0	0	0	0	0	0	0	0	0	0	N/A	N/A	3954
Sturge, Justin RP BOS	-	Free Agent	0.0	0	0	0	0	0	0	0	0	0	0	N/A	N/A	3957
Kleine, Victor RP CLE	-	Free Agent	0.0	0	0	0	0	0	0	0	0	0	0	N/A	N/A	3958
Andrade, Steve RP TB	-	Free Agent	0.0	0	0	0	0	0	0	0	0	0	0	N/A	N/A	3961
Walker, Andrew RP TEX	-	Free Agent	0.0	0	0	0	0	0	0	0	0	0	0	N/A	N/A	3962
Martinez, Carlos RP MIA	-	Free Agent	0.0	0	0	0	0	0	0	0	0	0	0	N/A	N/A	3969
Bastardo, Alberto RP LAD	-	Free Agent	0.0	0	0	0	0	0	0	0	0	0	0	N/A	N/A	3971
Burgos, Ambiorix RP NYM	-	Free Agent	0.0	0	0	0	0	0	0	0	0	0	0	N/A	N/A	3974
Lopez, Aquilino RP DET	-	Free Agent	0.0	0	0	0	0	0	0	0	0	0	0	N/A	N/A	3979
Puffer, Brandon RP SF	-	Free Agent	0.0	0	0	0	0	0	0	0	0	0	0	N/A	N/A	3981
Schultz, Mike RP ARI	-	Free Agent	0.0	0	0	0	0	0	0	0	0	0	0	N/A	N/A	3987
Anderson, Brian RP NYY	-	Free Agent	0.0	0	0	0	0	0	0	0	0	0	0	N/A	N/A	3988
Valdez, Eddy RP COL	-	Free Agent	0.0	0	0	0	0	0	0	0	0	0	0	N/A	N/A	3989
Mahon, Reid RP ARI	-	Free Agent	0.0	0	0	0	0	0	0	0	0	0	0	N/A	N/A	3991
Guerrieri, Taylor P TB	-	Free Agent	0.0	0	0	0	0	0	0	0	0	0	0	N/A	N/A	3996
Korpi, Wade P MIA	-	Free Agent	0.0	0	0	0	0	0	0	0	0	0	0	N/A	N/A	3998
Lugo, Ruddy RP DET	-	Free Agent	0.0	0	0	0	0	0	0	0	0	0	0	N/A	N/A	4002
Vizcaino, Luis RP CLE	-	Free Agent	0.0	0	0	0	0	0	0	0	0	0	0	N/A	N/A	4004
Graham, Andrew RP COL	-	Free Agent	0.0	0	0	0	0	0	0	0	0	0	0	N/A	N/A	4006
Gaffney, Scott P CIN	-	Free Agent	0.0	0	0	0	0	0	0	0	0	0	0	N/A	N/A	4009
Stutes, Kyle RP SD	-	Free Agent	0.0	0	0	0	0	0	0	0	0	0	0	N/A	N/A	4011
Driskill, Travis RP HOU	-	Free Agent	0.0	0	0	0	0	0	0	0	0	0	0	N/A	N/A	4013
Martin, Tom RP NYM	-	Free Agent	0.0	0	0	0	0	0	0	0	0	0	0	N/A	N/A	4016
Leach, Brent RP LAD	-	Free Agent	0.0	0	0	0	0	0	0	0	0	0	0	N/A	N/A	4024
Otero, Dan RP SF	-	Free Agent	0.0	0	0	0	0	0	0	0	0	0	0	N/A	N/A	4029
Megrew, Mike RP SD	-	Free Agent	0.0	0	0	0	0	0	0	0	0	0	0	N/A	N/A	4034
Switzer, Jon RP NYM	-	Free Agent	0.0	0	0	0	0	0	0	0	0	0	0	N/A	N/A	4038
McBride, Macay RP DET	-	Free Agent	0.0	0	0	0	0	0	0	0	0	0	0	N/A	N/A	4040
Bass, Brian RP PHI	-	Free Agent	0.0	0	0	0	0	0	0	0	0	0	0	N/A	N/A	4041
Buzachero, Bubbie RP TOR	-	Free Agent	0.0	0	0	0	0	0	0	0	0	0	0	N/A	N/A	4043
Baker, Brad RP ATL	-	Free Agent	0.0	0	0	0	0	0	0	0	0	0	0	N/A	N/A	4044
Buschmann, Matt RP SD	-	Free Agent	0.0	0	0	0	0	0	0	0	0	0	0	N/A	N/A	4053
Garceau, Shaun RP STL	-	Free Agent	0.0	0	0	0	0	0	0	0	0	0	0	N/A	N/A	4054
Estrada, Paul RP HOU	-	Free Agent	0.0	0	0	0	0	0	0	0	0	0	0	N/A	N/A	4058
Browning, Barret RP LAA	-	Free Agent	0.0	0	0	0	0	0	0	0	0	0	0	N/A	N/A	4059
Meque, Jacobo RP LAD	-	Free Agent	0.0	0	0	0	0	0	0	0	0	0	0	N/A	N/A	4062
Banwart, Travis P OAK	-	Free Agent	0.0	0	0	0	0	0	0	0	0	0	0	N/A	N/A	4064
Muyco, Dionisio RP CHC	-	Free Agent	0.0	0	0	0	0	0	0	0	0	0	0	N/A	N/A	4078
Bernero, Adam RP PIT	-	Free Agent	0.0	0	0	0	0	0	0	0	0	0	0	N/A	N/A	4083
MacLane, Evan RP STL	-	Free Agent	0.0	0	0	0	0	0	0	0	0	0	0	N/A	N/A	4094
Shafer, David RP CIN	-	Free Agent	0.0	0	0	0	0	0	0	0	0	0	0	N/A	N/A	4095
Trubee, Luke RP NYY	-	Free Agent	0.0	0	0	0	0	0	0	0	0	0	0	N/A	N/A	4097
Cassidy, Scott RP MIL	-	Free Agent	0.0	0	0	0	0	0	0	0	0	0	0	N/A	N/A	4101
Crouthers, Dave RP CHC	-	Free Agent	0.0	0	0	0	0	0	0	0	0	0	0	N/A	N/A	4104
Rodriguez, Derek RP CHW	-	Free Agent	0.0	0	0	0	0	0	0	0	0	0	0	N/A	N/A	4105
Bumatay, Mike RP BOS	-	Free Agent	0.0	0	0	0	0	0	0	0	0	0	0	N/A	N/A	4109
Meaux, Ryan RP SF	-	Free Agent	0.0	0	0	0	0	0	0	0	0	0	0	N/A	N/A	4121
Orvella, Chad RP LAA	-	Free Agent	0.0	0	0	0	0	0	0	0	0	0	0	N/A	N/A	4125
Bailey, Cory RP CHC	-	Free Agent	0.0	0	0	0	0	0	0	0	0	0	0	N/A	N/A	4128
Chapman, Jaye P ATL	-	Free Agent	0.0	0	0	0	0	0	0	0	0	0	0	N/A	N/A	4133
Sequea, Jacobo RP WAS	-	Free Agent	0.0	0	0	0	0	0	0	0	0	0	0	N/A	N/A	4135
Stanczyk, Ben RP MIL	-	Free Agent	0.0	0	0	0	0	0	0	0	0	0	0	N/A	N/A	4140
Thompson, Brad RP HOU	-	Free Agent	0.0	0	0	0	0	0	0	0	0	0	0	N/A	N/A	4141
Holdzkom, Lincoln RP BOS	-	Free Agent	0.0	0	0	0	0	0	0	0	0	0	0	N/A	N/A	4142
Childers, Jason RP TB	-	Free Agent	0.0	0	0	0	0	0	0	0	0	0	0	N/A	N/A	4144
Ward, Zachary RP MIN	-	Free Agent	0.0	0	0	0	0	0	0	0	0	0	0	N/A	N/A	4147
Italiano, Craig RP SD	-	Free Agent	0.0	0	0	0	0	0	0	0	0	0	0	N/A	N/A	4161
Chulk, Vinnie RP OAK	-	Free Agent	0.0	0	0	0	0	0	0	0	0	0	0	N/A	N/A	4162
Hill, Danny RP TOR	-	Free Agent	0.0	0	0	0	0	0	0	0	0	0	0	N/A	N/A	4164
Perkins, Vince RP TOR	-	Free Agent	0.0	0	0	0	0	0	0	0	0	0	0	N/A	N/A	4168
Castro, Fabio RP SEA	-	Free Agent	0.0	0	0	0	0	0	0	0	0	0	0	N/A	N/A	4169
Maestri, Alessandro RP CHC	-	Free Agent	0.0	0	0	0	0	0	0	0	0	0	0	N/A	N/A	4171
Bierd, Randor RP BOS	-	Free Agent	0.0	0	0	0	0	0	0	0	0	0	0	N/A	N/A	4188
Kim, Byung-Hyun RP SF	-	Free Agent	0.0	0	0	0	0	0	0	0	0	0	0	N/A	N/A	4189
Zimmermann, Bob RP LAA	-	Free Agent	0.0	0	0	0	0	0	0	0	0	0	0	N/A	N/A	4190
Journell, Jimmy RP CIN	-	Free Agent	0.0	0	0	0	0	0	0	0	0	0	0	N/A	N/A	4196
Reynoso, Paulino RP CHW	-	Free Agent	0.0	0	0	0	0	0	0	0	0	0	0	N/A	N/A	4197
Lentz, Richard RP BOS	-	Free Agent	0.0	0	0	0	0	0	0	0	0	0	0	N/A	N/A	4198
Nippert, Dustin RP TEX	-	Free Agent	0.0	0	0	0	0	0	0	0	0	0	0	N/A	N/A	4200
Mahay, Ron RP LAD	-	Free Agent	0.0	0	0	0	0	0	0	0	0	0	0	N/A	N/A	4201
Gallo, Mike D. RP TOR	-	Free Agent	0.0	0	0	0	0	0	0	0	0	0	0	N/A	N/A	4210
Sues, Jeff RP CHW	-	Free Agent	0.0	0	0	0	0	0	0	0	0	0	0	N/A	N/A	4211
Johnson, Nathan RP PHI	-	Free Agent	0.0	0	0	0	0	0	0	0	0	0	0	N/A	N/A	4215
Kemp, Beau RP TOR	-	Free Agent	0.0	0	0	0	0	0	0	0	0	0	0	N/A	N/A	4219
Kahn, Stephen RP SEA	-	Free Agent	0.0	0	0	0	0	0	0	0	0	0	0	N/A	N/A	4220
Johnson, David RP MIL	-	Free Agent	0.0	0	0	0	0	0	0	0	0	0	0	N/A	N/A	4225
Bueno, Francisley RP KC 	-	Free Agent	0.0	0	0	0	0	0	0	0	0	0	0	N/A	N/A	4228
Saarloos, Kirk RP CLE	-	Free Agent	0.0	0	0	0	0	0	0	0	0	0	0	N/A	N/A	4230
Morillo, Juan RP MIN	-	Free Agent	0.0	0	0	0	0	0	0	0	0	0	0	N/A	N/A	4231
Gwyn, Marcus RP MIA	-	Free Agent	0.0	0	0	0	0	0	0	0	0	0	0	N/A	N/A	4232
Gil, Francisco P NYY	-	Free Agent	0.0	0	0	0	0	0	0	0	0	0	0	N/A	N/A	4233
Kown, Andrew RP WAS	-	Free Agent	0.0	0	0	0	0	0	0	0	0	0	0	N/A	N/A	4234
Isenberg, Kurt RP SD	-	Free Agent	0.0	0	0	0	0	0	0	0	0	0	0	N/A	N/A	4240
Solano, Javier P LAD	-	Free Agent	0.0	0	0	0	0	0	0	0	0	0	0	N/A	N/A	4243
Park, Chan Ho RP PIT	-	Free Agent	0.0	0	0	0	0	0	0	0	0	0	0	N/A	N/A	4244
Santos, Victor RP SF	-	Free Agent	0.0	0	0	0	0	0	0	0	0	0	0	N/A	N/A	4245
Heyer, Craig RP NYY	-	Free Agent	0.0	0	0	0	0	0	0	0	0	0	0	N/A	N/A	4249
Madrigal, Warner RP NYY	-	Free Agent	0.0	0	0	0	0	0	0	0	0	0	0	N/A	N/A	4251
Jones, Greg RP LAD	-	Free Agent	0.0	0	0	0	0	0	0	0	0	0	0	N/A	N/A	4252
Barbara, Michael RP TOR	-	Free Agent	0.0	0	0	0	0	0	0	0	0	0	0	N/A	N/A	4254
Smit, Alexander RP CIN	-	Free Agent	0.0	0	0	0	0	0	0	0	0	0	0	N/A	N/A	4257
Espineli, Geno RP COL	-	Free Agent	0.0	0	0	0	0	0	0	0	0	0	0	N/A	N/A	4270
Nelson, Brad RP ATL	-	Free Agent	0.0	0	0	0	0	0	0	0	0	0	0	N/A	N/A	4275
Miller, Jason RP MIN	-	Free Agent	0.0	0	0	0	0	0	0	0	0	0	0	N/A	N/A	4276
Johnson, Blake P KC	-	Free Agent	0.0	0	0	0	0	0	0	0	0	0	0	N/A	N/A	4279
Day, Dewon RP OAK	-	Free Agent	0.0	0	0	0	0	0	0	0	0	0	0	N/A	N/A	4283
Sharpe, Steven RP OAK	-	Free Agent	0.0	0	0	0	0	0	0	0	0	0	0	N/A	N/A	4286
Romero, Felix RP SF	-	Free Agent	0.0	0	0	0	0	0	0	0	0	0	0	N/A	N/A	4291
Choi, Hyang-Nam RP LAD	-	Free Agent	0.0	0	0	0	0	0	0	0	0	0	0	N/A	N/A	4292
Baker, Brian RP TB	-	Free Agent	0.0	0	0	0	0	0	0	0	0	0	0	N/A	N/A	4294
Tamayo, Ignacio RP KC	-	Free Agent	0.0	0	0	0	0	0	0	0	0	0	0	N/A	N/A	4296
Ortiz, Joseph P TEX	-	Free Agent	0.0	0	0	0	0	0	0	0	0	0	0	N/A	N/A	4303
Elliott, Matthew RP ARI	-	Free Agent	0.0	0	0	0	0	0	0	0	0	0	0	N/A	N/A	4304
