Reed, Evan RP MIA	-	Free Agent	0.0	0	0	0	0	0	0	0	0	0	0	N/A	N/A	1000
Alvarez, Manny RP NYM	-	Free Agent	0.0	0	0	0	0	0	0	0	0	0	0	N/A	N/A	1003
Ray, Robert RP TOR	-	Free Agent	0.0	0	0	0	0	0	0	0	0	0	0	N/A	N/A	1004
Bush, Matt RP TB	-	Free Agent	0.0	0	0	0	0	0	0	0	0	0	0	N/A	N/A	1008
Nunez, Jhonny RP TB	-	Free Agent	0.0	0	0	0	0	0	0	0	0	0	0	N/A	N/A	1009
Aguero, Ramon RP TEX	-	Free Agent	0.0	0	0	0	0	0	0	0	0	0	0	N/A	N/A	1011
Beltre, Omar RP TEX	-	Free Agent	0.0	0	0	0	0	0	0	0	0	0	0	N/A	N/A	1012
Smit, Kyle RP CHC	-	Free Agent	0.0	0	0	0	0	0	0	0	0	0	0	N/A	N/A	1013
King, Blake RP HOU	-	Free Agent	0.0	0	0	0	0	0	0	0	0	0	0	N/A	N/A	1015
Feliciano, Pedro RP NYY	-	Free Agent	0.0	0	0	0	0	0	0	0	0	0	0	N/A	N/A	1017
Poreda, Aaron RP SD 	-	Free Agent	0.0	0	0	0	0	0	0	0	0	0	0	N/A	N/A	1018
Reifer, Adam RP STL	-	Free Agent	0.0	0	0	0	0	0	0	0	0	0	0	N/A	N/A	1019
Infante, Gregory RP CHW	-	Free Agent	0.0	0	0	0	0	0	0	0	0	0	0	N/A	N/A	1026
Kopp, David RP STL	-	Free Agent	0.0	0	0	0	0	0	0	0	0	0	0	N/A	N/A	1030
Casilla, Jose RP SF	-	Free Agent	0.0	0	0	0	0	0	0	0	0	0	0	N/A	N/A	1032
Ortega, Jose RP DET	-	Free Agent	0.0	0	0	0	0	0	0	0	0	0	0	N/A	N/A	1034
Paredes, Edward RP SEA	-	Free Agent	0.0	0	0	0	0	0	0	0	0	0	0	N/A	N/A	1035
Septimo, Leyson RP CHW	-	Free Agent	0.0	0	0	0	0	0	0	0	0	0	0	N/A	N/A	1038
Van Mil, Loek RP LAA	-	Free Agent	0.0	0	0	0	0	0	0	0	0	0	0	N/A	N/A	1039
Schlichting, Travis RP LAD	-	Free Agent	0.0	0	0	0	0	0	0	0	0	0	0	N/A	N/A	1040
Castillo, Fabio RP TEX	-	Free Agent	0.0	0	0	0	0	0	0	0	0	0	0	N/A	N/A	1041
Todd, Jess RP STL	-	Free Agent	0.0	0	0	0	0	0	0	0	0	0	0	N/A	N/A	1049
Carter, Anthony RP CHW	-	Free Agent	0.0	0	0	0	0	0	0	0	0	0	0	N/A	N/A	1050
Caminero, Arquimedes RP MIA	-	Free Agent	0.0	0	0	0	0	0	0	0	0	0	0	N/A	N/A	1051
Valiquette, Philippe RP SEA	-	Free Agent	0.0	0	0	0	0	0	0	0	0	0	0	N/A	N/A	1053
Marte, Damaso RP NYY 	-	Free Agent	0.0	0	0	0	0	0	0	0	0	0	0	N/A	N/A	1054
Barrera, Henry RP KC	-	Free Agent	0.0	0	0	0	0	0	0	0	0	0	0	N/A	N/A	1055
Arias, Alberto RP HOU	-	Free Agent	0.0	0	0	0	0	0	0	0	0	0	0	N/A	N/A	1056
James, Justin RP MIL	-	Free Agent	0.0	0	0	0	0	0	0	0	0	0	0	N/A	N/A	1057
Mulvey, Kevin RP ARI	-	Free Agent	0.0	0	0	0	0	0	0	0	0	0	0	N/A	N/A	1058
Schlitter, Brian RP CHC	-	Free Agent	0.0	0	0	0	0	0	0	0	0	0	0	N/A	N/A	1059
Belisario, Ronald RP LAD 	-	Free Agent	0.0	0	0	0	0	0	0	0	0	0	0	N/A	N/A	1061
Ortega, Yonata RP ARI	-	Free Agent	0.0	0	0	0	0	0	0	0	0	0	0	N/A	N/A	1063
Leon, Arcenio RP HOU	-	Free Agent	0.0	0	0	0	0	0	0	0	0	0	0	N/A	N/A	1064
Monasterios, Carlos RP LAD	-	Free Agent	0.0	0	0	0	0	0	0	0	0	0	0	N/A	N/A	1066
Hinshaw, Alex RP SF	-	Free Agent	0.0	0	0	0	0	0	0	0	0	0	0	N/A	N/A	1068
Farina, Alan RP TOR	-	Free Agent	0.0	0	0	0	0	0	0	0	0	0	0	N/A	N/A	1069
Parra, Manny RP MIL 	-	Free Agent	0.0	0	0	0	0	0	0	0	0	0	0	N/A	N/A	1071
Hyde, Lee RP WAS	-	Free Agent	0.0	0	0	0	0	0	0	0	0	0	0	N/A	N/A	1078
Hatcher, Chris RP MIA	-	Free Agent	0.0	0	0	0	0	0	0	0	0	0	0	N/A	N/A	1080
Weathers, Casey RP CHC 	-	Free Agent	0.0	0	0	0	0	0	0	0	0	0	0	N/A	N/A	1081
De Leon, Jorge RP HOU	-	Free Agent	0.0	0	0	0	0	0	0	0	0	0	0	N/A	N/A	1083
Aardsma, David RP SEA 	-	Disco Bush Horticulturists	0.0	0	0	0	0	0	0	0	0	0	0	N/A	N/A	1084
Carlson, Jesse RP BOS 	-	Free Agent	0.0	0	0	0	0	0	0	0	0	0	0	N/A	N/A	1087
Villar, Henry RP HOU	-	Free Agent	0.0	0	0	0	0	0	0	0	0	0	0	N/A	N/A	1088
Richardson, Dustin RP ATL	-	Free Agent	0.0	0	0	0	0	0	0	0	0	0	0	N/A	N/A	1089
Dolsi, Freddy RP CHW	-	Free Agent	0.0	0	0	0	0	0	0	0	0	0	0	N/A	N/A	1090
Carr, Adam RP WAS	-	Free Agent	0.0	0	0	0	0	0	0	0	0	0	0	N/A	N/A	1094
Caridad, Esmailin RP CHC	-	Free Agent	0.0	0	0	0	0	0	0	0	0	0	0	N/A	N/A	1096
Diamond, Thomas RP CHC	-	Free Agent	0.0	0	0	0	0	0	0	0	0	0	0	N/A	N/A	1097
Rosario, Sandy RP MIA	-	Free Agent	3.7	0	0	0	0	0	0	0	2	2	5	2.454	1.9091	1098
Palmer, Matt RP LAA	-	Free Agent	15.7	3	1	0	1	1	0	0	7	4	19	5.745	1.4681	1100
Fiers, Michael RP MIL	-	Free Agent	2.0	0	0	0	0	0	0	0	2	3	2	0.000	2.5000	1102
Walters, P.J. RP MIN	-	Free Agent	5.0	0	0	0	0	0	0	0	4	3	3	7.200	1.2000	1103
Gaub, John RP CHC	-	Free Agent	2.7	0	0	0	0	0	0	0	3	2	2	6.750	1.5000	1114
Carpenter, Chris RP CHC	-	Free Agent	9.7	0	0	0	0	0	0	0	8	7	12	2.793	1.9655	1117
Magnuson, Trystan RP TOR	-	Free Agent	14.7	0	0	0	0	0	0	0	11	5	15	6.136	1.3636	1118
Gordon, Brian RP NYY	-	Free Agent	10.3	2	0	0	0	1	0	0	4	3	12	5.226	1.4516	1120
Stevens, Jeff RP CHC 	-	Free Agent	7.0	0	0	0	0	0	0	0	4	7	4	5.143	1.5714	1129
Burton, Jared RP MIN	-	Free Agent	4.7	0	0	0	0	0	0	0	3	3	6	3.857	1.9286	1139
Herrera, Danny RP NYM	-	Free Agent	9.7	0	0	0	0	1	0	0	5	3	13	4.655	1.6552	1143
Kirkman, Michael RP TEX	-	Free Agent	27.3	0	0	0	1	1	0	0	21	12	26	6.585	1.3902	1147
Maya, Yunesky SP WAS	-	Free Agent	32.7	5	1	0	1	1	0	0	15	10	40	5.235	1.5306	1158
Valdez, Merkin RP TEX	-	Free Agent	4.3	0	0	0	0	0	0	0	6	1	7	6.231	1.8462	1160
Harrell, Lucas RP HOU	-	Free Agent	18.0	2	0	0	0	2	0	0	15	8	23	4.500	1.7222	1161
Zagurski, Mike RP ARI	-	Free Agent	3.3	0	0	0	0	0	0	0	4	3	4	5.400	2.1000	1163
Deduno, Samuel RP MIN	-	Free Agent	3.0	0	0	0	0	0	0	0	4	3	5	3.000	2.6667	1170
Gutierrez, Juan RP KC 	-	Free Agent	18.3	0	0	0	0	0	0	1	23	9	22	5.400	1.6909	1174
James, Chuck RP MIN 	-	Free Agent	10.3	0	0	0	0	0	0	0	8	4	12	6.097	1.5484	1176
Perry, Ryan RP WAS 	-	Free Agent	37.0	0	0	0	2	0	0	1	24	21	39	5.351	1.6216	1177
Herrera, Kelvin RP KC	-	Free Agent	2.0	0	0	0	0	1	0	0	0	0	2	13.500	1.0000	1178
Reynolds, Greg RP COL 	-	Free Agent	32.0	3	1	0	3	0	0	0	18	10	40	6.188	1.5625	1182
Hottovy, Tommy RP BOS	-	Free Agent	4.0	0	0	0	0	0	0	0	2	3	4	6.750	1.7500	1183
Whelan, Kevin RP NYY	-	Free Agent	1.7	0	0	0	0	0	0	0	1	5	0	5.400	3.0000	1187
Accardo, Jeremy RP BAL	-	Free Agent	37.7	0	0	0	3	3	0	1	23	18	43	5.734	1.6195	1190
Rupe, Josh RP BAL	-	Free Agent	14.3	0	0	0	0	0	0	0	7	6	16	5.651	1.5349	1191
Brazoban, Yhency RP ARI	-	Free Agent	6.0	0	0	0	0	0	0	1	8	4	8	6.000	2.0000	1199
Weinhardt, Robbie RP DET	-	Free Agent	1.7	0	0	0	0	0	0	0	1	0	4	10.800	2.4000	1201
Wagner, Neil RP OAK	-	Free Agent	5.0	0	0	0	0	0	0	0	4	3	6	7.200	1.8000	1203
Germano, Justin RP CLE	-	Free Agent	12.7	0	0	0	0	1	0	0	5	5	15	5.684	1.5789	1206
Stinson, Josh RP NYM	-	Free Agent	13.0	0	0	0	0	2	1	1	8	7	14	6.923	1.6154	1207
Green, Sean RP MIL	-	Free Agent	11.7	0	0	0	0	1	0	0	7	6	14	5.400	1.7143	1212
Kroenke, Zach RP ARI	-	Free Agent	4.0	0	0	0	0	1	0	0	3	1	6	9.000	1.7500	1214
DiFelice, Mark RP MIL	-	Free Agent	3.0	0	0	0	0	0	0	0	3	2	3	12.000	1.6667	1218
Richards, Garrett RP LAA	-	Free Agent	14.0	3	0	0	0	2	0	0	9	7	16	5.786	1.6429	1219
Beimel, Joe RP PIT	-	Free Agent	25.3	0	0	0	1	1	0	2	17	9	34	5.329	1.6974	1221
Doubront, Felix RP BOS	-	Free Agent	10.3	0	0	0	0	0	1	0	6	8	12	6.097	1.9355	1222
Brach, Brad RP SD	-	Free Agent	7.0	0	0	0	0	2	0	0	11	7	9	5.143	2.2857	1224
Hendrickson, Mark RP BAL	-	Free Agent	11.0	0	0	0	1	0	0	0	5	6	15	5.727	1.9091	1225
Tucker, Ryan RP LAD	-	Free Agent	5.0	0	0	0	0	0	0	0	4	4	6	7.200	2.0000	1226
Ramirez, Horacio RP LAA	-	Free Agent	9.0	0	0	0	1	0	0	0	4	2	16	6.000	2.0000	1227
Mickolio, Kam RP ARI	-	Free Agent	6.7	0	0	0	0	0	0	0	7	3	10	6.750	1.9500	1228
Kluber, Corey RP CLE	-	Free Agent	4.3	0	0	0	0	0	0	0	5	3	6	8.308	2.0769	1231
Gonzalez, Edgar RP OAK	-	Free Agent	2.0	0	0	0	0	0	0	0	1	1	5	9.000	3.0000	1232
Tobin, Mason RP TEX 	-	Free Agent	5.3	0	0	0	0	0	0	0	0	5	5	6.750	1.8750	1233
Williams, Randy RP BOS	-	Free Agent	8.3	0	0	0	0	1	0	0	6	5	10	6.480	1.8000	1236
Ascanio, Jose RP LAD	-	Free Agent	6.3	0	0	0	0	0	0	0	5	2	10	7.105	1.8947	1240
Sonnanstine, Andy RP CHC 	-	Free Agent	35.7	4	0	0	0	2	0	0	12	12	40	5.551	1.4579	1241
Reyes, Dennys RP BOS	-	Free Agent	1.7	0	0	0	0	0	0	0	1	2	2	16.200	2.4000	1243
Broderick, Brian RP STL	-	Free Agent	12.3	0	0	0	0	1	0	0	4	3	16	6.568	1.5405	1244
Eppley, Cody RP TEX	-	Free Agent	9.0	0	0	0	1	1	0	1	6	5	11	8.000	1.7778	1245
Gearrin, Cory RP ATL	-	Free Agent	18.3	0	0	0	1	1	0	1	25	12	17	7.854	1.5818	1246
Viola, Pedro RP BAL	-	Free Agent	3.7	0	0	0	0	0	0	0	4	2	6	9.818	2.1818	1249
Texeira, Kanekoa RP CIN	-	Free Agent	6.3	0	0	0	0	0	0	0	0	3	13	2.842	2.5263	1253
Bush, Dave RP PHI	-	Free Agent	37.3	3	0	0	0	1	0	0	23	9	47	5.786	1.5000	1256
Pena, Tony RP CHW	-	Free Agent	20.3	0	0	0	1	1	0	1	17	10	25	6.197	1.7213	1257
Heilman, Aaron RP ARI	-	Free Agent	35.3	0	0	0	4	1	0	1	33	11	48	6.877	1.6698	1258
Cortes, Dan RP SEA	-	Free Agent	10.7	0	0	0	0	2	0	0	3	6	13	5.906	1.7812	1260
Wood, Tim RP PIT	-	Free Agent	8.0	0	0	0	0	3	0	0	2	8	8	5.625	2.0000	1262
Judy, Josh RP CIN 	-	Free Agent	14.0	0	0	0	0	0	0	0	10	4	18	7.071	1.5714	1264
Scribner, Evan RP OAK	-	Free Agent	14.0	0	0	0	0	0	0	0	10	4	18	7.071	1.5714	1265
Runzler, Dan RP SF	-	Free Agent	27.3	1	0	0	1	2	0	0	25	16	29	6.256	1.6463	1268
Manship, Jeff RP MIN	-	Free Agent	3.3	0	0	0	0	0	0	0	2	4	5	8.100	2.7000	1270
Daley, Matt RP COL 	-	Free Agent	6.0	0	0	0	0	0	0	0	7	2	8	10.500	1.6667	1272
Farquhar, Danny RP TOR	-	Free Agent	2.0	0	0	0	0	0	0	0	1	2	4	13.500	3.0000	1273
Braddock, Zach RP MIL	-	Free Agent	17.3	0	0	0	0	1	0	1	18	11	16	7.269	1.5577	1274
Tejeda, Robinson RP CLE 	-	Free Agent	7.3	0	0	0	0	1	0	0	2	3	12	6.136	2.0455	1275
Gaudin, Chad RP WAS 	-	Free Agent	8.3	0	0	0	1	1	0	0	10	8	12	6.480	2.4000	1276
Fulchino, Jeff RP WAS 	-	Free Agent	34.7	0	0	0	1	4	0	3	33	22	37	5.712	1.7019	1277
Baez, Danys RP PHI	-	Free Agent	36.0	0	0	0	2	4	0	1	18	13	43	6.250	1.5556	1278
Kinney, Josh RP SEA 	-	Free Agent	17.7	0	0	0	0	0	0	0	20	7	23	6.623	1.6981	1280
Mijares, Jose RP KC 	-	Free Agent	49.0	0	0	0	0	2	0	2	30	30	53	4.592	1.6939	1281
Kohn, Michael RP LAA	-	Free Agent	12.3	0	0	0	0	1	1	1	9	9	14	7.297	1.8649	1282
Durbin, Chad RP CLE	-	Free Agent	68.3	0	0	0	2	2	0	1	59	26	86	5.532	1.6390	1288
Bergesen, Brad SP BAL	-	Free Agent	101.0	12	3	1	2	7	0	0	61	32	119	5.703	1.4950	1289
De La Rosa, Dane RP TB	-	Free Agent	7.3	0	0	0	0	0	0	0	8	3	10	9.818	1.7727	1292
Del Rosario, Enerio RP HOU	-	Free Agent	53.0	0	0	0	0	3	0	2	31	31	59	4.585	1.6981	1296
Buente, Jay RP TB	-	Free Agent	5.0	1	0	0	0	1	0	0	2	5	7	9.000	2.4000	1303
Slaten, Doug RP WAS 	-	Free Agent	16.3	0	0	0	0	2	0	0	13	9	26	4.408	2.1429	1305
Pendleton, Lance RP HOU	-	Free Agent	18.7	0	0	0	0	0	0	0	13	11	20	6.750	1.6607	1306
Misch, Pat RP PHI	-	Free Agent	7.0	0	0	0	1	0	0	0	5	4	11	10.286	2.1429	1307
Delaney, Rob RP TB	-	Free Agent	5.0	0	0	0	0	0	0	0	3	7	4	10.800	2.2000	1308
Norberto, Jordan RP OAK	-	Free Agent	6.7	0	0	0	0	0	0	0	4	7	8	8.100	2.2500	1309
Villarreal, Brayan RP DET	-	Free Agent	16.0	0	0	0	1	1	0	0	14	10	21	6.750	1.9375	1311
Asencio, Jairo RP ATL	-	Free Agent	10.3	0	0	0	0	0	0	1	8	5	16	6.968	2.0323	1313
Boyer, Blaine RP NYM	-	Free Agent	6.7	0	0	0	0	2	1	0	1	1	13	10.800	2.1000	1315
Jenks, Bobby RP BOS 	-	Free Agent	15.7	0	0	0	2	2	0	2	17	13	22	6.319	2.2340	1316
Cleto, Maikel RP STL	-	Free Agent	4.3	0	0	0	0	0	0	0	6	4	7	12.461	2.5385	1322
Augenstein, Bryan RP STL	-	Free Agent	5.7	0	0	0	0	1	0	0	6	3	11	9.529	2.4706	1324
Lewis, Rommie RP TOR	-	Free Agent	5.0	0	0	0	0	0	0	0	5	2	12	9.000	2.8000	1327
Cook, Ryan RP OAK 	-	Free Agent	7.7	0	0	0	0	1	0	0	7	8	11	7.043	2.4783	1330
Miller, Andrew SP BOS 	-	Free Agent	65.0	12	3	0	6	3	0	0	50	41	77	5.538	1.8154	1331
Carpenter, Andrew RP TOR	-	Free Agent	14.7	0	0	0	0	0	0	1	16	7	19	7.977	1.7727	1332
Hoey, Jim RP TOR 	-	Free Agent	24.7	0	0	0	1	2	0	1	14	13	34	5.473	1.9054	1333
Lyon, Brandon RP HOU 	-	Free Agent	13.3	0	0	0	3	3	4	4	6	5	27	11.475	2.4000	1334
Purcey, David RP PHI 	-	Free Agent	33.7	0	0	0	1	2	0	0	22	27	33	5.614	1.7822	1335
VandenHurk, Rick RP BAL	-	Free Agent	9.0	2	0	0	0	0	0	0	7	8	12	8.000	2.2222	1338
Cedeno, Xavier RP HOU	-	Free Agent	1.7	0	0	0	0	0	0	0	0	0	7	27.000	4.2000	1341
Valdez, Jose RP HOU	-	Free Agent	14.0	0	0	0	0	0	0	0	15	7	17	9.000	1.7143	1342
Thompson, Aaron RP MIN	-	Free Agent	7.7	1	0	0	0	0	0	0	1	6	13	7.043	2.4783	1343
Berken, Jason RP BAL	-	Free Agent	47.0	0	0	0	1	2	0	3	41	21	63	5.362	1.7872	1344
Slowey, Kevin SP COL 	-	Free Agent	59.3	8	2	0	0	8	0	0	34	5	78	6.674	1.3989	1346
Bruney, Brian RP CHW	-	Free Agent	19.7	0	0	0	1	0	0	0	16	12	26	6.864	1.9322	1348
Maine, Scott RP CHC	-	Free Agent	7.0	0	0	0	0	0	0	0	5	5	11	10.286	2.2857	1349
Chavez, Jesse RP KC 	-	Free Agent	7.7	0	0	0	0	0	0	0	8	5	12	10.565	2.2174	1350
Thompson, Daryl RP MIN	-	Free Agent	3.0	0	0	0	0	1	0	0	0	5	6	15.000	3.6667	1352
Abad, Fernando RP HOU	-	Free Agent	19.7	0	0	0	1	4	0	2	15	9	28	7.322	1.8814	1353
Lindsay, Shane RP CHW 	-	Free Agent	6.0	0	0	0	0	0	0	0	6	5	11	12.000	2.6667	1356
Gonzalez, Enrique RP DET	-	Free Agent	9.0	0	0	0	0	0	0	1	3	7	12	10.000	2.1111	1357
Sanit, Amauri RP NYY	-	Free Agent	7.0	0	0	0	0	0	0	0	4	3	12	12.857	2.1429	1358
Thomas, Brad RP DET	-	Free Agent	11.0	0	0	0	0	1	0	0	7	6	17	9.000	2.0909	1359
Atkins, Mitch RP BAL	-	Free Agent	10.7	3	1	0	0	0	0	0	7	3	21	8.438	2.2500	1361
Billings, Bruce RP OAK	-	Free Agent	7.0	0	0	0	0	0	0	0	7	6	13	10.286	2.7143	1362
Jepsen, Kevin RP LAA	-	Free Agent	13.0	0	0	0	1	2	0	1	6	9	21	7.615	2.3077	1364
Troncoso, Ramon RP LAD	-	Free Agent	22.7	0	0	0	0	0	0	0	14	4	38	6.750	1.8529	1365
Worrell, Mark RP BAL	-	Free Agent	2.0	0	0	0	0	0	0	0	3	2	6	36.000	4.0000	1366
Jakubauskas, Chris SP BAL	-	Free Agent	72.3	6	0	0	2	2	0	0	52	29	93	5.723	1.6866	1368
Hughes, Dusty RP ATL	-	Free Agent	12.7	0	0	0	1	0	0	0	11	8	19	9.947	2.1316	1370
Carrasco, D.J. RP NYM	-	Free Agent	49.3	1	0	0	1	3	0	1	27	16	67	6.020	1.6824	1373
Crotta, Mike RP PIT	-	Free Agent	10.7	0	0	0	0	1	0	1	7	5	20	9.281	2.3438	1374
Smith, Jordan RP CIN	-	Free Agent	20.0	0	0	0	0	0	0	1	13	8	32	7.200	2.0000	1375
Kuo, Hong-Chih RP LAD 	-	Free Agent	27.0	0	0	0	1	2	0	2	36	23	24	9.000	1.7407	1377
Cormier, Lance RP LAD	-	Free Agent	13.7	0	0	0	0	1	0	0	7	5	22	9.878	1.9756	1379
Mills, Brad RP LAA 	-	Free Agent	18.3	4	1	0	1	2	0	0	18	12	23	9.818	1.9091	1380
Tallet, Brian RP TOR	-	Free Agent	13.3	0	0	0	0	2	0	1	10	7	22	9.450	2.1750	1381
Ledezma, Wil RP LAD	-	Free Agent	6.0	0	0	0	0	0	0	0	6	7	11	15.000	3.0000	1382
Edlefsen, Steve RP SF	-	Free Agent	11.3	0	0	0	0	0	0	0	6	10	17	9.529	2.3824	1384
Wuertz, Michael RP OAK	-	Free Agent	33.7	0	0	0	0	0	0	1	32	26	37	6.683	1.8713	1385
Franklin, Ryan RP STL 	-	Free Agent	27.7	0	0	0	1	4	1	4	17	7	44	8.458	1.8434	1386
Maloney, Matt RP MIN	-	Free Agent	18.7	2	0	0	0	3	0	0	13	4	36	9.161	2.1429	1391
Proctor, Scott RP NYY	-	Free Agent	40.3	0	0	0	2	6	0	2	29	31	50	7.141	2.0083	1396
Rogers, Esmil SP COL	-	Free Agent	83.0	13	3	0	6	6	0	0	63	47	110	7.048	1.8916	1404
Smith, Matt A. RP CHW	-	Free Agent	0.0	0	0	0	0	0	0	0	0	0	0	N/A	N/A	1409
Shiell, Jason RP MIL	-	Free Agent	0.0	0	0	0	0	0	0	0	0	0	0	N/A	N/A	1411
Gordon, Tom RP ARI	-	Free Agent	0.0	0	0	0	0	0	0	0	0	0	0	N/A	N/A	1412
Brigham, Jake P TEX	-	Free Agent	0.0	0	0	0	0	0	0	0	0	0	0	N/A	N/A	1413
Leon, Arnold RP OAK	-	Free Agent	0.0	0	0	0	0	0	0	0	0	0	0	N/A	N/A	1414
Peguero, Jailen RP HOU	-	Free Agent	0.0	0	0	0	0	0	0	0	0	0	0	N/A	N/A	1422
Long, Matt RP CHW	-	Free Agent	0.0	0	0	0	0	0	0	0	0	0	0	N/A	N/A	1424
Cruz, Rhiner RP HOU	-	Free Agent	0.0	0	0	0	0	0	0	0	0	0	0	N/A	N/A	1426
Rainville, Jay RP MIN	-	Free Agent	0.0	0	0	0	0	0	0	0	0	0	0	N/A	N/A	1431
Jones, Jason M. RP WAS	-	Free Agent	0.0	0	0	0	0	0	0	0	0	0	0	N/A	N/A	1438
Parisi, Mike RP CHC	-	Free Agent	0.0	0	0	0	0	0	0	0	0	0	0	N/A	N/A	1440
Turpen, Daniel RP BOS 	-	Free Agent	0.0	0	0	0	0	0	0	0	0	0	0	N/A	N/A	1441
Banks, Demetrius RP CHW	-	Free Agent	0.0	0	0	0	0	0	0	0	0	0	0	N/A	N/A	1445
Meyer, Dan RP PHI	-	Free Agent	0.0	0	0	0	0	0	0	0	0	0	0	N/A	N/A	1446
Weathers, David RP MIL	-	Free Agent	0.0	0	0	0	0	0	0	0	0	0	0	N/A	N/A	1455
Johnson, Tyler J. RP SEA	-	Free Agent	0.0	0	0	0	0	0	0	0	0	0	0	N/A	N/A	1460
Gailey, Frank P TOR 	-	Free Agent	0.0	0	0	0	0	0	0	0	0	0	0	N/A	N/A	1462
Kensing, Logan RP PIT 	-	Free Agent	0.0	0	0	0	0	0	0	0	0	0	0	N/A	N/A	1463
Nabors, Kevin RP LAA	-	Free Agent	0.0	0	0	0	0	0	0	0	0	0	0	N/A	N/A	1467
Ramirez, Erasmo RP MIL	-	Free Agent	0.0	0	0	0	0	0	0	0	0	0	0	N/A	N/A	1469
Ramos, Mario RP OAK	-	Free Agent	0.0	0	0	0	0	0	0	0	0	0	0	N/A	N/A	1471
Mitchell, Mike RP OAK	-	Free Agent	0.0	0	0	0	0	0	0	0	0	0	0	N/A	N/A	1472
De La Cruz, Jose RP SEA	-	Free Agent	0.0	0	0	0	0	0	0	0	0	0	0	N/A	N/A	1475
McLeary, Marty RP MIL	-	Free Agent	0.0	0	0	0	0	0	0	0	0	0	0	N/A	N/A	1481
Muecke, Josh RP COL	-	Free Agent	0.0	0	0	0	0	0	0	0	0	0	0	N/A	N/A	1485
Hand, Donovan P MIL	-	Free Agent	0.0	0	0	0	0	0	0	0	0	0	0	N/A	N/A	1489
Cameron, Kevin RP OAK	-	Free Agent	0.0	0	0	0	0	0	0	0	0	0	0	N/A	N/A	1490
Wlodarczyk, Michael RP TB	-	Free Agent	0.0	0	0	0	0	0	0	0	0	0	0	N/A	N/A	1491
Embree, Alan RP CHW	-	Free Agent	0.0	0	0	0	0	0	0	0	0	0	0	N/A	N/A	1498
Barnette, Tony RP ARI	-	Free Agent	0.0	0	0	0	0	0	0	0	0	0	0	N/A	N/A	1500
Alvarez, Carlos RP LAD	-	Free Agent	0.0	0	0	0	0	0	0	0	0	0	0	N/A	N/A	1501
Sillman, Mike RP STL	-	Free Agent	0.0	0	0	0	0	0	0	0	0	0	0	N/A	N/A	1503
Santiago, Julio RP SEA	-	Free Agent	0.0	0	0	0	0	0	0	0	0	0	0	N/A	N/A	1506
Zinicola, Zech RP TOR 	-	Free Agent	0.0	0	0	0	0	0	0	0	0	0	0	N/A	N/A	1508
Borrell, Danny RP NYY	-	Free Agent	0.0	0	0	0	0	0	0	0	0	0	0	N/A	N/A	1509
Zavada, Clay RP ARI	-	Free Agent	0.0	0	0	0	0	0	0	0	0	0	0	N/A	N/A	1516
Maekawa, Katsuhiko RP STL	-	Free Agent	0.0	0	0	0	0	0	0	0	0	0	0	N/A	N/A	1518
Hoorelbeke, Casey RP LAD	-	Free Agent	0.0	0	0	0	0	0	0	0	0	0	0	N/A	N/A	1519
Maust, David RP WAS	-	Free Agent	0.0	0	0	0	0	0	0	0	0	0	0	N/A	N/A	1525
Curreri, Frank RP ARI	-	Free Agent	0.0	0	0	0	0	0	0	0	0	0	0	N/A	N/A	1531
Koplove, Mike RP SD	-	Free Agent	0.0	0	0	0	0	0	0	0	0	0	0	N/A	N/A	1532
Malaska, Mark RP TB	-	Free Agent	0.0	0	0	0	0	0	0	0	0	0	0	N/A	N/A	1533
White, Sean RP COL	-	Free Agent	0.0	0	0	0	0	0	0	0	0	0	0	N/A	N/A	1536
Lincoln, Mike RP CIN	-	Free Agent	0.0	0	0	0	0	0	0	0	0	0	0	N/A	N/A	1541
Testa, Joe RP WAS	-	Free Agent	0.0	0	0	0	0	0	0	0	0	0	0	N/A	N/A	1542
Davidson, Dave RP BAL	-	Free Agent	0.0	0	0	0	0	0	0	0	0	0	0	N/A	N/A	1543
Macdonald, Mike RP TOR	-	Free Agent	0.0	0	0	0	0	0	0	0	0	0	0	N/A	N/A	1547
Fick, Chuckie RP STL	-	Free Agent	0.0	0	0	0	0	0	0	0	0	0	0	N/A	N/A	1551
Gosling, Mike RP CLE	-	Free Agent	0.0	0	0	0	0	0	0	0	0	0	0	N/A	N/A	1552
Houston, Ryan RP LAA	-	Free Agent	0.0	0	0	0	0	0	0	0	0	0	0	N/A	N/A	1553
Mendoza, Tommy RP LAA	-	Free Agent	0.0	0	0	0	0	0	0	0	0	0	0	N/A	N/A	1555
Yates, Tyler RP PIT	-	Free Agent	0.0	0	0	0	0	0	0	0	0	0	0	N/A	N/A	1558
Marte, Jose RP ARI	-	Free Agent	0.0	0	0	0	0	0	0	0	0	0	0	N/A	N/A	1561
Campos, Machado RP NYM	-	Free Agent	0.0	0	0	0	0	0	0	0	0	0	0	N/A	N/A	1562
Hennessey, Brad RP MIN	-	Free Agent	0.0	0	0	0	0	0	0	0	0	0	0	N/A	N/A	1572
Mata, Frank RP MIA	-	Free Agent	0.0	0	0	0	0	0	0	0	0	0	0	N/A	N/A	1574
Fossum, Casey RP CHC	-	Free Agent	0.0	0	0	0	0	0	0	0	0	0	0	N/A	N/A	1576
Cavazos, Andy RP NYM	-	Free Agent	0.0	0	0	0	0	0	0	0	0	0	0	N/A	N/A	1579
Pereira, Nick RP SF	-	Free Agent	0.0	0	0	0	0	0	0	0	0	0	0	N/A	N/A	1581
Crawford, Evan RP TOR	-	Free Agent	0.0	0	0	0	0	0	0	0	0	0	0	N/A	N/A	1588
Capellan, Jose F. RP HOU	-	Free Agent	0.0	0	0	0	0	0	0	0	0	0	0	N/A	N/A	1597
Rleal, Sendy RP BAL	-	Free Agent	0.0	0	0	0	0	0	0	0	0	0	0	N/A	N/A	1604
Hayes, Christopher RP KC	-	Free Agent	0.0	0	0	0	0	0	0	0	0	0	0	N/A	N/A	1607
Paulk, Robert RP NYM	-	Free Agent	0.0	0	0	0	0	0	0	0	0	0	0	N/A	N/A	1611
Lugo, Ebelin P PHI	-	Free Agent	0.0	0	0	0	0	0	0	0	0	0	0	N/A	N/A	1613
Newby, Kyler RP ARI	-	Free Agent	0.0	0	0	0	0	0	0	0	0	0	0	N/A	N/A	1617
Olson, Justin RP MIN	-	Free Agent	0.0	0	0	0	0	0	0	0	0	0	0	N/A	N/A	1620
Weis, Brad RP OAK	-	Free Agent	0.0	0	0	0	0	0	0	0	0	0	0	N/A	N/A	1621
Sarfate, Dennis RP BAL	-	Free Agent	0.0	0	0	0	0	0	0	0	0	0	0	N/A	N/A	1624
Sisco, Andrew RP NYY	-	Free Agent	0.0	0	0	0	0	0	0	0	0	0	0	N/A	N/A	1625
Wayne, Justin RP MIA	-	Free Agent	0.0	0	0	0	0	0	0	0	0	0	0	N/A	N/A	1630
Benson, Kris RP ARI	-	Free Agent	0.0	0	0	0	0	0	0	0	0	0	0	N/A	N/A	1633
Gobble, Jimmy RP COL	-	Free Agent	0.0	0	0	0	0	0	0	0	0	0	0	N/A	N/A	1634
Hull, Eric RP SEA	-	Free Agent	0.0	0	0	0	0	0	0	0	0	0	0	N/A	N/A	1635
Patton, David RP CHC	-	Free Agent	0.0	0	0	0	0	0	0	0	0	0	0	N/A	N/A	1639
Salas, Marino RP PIT	-	Free Agent	0.0	0	0	0	0	0	0	0	0	0	0	N/A	N/A	1640
Julianel, Ben RP MIN	-	Free Agent	0.0	0	0	0	0	0	0	0	0	0	0	N/A	N/A	1643
Herges, Matt RP KC	-	Free Agent	0.0	0	0	0	0	0	0	0	0	0	0	N/A	N/A	1645
Blevins, Steven RP MIN	-	Free Agent	0.0	0	0	0	0	0	0	0	0	0	0	N/A	N/A	1646
Mabeus, Chris RP MIL	-	Free Agent	0.0	0	0	0	0	0	0	0	0	0	0	N/A	N/A	1649
Glover, Gary RP MIA	-	Free Agent	0.0	0	0	0	0	0	0	0	0	0	0	N/A	N/A	1654
Malone, Christopher RP COL	-	Free Agent	0.0	0	0	0	0	0	0	0	0	0	0	N/A	N/A	1659
Howard, Ben RP BOS	-	Free Agent	0.0	0	0	0	0	0	0	0	0	0	0	N/A	N/A	1663
Dials, Zachary RP TOR	-	Free Agent	0.0	0	0	0	0	0	0	0	0	0	0	N/A	N/A	1665
Fahrner, Evan RP OAK	-	Free Agent	0.0	0	0	0	0	0	0	0	0	0	0	N/A	N/A	1671
Gonzalez, Aguido RP CIN	-	Free Agent	0.0	0	0	0	0	0	0	0	0	0	0	N/A	N/A	1674
Aldridge, Richard RP LAA	-	Free Agent	0.0	0	0	0	0	0	0	0	0	0	0	N/A	N/A	1675
Booker, Chris RP WAS	-	Free Agent	0.0	0	0	0	0	0	0	0	0	0	0	N/A	N/A	1676
Gardner, Lee RP MIA	-	Free Agent	0.0	0	0	0	0	0	0	0	0	0	0	N/A	N/A	1678
Broadway, Lance RP TOR	-	Free Agent	0.0	0	0	0	0	0	0	0	0	0	0	N/A	N/A	1680
Register, Steven RP TOR	-	Free Agent	0.0	0	0	0	0	0	0	0	0	0	0	N/A	N/A	1682
Roberts, Kevin RP PIT	-	Free Agent	0.0	0	0	0	0	0	0	0	0	0	0	N/A	N/A	1686
Zarate, Mauro RP SD	-	Free Agent	0.0	0	0	0	0	0	0	0	0	0	0	N/A	N/A	1692
Traber, Billy RP BOS	-	Free Agent	0.0	0	0	0	0	0	0	0	0	0	0	N/A	N/A	1697
Colyer, Steve RP ATL	-	Free Agent	0.0	0	0	0	0	0	0	0	0	0	0	N/A	N/A	1704
Nunez, Vladimir RP ATL	-	Free Agent	0.0	0	0	0	0	0	0	0	0	0	0	N/A	N/A	1707
Phillips, P.J. RP LAA	-	Free Agent	0.0	0	0	0	0	0	0	0	0	0	0	N/A	N/A	1709
Bland, Nate RP LAA	-	Free Agent	0.0	0	0	0	0	0	0	0	0	0	0	N/A	N/A	1718
Wear, Gregory RP SEA	-	Free Agent	0.0	0	0	0	0	0	0	0	0	0	0	N/A	N/A	1719
Abreu, Winston RP TOR	-	Free Agent	0.0	0	0	0	0	0	0	0	0	0	0	N/A	N/A	1721
Kennard, Jeff RP CHC	-	Free Agent	0.0	0	0	0	0	0	0	0	0	0	0	N/A	N/A	1722
Riske, David RP BAL	-	Free Agent	0.0	0	0	0	0	0	0	0	0	0	0	N/A	N/A	1725
Moreno, Anthony RP SF	-	Free Agent	0.0	0	0	0	0	0	0	0	0	0	0	N/A	N/A	1729
Wechsler, Justin RP ARI	-	Free Agent	0.0	0	0	0	0	0	0	0	0	0	0	N/A	N/A	1732
Freeman, Justin P CIN	-	Free Agent	0.0	0	0	0	0	0	0	0	0	0	0	N/A	N/A	1734
Spiehs, R.D. RP SEA	-	Free Agent	0.0	0	0	0	0	0	0	0	0	0	0	N/A	N/A	1735
DeMark, Mike RP SD	-	Free Agent	0.0	0	0	0	0	0	0	0	0	0	0	N/A	N/A	1738
Burke, Erick RP SD	-	Free Agent	0.0	0	0	0	0	0	0	0	0	0	0	N/A	N/A	1739
Yabu, Keiichi RP SF	-	Free Agent	0.0	0	0	0	0	0	0	0	0	0	0	N/A	N/A	1742
Baker, Craig RP COL	-	Free Agent	0.0	0	0	0	0	0	0	0	0	0	0	N/A	N/A	1744
Campbell, Matt RP KC	-	Free Agent	0.0	0	0	0	0	0	0	0	0	0	0	N/A	N/A	1747
Yates, Kyle RP TOR	-	Free Agent	0.0	0	0	0	0	0	0	0	0	0	0	N/A	N/A	1750
Herrera, Alex RP ATL	-	Free Agent	0.0	0	0	0	0	0	0	0	0	0	0	N/A	N/A	1753
Kobayashi, Masa RP CLE	-	Free Agent	0.0	0	0	0	0	0	0	0	0	0	0	N/A	N/A	1754
Rodriguez, Eddy RP MIA	-	Free Agent	0.0	0	0	0	0	0	0	0	0	0	0	N/A	N/A	1756
Hankins, Derek P TEX	-	Free Agent	0.0	0	0	0	0	0	0	0	0	0	0	N/A	N/A	1757
Embry, Byron RP SEA	-	Free Agent	0.0	0	0	0	0	0	0	0	0	0	0	N/A	N/A	1758
Bass, Adam RP SD	-	Free Agent	0.0	0	0	0	0	0	0	0	0	0	0	N/A	N/A	1759
Barber, Scott RP ARI	-	Free Agent	0.0	0	0	0	0	0	0	0	0	0	0	N/A	N/A	1761
Corey, Bryan RP SD	-	Free Agent	0.0	0	0	0	0	0	0	0	0	0	0	N/A	N/A	1763
Diaz, Jose R. RP LAD	-	Free Agent	0.0	0	0	0	0	0	0	0	0	0	0	N/A	N/A	1768
Bush, Paul RP ATL	-	Free Agent	0.0	0	0	0	0	0	0	0	0	0	0	N/A	N/A	1770
Alexander, Mark RP LAD	-	Free Agent	0.0	0	0	0	0	0	0	0	0	0	0	N/A	N/A	1776
Ramirez, Santiago RP WAS	-	Free Agent	0.0	0	0	0	0	0	0	0	0	0	0	N/A	N/A	1779
Ennis, John RP PHI	-	Free Agent	0.0	0	0	0	0	0	0	0	0	0	0	N/A	N/A	1782
Stamler, Keith RP TEX	-	Free Agent	0.0	0	0	0	0	0	0	0	0	0	0	N/A	N/A	1783
Bayliss, Jonah RP TB	-	Free Agent	0.0	0	0	0	0	0	0	0	0	0	0	N/A	N/A	1790
Nestor, Scott RP PHI	-	Free Agent	0.0	0	0	0	0	0	0	0	0	0	0	N/A	N/A	1802
Pullin, Aaron RP LAA	-	Free Agent	0.0	0	0	0	0	0	0	0	0	0	0	N/A	N/A	1811
McClung, Seth RP TEX	-	Free Agent	0.0	0	0	0	0	0	0	0	0	0	0	N/A	N/A	1812
Pugliese, Nick RP LAA	-	Free Agent	0.0	0	0	0	0	0	0	0	0	0	0	N/A	N/A	1814
James, Craig RP SEA	-	Free Agent	0.0	0	0	0	0	0	0	0	0	0	0	N/A	N/A	1817
Cabrera, Fernando RP OAK	-	Free Agent	0.0	0	0	0	0	0	0	0	0	0	0	N/A	N/A	1818
Bazzell, Shane RP TEX	-	Free Agent	0.0	0	0	0	0	0	0	0	0	0	0	N/A	N/A	1826
Rodriguez, Rafael RP ARI	-	Free Agent	0.0	0	0	0	0	0	0	0	0	0	0	N/A	N/A	1829
Petersen, Jeffrey RP SF	-	Free Agent	0.0	0	0	0	0	0	0	0	0	0	0	N/A	N/A	1830
Merritt, Roydrick RP NYM	-	Free Agent	0.0	0	0	0	0	0	0	0	0	0	0	N/A	N/A	1835
Roark, Tanner RP WAS	-	Free Agent	0.0	0	0	0	0	0	0	0	0	0	0	N/A	N/A	1837
Carpenter, David P LAA	-	Free Agent	0.0	0	0	0	0	0	0	0	0	0	0	N/A	N/A	1840
Fien, Casey RP MIN	-	Free Agent	0.0	0	0	0	0	0	0	0	0	0	0	N/A	N/A	1841
Sweeney, Brian RP ARI	-	Free Agent	0.0	0	0	0	0	0	0	0	0	0	0	N/A	N/A	1842
Yourkin, Matt RP SF	-	Free Agent	0.0	0	0	0	0	0	0	0	0	0	0	N/A	N/A	1844
Stowell, Bryce RP CLE	-	Free Agent	0.0	0	0	0	0	0	0	0	0	0	0	N/A	N/A	1849
Quezada, Jackson RP SD	-	Free Agent	0.0	0	0	0	0	0	0	0	0	0	0	N/A	N/A	1854
Moran, Brian P SEA	-	Free Agent	0.0	0	0	0	0	0	0	0	0	0	0	N/A	N/A	1855
Johnston, Andrew RP COL	-	Free Agent	0.0	0	0	0	0	0	0	0	0	0	0	N/A	N/A	1857
Ortiz, Russ RP LAD	-	Free Agent	0.0	0	0	0	0	0	0	0	0	0	0	N/A	N/A	1860
Bibens-Dirkx, Austin RP CHC	-	Free Agent	0.0	0	0	0	0	0	0	0	0	0	0	N/A	N/A	1861
Kenney, Michael RP LAA	-	Free Agent	0.0	0	0	0	0	0	0	0	0	0	0	N/A	N/A	1863
Cordero, Chad RP TOR	-	Free Agent	0.0	0	0	0	0	0	0	0	0	0	0	N/A	N/A	1864
Colome, Jesus RP TEX	-	Free Agent	0.0	0	0	0	0	0	0	0	0	0	0	N/A	N/A	1869
Vasquez, Carlos RP MIA	-	Free Agent	0.0	0	0	0	0	0	0	0	0	0	0	N/A	N/A	1870
Vaclavik, Justin RP PIT	-	Free Agent	0.0	0	0	0	0	0	0	0	0	0	0	N/A	N/A	1871
Wolf, Ross RP HOU	-	Free Agent	0.0	0	0	0	0	0	0	0	0	0	0	N/A	N/A	1873
Stoffel, Jason RP SF	-	Free Agent	0.0	0	0	0	0	0	0	0	0	0	0	N/A	N/A	1874
Robertson, Connor RP NYM	-	Free Agent	0.0	0	0	0	0	0	0	0	0	0	0	N/A	N/A	1879
Hamulack, Tim RP KC	-	Free Agent	0.0	0	0	0	0	0	0	0	0	0	0	N/A	N/A	1880
Steele, Mike RP SEA	-	Free Agent	0.0	0	0	0	0	0	0	0	0	0	0	N/A	N/A	1882
Keefer, Ryan RP BAL	-	Free Agent	0.0	0	0	0	0	0	0	0	0	0	0	N/A	N/A	1886
Hellweg, Johnny RP LAA	-	Free Agent	0.0	0	0	0	0	0	0	0	0	0	0	N/A	N/A	1887
Villacis, Eduardo E. RP CHW	-	Free Agent	0.0	0	0	0	0	0	0	0	0	0	0	N/A	N/A	1891
Adkins, James RP LAD	-	Free Agent	0.0	0	0	0	0	0	0	0	0	0	0	N/A	N/A	1895
Walrond, Les RP NYM	-	Free Agent	0.0	0	0	0	0	0	0	0	0	0	0	N/A	N/A	1899
Valdez, Jose A. RP NYY	-	Free Agent	0.0	0	0	0	0	0	0	0	0	0	0	N/A	N/A	1901
Harvey, Kris RP MIA	-	Free Agent	0.0	0	0	0	0	0	0	0	0	0	0	N/A	N/A	1903
Zell, Danny RP DET	-	Free Agent	0.0	0	0	0	0	0	0	0	0	0	0	N/A	N/A	1905
Estrada, Jesus RP CHC	-	Free Agent	0.0	0	0	0	0	0	0	0	0	0	0	N/A	N/A	1917
