Snow, Forrest SP SEA	-	Free Agent	0.0	0	0	0	0	0	0	0	0	0	0	N/A	N/A	1677
Klinker, Matt SP CIN	-	Free Agent	0.0	0	0	0	0	0	0	0	0	0	0	N/A	N/A	1681
Sowers, Jeremy SP CLE	-	Free Agent	0.0	0	0	0	0	0	0	0	0	0	0	N/A	N/A	1685
Bloom, Kyle SP PIT	-	Free Agent	0.0	0	0	0	0	0	0	0	0	0	0	N/A	N/A	1687
Bradley, Archie SP ARI	-	Free Agent	0.0	0	0	0	0	0	0	0	0	0	0	N/A	N/A	1696
Ginley, Kyle SP TOR	-	Free Agent	0.0	0	0	0	0	0	0	0	0	0	0	N/A	N/A	1700
Savage, Will SP LAD	-	Free Agent	0.0	0	0	0	0	0	0	0	0	0	0	N/A	N/A	1702
Harben, Adam SP CHC	-	Free Agent	0.0	0	0	0	0	0	0	0	0	0	0	N/A	N/A	1711
Gutierrez, Danny SP TEX	-	Free Agent	0.0	0	0	0	0	0	0	0	0	0	0	N/A	N/A	1713
Foppert, Jesse SP SF	-	Free Agent	0.0	0	0	0	0	0	0	0	0	0	0	N/A	N/A	1714
Leesman, Charlie SP CHW	-	Free Agent	0.0	0	0	0	0	0	0	0	0	0	0	N/A	N/A	1728
Wells, Kip SP CIN	-	Free Agent	0.0	0	0	0	0	0	0	0	0	0	0	N/A	N/A	1741
Herrera, Yoslan SP MIN	-	Free Agent	0.0	0	0	0	0	0	0	0	0	0	0	N/A	N/A	1745
Leicester, Jon SP BAL	-	Free Agent	0.0	0	0	0	0	0	0	0	0	0	0	N/A	N/A	1748
Perrault, Josh M. SP BAL	-	Free Agent	0.0	0	0	0	0	0	0	0	0	0	0	N/A	N/A	1760
Suppan, Jeff SP KC	-	Free Agent	0.0	0	0	0	0	0	0	0	0	0	0	N/A	N/A	1765
Kinney, Matt SP SF	-	Free Agent	0.0	0	0	0	0	0	0	0	0	0	0	N/A	N/A	1777
Keisler, Randy SP MIN	-	Free Agent	0.0	0	0	0	0	0	0	0	0	0	0	N/A	N/A	1788
Ponson, Sidney SP KC	-	Free Agent	0.0	0	0	0	0	0	0	0	0	0	0	N/A	N/A	1791
Walker, Taijuan SP SEA	-	Free Agent	0.0	0	0	0	0	0	0	0	0	0	0	N/A	N/A	1793
Vega, Marwin SP SEA	-	Free Agent	0.0	0	0	0	0	0	0	0	0	0	0	N/A	N/A	1798
Duckworth, Brandon SP BOS	-	Free Agent	0.0	0	0	0	0	0	0	0	0	0	0	N/A	N/A	1804
Taillon, Jameson SP PIT	-	Disco Bush Horticulturists	0.0	0	0	0	0	0	0	0	0	0	0	N/A	N/A	1813
Fife, Stephen SP LAD	-	Free Agent	0.0	0	0	0	0	0	0	0	0	0	0	N/A	N/A	1834
McGuire, Deck SP TOR	-	Free Agent	0.0	0	0	0	0	0	0	0	0	0	0	N/A	N/A	1846
Cosart, Jarred SP HOU	-	Free Agent	0.0	0	0	0	0	0	0	0	0	0	0	N/A	N/A	1848
Hernandez, Gaby SP KC	-	Free Agent	0.0	0	0	0	0	0	0	0	0	0	0	N/A	N/A	1866
Looper, Braden SP CHC	-	Free Agent	0.0	0	0	0	0	0	0	0	0	0	0	N/A	N/A	1878
Wieland, Joseph SP SD	-	Free Agent	0.0	0	0	0	0	0	0	0	0	0	0	N/A	N/A	1885
Pettyjohn, Adam C. SP NYM	-	Free Agent	0.0	0	0	0	0	0	0	0	0	0	0	N/A	N/A	1894
Jenkins, Tyrell SP STL	-	Free Agent	0.0	0	0	0	0	0	0	0	0	0	0	N/A	N/A	1912
Rainwater, Josh SP DET	-	Free Agent	0.0	0	0	0	0	0	0	0	0	0	0	N/A	N/A	1914
Hudson, Luke SP KC	-	Free Agent	0.0	0	0	0	0	0	0	0	0	0	0	N/A	N/A	1916
Rivera, Oscar SP COL	-	Free Agent	0.0	0	0	0	0	0	0	0	0	0	0	N/A	N/A	1927
Martinez, Fabio SP LAA	-	Free Agent	0.0	0	0	0	0	0	0	0	0	0	0	N/A	N/A	1940
Jones, Justin SP WAS	-	Free Agent	0.0	0	0	0	0	0	0	0	0	0	0	N/A	N/A	1954
Pimentel, Elisaul SP KC	-	Free Agent	0.0	0	0	0	0	0	0	0	0	0	0	N/A	N/A	1972
Gonzalez, Rey SP TOR	-	Free Agent	0.0	0	0	0	0	0	0	0	0	0	0	N/A	N/A	1973
Clark, Craig SP SF	-	Free Agent	0.0	0	0	0	0	0	0	0	0	0	0	N/A	N/A	1976
Pena, Ariel SP LAA	-	Free Agent	0.0	0	0	0	0	0	0	0	0	0	0	N/A	N/A	1978
Matthews, Kevin SP TEX	-	Free Agent	0.0	0	0	0	0	0	0	0	0	0	0	N/A	N/A	2000
Orenduff, Justin SP LAD	-	Free Agent	0.0	0	0	0	0	0	0	0	0	0	0	N/A	N/A	2006
Seaton, Ross SP HOU	-	Free Agent	0.0	0	0	0	0	0	0	0	0	0	0	N/A	N/A	2031
Ottavino, Adam SP STL	-	Free Agent	0.0	0	0	0	0	0	0	0	0	0	0	N/A	N/A	2036
Bannister, Brian SP KC	-	Free Agent	0.0	0	0	0	0	0	0	0	0	0	0	N/A	N/A	2054
Mulder, Mark SP STL	-	Free Agent	0.0	0	0	0	0	0	0	0	0	0	0	N/A	N/A	2057
Stanford, Jason SP WAS	-	Free Agent	0.0	0	0	0	0	0	0	0	0	0	0	N/A	N/A	2062
Anderson, Craig SP BAL	-	Free Agent	0.0	0	0	0	0	0	0	0	0	0	0	N/A	N/A	2097
Silva, Walter SP SD	-	Free Agent	0.0	0	0	0	0	0	0	0	0	0	0	N/A	N/A	2099
Redding, Tim SP LAD	-	Free Agent	0.0	0	0	0	0	0	0	0	0	0	0	N/A	N/A	2107
Foltynewicz, Mike SP HOU	-	Free Agent	0.0	0	0	0	0	0	0	0	0	0	0	N/A	N/A	2121
Reyes, Anthony SP CLE	-	Free Agent	0.0	0	0	0	0	0	0	0	0	0	0	N/A	N/A	2129
Marceaux, Jacob SP MIA	-	Free Agent	0.0	0	0	0	0	0	0	0	0	0	0	N/A	N/A	2138
Brito, Eude SP WAS	-	Free Agent	0.0	0	0	0	0	0	0	0	0	0	0	N/A	N/A	2141
Mendez, Adalberto SP MIA	-	Free Agent	0.0	0	0	0	0	0	0	0	0	0	0	N/A	N/A	2145
Horne, Alan SP NYY	-	Free Agent	0.0	0	0	0	0	0	0	0	0	0	0	N/A	N/A	2150
Carroll, Scott SP CIN	-	Free Agent	0.0	0	0	0	0	0	0	0	0	0	0	N/A	N/A	2170
Purke, Matt SP WAS	-	Free Agent	0.0	0	0	0	0	0	0	0	0	0	0	N/A	N/A	2176
Kiker, Kasey SP TEX 	-	Free Agent	0.0	0	0	0	0	0	0	0	0	0	0	N/A	N/A	2184
Kadokura, Ken SP CHC	-	Free Agent	0.0	0	0	0	0	0	0	0	0	0	0	N/A	N/A	2187
Jackson, Zach SP TEX	-	Free Agent	0.0	0	0	0	0	0	0	0	0	0	0	N/A	N/A	2194
Lumsden, Tyler SP HOU	-	Free Agent	0.0	0	0	0	0	0	0	0	0	0	0	N/A	N/A	2198
Koronka, John SP LAD	-	Free Agent	0.0	0	0	0	0	0	0	0	0	0	0	N/A	N/A	2204
Cabrera, Daniel SP LAA	-	Free Agent	0.0	0	0	0	0	0	0	0	0	0	0	N/A	N/A	2213
Carrillo, Cesar SP HOU	-	Free Agent	0.0	0	0	0	0	0	0	0	0	0	0	N/A	N/A	2215
Miller, Aaron SP LAD	-	Free Agent	0.0	0	0	0	0	0	0	0	0	0	0	N/A	N/A	2225
Townsend, Wade SP TB	-	Free Agent	0.0	0	0	0	0	0	0	0	0	0	0	N/A	N/A	2229
Hirsh, Jason SP NYY	-	Free Agent	0.0	0	0	0	0	0	0	0	0	0	0	N/A	N/A	2236
Holt, Bradley SP NYM	-	Free Agent	0.0	0	0	0	0	0	0	0	0	0	0	N/A	N/A	2238
Knight, Brandon SP NYM	-	Free Agent	0.0	0	0	0	0	0	0	0	0	0	0	N/A	N/A	2242
Armas, Tony SP NYM	-	Free Agent	0.0	0	0	0	0	0	0	0	0	0	0	N/A	N/A	2249
Kawakami, Kenshin SP ATL	-	Free Agent	0.0	0	0	0	0	0	0	0	0	0	0	N/A	N/A	2257
Tago, Peter SP COL	-	Free Agent	0.0	0	0	0	0	0	0	0	0	0	0	N/A	N/A	2270
Morris, Cory SP BAL	-	Free Agent	0.0	0	0	0	0	0	0	0	0	0	0	N/A	N/A	2280
Trinidad, Polin SP HOU	-	Free Agent	0.0	0	0	0	0	0	0	0	0	0	0	N/A	N/A	2289
Periard, Alex SP MIL	-	Free Agent	0.0	0	0	0	0	0	0	0	0	0	0	N/A	N/A	2298
Holmberg, David SP ARI	-	Free Agent	0.0	0	0	0	0	0	0	0	0	0	0	N/A	N/A	2308
Finch, Brian SP BAL	-	Free Agent	0.0	0	0	0	0	0	0	0	0	0	0	N/A	N/A	2311
Leek, Randy SP STL	-	Free Agent	0.0	0	0	0	0	0	0	0	0	0	0	N/A	N/A	2313
Burns, Mike SP MIL	-	Free Agent	0.0	0	0	0	0	0	0	0	0	0	0	N/A	N/A	2325
Luis, Santo SP BOS	-	Free Agent	0.0	0	0	0	0	0	0	0	0	0	0	N/A	N/A	2327
Arnett, Eric SP MIL	-	Free Agent	0.0	0	0	0	0	0	0	0	0	0	0	N/A	N/A	2334
Prior, Mark SP NYY	-	Free Agent	0.0	0	0	0	0	0	0	0	0	0	0	N/A	N/A	2340
Seibel, Phil SP BOS	-	Free Agent	0.0	0	0	0	0	0	0	0	0	0	0	N/A	N/A	2354
Soto, Giovanni SP CLE	-	Free Agent	0.0	0	0	0	0	0	0	0	0	0	0	N/A	N/A	2355
Edell, Ryan SP PHI	-	Free Agent	0.0	0	0	0	0	0	0	0	0	0	0	N/A	N/A	2358
Rasmussen, Rob SP MIA	-	Free Agent	0.0	0	0	0	0	0	0	0	0	0	0	N/A	N/A	2360
Tyler, Scott SP MIA	-	Free Agent	0.0	0	0	0	0	0	0	0	0	0	0	N/A	N/A	2374
Rasner, Jacob SP CHW	-	Free Agent	0.0	0	0	0	0	0	0	0	0	0	0	N/A	N/A	2379
Cota, Luis SP KC	-	Free Agent	0.0	0	0	0	0	0	0	0	0	0	0	N/A	N/A	2410
Lotzkar, Kyle SP CIN	-	Free Agent	0.0	0	0	0	0	0	0	0	0	0	0	N/A	N/A	2413
Knapp, Jason SP CLE	-	Free Agent	0.0	0	0	0	0	0	0	0	0	0	0	N/A	N/A	2425
Dorman, Rich SP SEA	-	Free Agent	0.0	0	0	0	0	0	0	0	0	0	0	N/A	N/A	2426
DeVries, Cole SP MIN	-	Free Agent	0.0	0	0	0	0	0	0	0	0	0	0	N/A	N/A	2431
Cuevas, Jairo SP KC	-	Free Agent	0.0	0	0	0	0	0	0	0	0	0	0	N/A	N/A	2449
Banks, Josh SP SF	-	Free Agent	0.0	0	0	0	0	0	0	0	0	0	0	N/A	N/A	2456
Melville, Timothy SP KC	-	Free Agent	0.0	0	0	0	0	0	0	0	0	0	0	N/A	N/A	2463
Sampson, Keyvius SP SD	-	Free Agent	0.0	0	0	0	0	0	0	0	0	0	0	N/A	N/A	2464
Eaton, Adam SP COL	-	Free Agent	0.0	0	0	0	0	0	0	0	0	0	0	N/A	N/A	2476
Martinez, Anastacio SP DET	-	Free Agent	0.0	0	0	0	0	0	0	0	0	0	0	N/A	N/A	2482
Rodriguez, Ricardo SP PHI	-	Free Agent	0.0	0	0	0	0	0	0	0	0	0	0	N/A	N/A	2502
Lamb, John SP KC	-	User Abuser	0.0	0	0	0	0	0	0	0	0	0	0	N/A	N/A	2508
Chico, Matt SP LAD	-	Free Agent	0.0	0	0	0	0	0	0	0	0	0	0	N/A	N/A	2534
Parker, Zach SP COL	-	Free Agent	0.0	0	0	0	0	0	0	0	0	0	0	N/A	N/A	2548
Chen, Hung-Wen SP CHC	-	Free Agent	0.0	0	0	0	0	0	0	0	0	0	0	N/A	N/A	2553
Owens, Rudy SP PIT	-	Free Agent	0.0	0	0	0	0	0	0	0	0	0	0	N/A	N/A	2555
Villarreal, Pedro SP CIN	-	Free Agent	0.0	0	0	0	0	0	0	0	0	0	0	N/A	N/A	2557
Robertson, Tyler SP MIN	-	Free Agent	0.0	0	0	0	0	0	0	0	0	0	0	N/A	N/A	2564
Reina, Jesus SP SF	-	Free Agent	0.0	0	0	0	0	0	0	0	0	0	0	N/A	N/A	2583
Colome, Alexander SP TB	-	Free Agent	0.0	0	0	0	0	0	0	0	0	0	0	N/A	N/A	2587
Hammes, Zach SP LAD	-	Free Agent	0.0	0	0	0	0	0	0	0	0	0	0	N/A	N/A	2597
Simonitsch, Errol SP MIN	-	Free Agent	0.0	0	0	0	0	0	0	0	0	0	0	N/A	N/A	2602
Cannon, Jon SP ARI	-	Free Agent	0.0	0	0	0	0	0	0	0	0	0	0	N/A	N/A	2613
Trahern, Dallas SP MIA	-	Free Agent	0.0	0	0	0	0	0	0	0	0	0	0	N/A	N/A	2628
Syndergaard, Noah SP TOR	-	Free Agent	0.0	0	0	0	0	0	0	0	0	0	0	N/A	N/A	2631
Skaggs, Tyler SP ARI	-	Free Agent	0.0	0	0	0	0	0	0	0	0	0	0	N/A	N/A	2633
Deago, Roger SP SD	-	Free Agent	0.0	0	0	0	0	0	0	0	0	0	0	N/A	N/A	2636
Britton, Drake SP BOS	-	Free Agent	0.0	0	0	0	0	0	0	0	0	0	0	N/A	N/A	2640
Wright, Chase SP MIL	-	Free Agent	0.0	0	0	0	0	0	0	0	0	0	0	N/A	N/A	2647
Ginter, Matt SP MIL	-	Free Agent	0.0	0	0	0	0	0	0	0	0	0	0	N/A	N/A	2690
Salazar, Danny SP CLE	-	Free Agent	0.0	0	0	0	0	0	0	0	0	0	0	N/A	N/A	2705
Narron, Sam SP MIL	-	Free Agent	0.0	0	0	0	0	0	0	0	0	0	0	N/A	N/A	2717
Aumont, Phillippe SP PHI	-	Free Agent	0.0	0	0	0	0	0	0	0	0	0	0	N/A	N/A	2718
Meyers, Brad SP NYY 	-	Free Agent	0.0	0	0	0	0	0	0	0	0	0	0	N/A	N/A	2720
Hultzen, Danny SP SEA	-	Free Agent	0.0	0	0	0	0	0	0	0	0	0	0	N/A	N/A	2726
Pelzer, Wynn SP BAL	-	Free Agent	0.0	0	0	0	0	0	0	0	0	0	0	N/A	N/A	2735
Jackson, Luke SP TEX	-	Free Agent	0.0	0	0	0	0	0	0	0	0	0	0	N/A	N/A	2745
Perez, Martin SP TEX	-	User Abuser	0.0	0	0	0	0	0	0	0	0	0	0	N/A	N/A	2766
Biddle, Jesse SP PHI	-	Free Agent	0.0	0	0	0	0	0	0	0	0	0	0	N/A	N/A	2770
Lehr, Justin SP CIN	-	Free Agent	0.0	0	0	0	0	0	0	0	0	0	0	N/A	N/A	2775
Loux, Barret SP TEX	-	Free Agent	0.0	0	0	0	0	0	0	0	0	0	0	N/A	N/A	2792
Haigwood, Dan SP PIT	-	Free Agent	0.0	0	0	0	0	0	0	0	0	0	0	N/A	N/A	2815
Satterwhite, Cody SP DET	-	Free Agent	0.0	0	0	0	0	0	0	0	0	0	0	N/A	N/A	2827
Loux, Shane SP SF	-	Free Agent	0.0	0	0	0	0	0	0	0	0	0	0	N/A	N/A	2831
Smith, Travis SP LAD	-	Free Agent	0.0	0	0	0	0	0	0	0	0	0	0	N/A	N/A	2834
Thompson, Mike SP PIT	-	Free Agent	0.0	0	0	0	0	0	0	0	0	0	0	N/A	N/A	2849
Gardner, Richie SP MIL	-	Free Agent	0.0	0	0	0	0	0	0	0	0	0	0	N/A	N/A	2852
Allie, Stetson SP PIT	-	Free Agent	0.0	0	0	0	0	0	0	0	0	0	0	N/A	N/A	2858
Lorin, Brett SP ARI	-	Free Agent	0.0	0	0	0	0	0	0	0	0	0	0	N/A	N/A	2862
Hernandez, Orlando SP WAS	-	Free Agent	0.0	0	0	0	0	0	0	0	0	0	0	N/A	N/A	2864
Bierbrodt, Nick SP BAL	-	Free Agent	0.0	0	0	0	0	0	0	0	0	0	0	N/A	N/A	2867
Robertson, Nate SP SEA	-	Free Agent	0.0	0	0	0	0	0	0	0	0	0	0	N/A	N/A	2869
Dwyer, Chris SP KC	-	Free Agent	0.0	0	0	0	0	0	0	0	0	0	0	N/A	N/A	2885
Tata, Jordan SP DET	-	Free Agent	0.0	0	0	0	0	0	0	0	0	0	0	N/A	N/A	2894
Miller, Shelby SP STL 	-	Shits & Giggles	0.0	0	0	0	0	0	0	0	0	0	0	N/A	N/A	2917
Blair, Seth SP STL	-	Free Agent	0.0	0	0	0	0	0	0	0	0	0	0	N/A	N/A	2931
McNutt, Trey SP CHC	-	Free Agent	0.0	0	0	0	0	0	0	0	0	0	0	N/A	N/A	2952
Allison, Jeffrey SP MIA	-	Free Agent	0.0	0	0	0	0	0	0	0	0	0	0	N/A	N/A	2956
Jukich, Ben SP CIN	-	Free Agent	0.0	0	0	0	0	0	0	0	0	0	0	N/A	N/A	2972
Taubenheim, Ty SP TEX	-	Free Agent	0.0	0	0	0	0	0	0	0	0	0	0	N/A	N/A	2978
Garcia, Christian SP NYY	-	Free Agent	0.0	0	0	0	0	0	0	0	0	0	0	N/A	N/A	2979
Crosby, Casey SP DET	-	Free Agent	0.0	0	0	0	0	0	0	0	0	0	0	N/A	N/A	2991
Benjamin, Ramon SP MIA	-	Free Agent	0.0	0	0	0	0	0	0	0	0	0	0	N/A	N/A	2995
Mateo, Juan SP LAA	-	Free Agent	0.0	0	0	0	0	0	0	0	0	0	0	N/A	N/A	3011
Clemens, Paul SP HOU	-	Free Agent	0.0	0	0	0	0	0	0	0	0	0	0	N/A	N/A	3017
Arguello, Douglas SP HOU	-	Free Agent	0.0	0	0	0	0	0	0	0	0	0	0	N/A	N/A	3023
Vasquez, Virgil SP TB	-	Free Agent	0.0	0	0	0	0	0	0	0	0	0	0	N/A	N/A	3024
Claussen, Brandon SP WAS	-	Free Agent	0.0	0	0	0	0	0	0	0	0	0	0	N/A	N/A	3028
Weiser, Keith SP COL	-	Free Agent	0.0	0	0	0	0	0	0	0	0	0	0	N/A	N/A	3037
Dittler, Jake SP CLE	-	Free Agent	0.0	0	0	0	0	0	0	0	0	0	0	N/A	N/A	3045
Ungs, Nick SP MIA	-	Free Agent	0.0	0	0	0	0	0	0	0	0	0	0	N/A	N/A	3048
Kelly, Casey SP SD	-	Shits & Giggles	0.0	0	0	0	0	0	0	0	0	0	0	N/A	N/A	3057
Bundy, Dylan SP BAL	-	Free Agent	0.0	0	0	0	0	0	0	0	0	0	0	N/A	N/A	3070
Mason, Chris SP TB	-	Free Agent	0.0	0	0	0	0	0	0	0	0	0	0	N/A	N/A	3072
Sanchez, Aaron SP TOR	-	Free Agent	0.0	0	0	0	0	0	0	0	0	0	0	N/A	N/A	3081
Phelps, David SP NYY	-	Free Agent	0.0	0	0	0	0	0	0	0	0	0	0	N/A	N/A	3086
Liotta, Ray SP KC	-	Free Agent	0.0	0	0	0	0	0	0	0	0	0	0	N/A	N/A	3095
Perez, Beltran SP WAS	-	Free Agent	0.0	0	0	0	0	0	0	0	0	0	0	N/A	N/A	3097
Mendez, Roman SP TEX	-	Free Agent	0.0	0	0	0	0	0	0	0	0	0	0	N/A	N/A	3098
Doyle, Terry SP MIN 	-	Free Agent	0.0	0	0	0	0	0	0	0	0	0	0	N/A	N/A	3099
Waters, Chris SP MIL	-	Free Agent	0.0	0	0	0	0	0	0	0	0	0	0	N/A	N/A	3120
Thornburg, Tyler SP MIL	-	Free Agent	0.0	0	0	0	0	0	0	0	0	0	0	N/A	N/A	3130
Murray, A.J. SP MIL	-	Free Agent	0.0	0	0	0	0	0	0	0	0	0	0	N/A	N/A	3141
Corbin, Patrick SP ARI	-	Free Agent	0.0	0	0	0	0	0	0	0	0	0	0	N/A	N/A	3148
Lofgren, Chuck SP MIL	-	Free Agent	0.0	0	0	0	0	0	0	0	0	0	0	N/A	N/A	3161
Sosa, Oswaldo SP MIN	-	Free Agent	0.0	0	0	0	0	0	0	0	0	0	0	N/A	N/A	3164
Ramirez, Ismael SP WAS	-	Free Agent	0.0	0	0	0	0	0	0	0	0	0	0	N/A	N/A	3173
Olenberger, Kasey SP MIA	-	Free Agent	0.0	0	0	0	0	0	0	0	0	0	0	N/A	N/A	3178
Alvarez, Mario SP LAD	-	Free Agent	0.0	0	0	0	0	0	0	0	0	0	0	N/A	N/A	3192
Wheeler, Zack SP NYM	-	Free Agent	0.0	0	0	0	0	0	0	0	0	0	0	N/A	N/A	3198
Lansford, Jared SP OAK	-	Free Agent	0.0	0	0	0	0	0	0	0	0	0	0	N/A	N/A	3217
Hyatt, Austin SP PHI	-	Free Agent	0.0	0	0	0	0	0	0	0	0	0	0	N/A	N/A	3224
Lawrence, Brian SP MIA	-	Free Agent	0.0	0	0	0	0	0	0	0	0	0	0	N/A	N/A	3226
Green, Nick A. SP MIL	-	Free Agent	0.0	0	0	0	0	0	0	0	0	0	0	N/A	N/A	3233
Baek, Cha Seung SP SD	-	Free Agent	0.0	0	0	0	0	0	0	0	0	0	0	N/A	N/A	3254
Wojciechowski, Asher SP TOR	-	Free Agent	0.0	0	0	0	0	0	0	0	0	0	0	N/A	N/A	3258
Matzek, Tyler SP COL	-	SA`s	0.0	0	0	0	0	0	0	0	0	0	0	N/A	N/A	3269
Lee, Zach SP LAD	-	Free Agent	0.0	0	0	0	0	0	0	0	0	0	0	N/A	N/A	3275
Mitchell, D.J. SP NYY	-	Free Agent	0.0	0	0	0	0	0	0	0	0	0	0	N/A	N/A	3277
Broadway, Michael SP ATL	-	Free Agent	0.0	0	0	0	0	0	0	0	0	0	0	N/A	N/A	3285
Igawa, Kei SP NYY	-	Free Agent	0.0	0	0	0	0	0	0	0	0	0	0	N/A	N/A	3289
Bacsik, Mike SP WAS	-	Free Agent	0.0	0	0	0	0	0	0	0	0	0	0	N/A	N/A	3297
Harvey, Matt SP NYM	-	Free Agent	0.0	0	0	0	0	0	0	0	0	0	0	N/A	N/A	3332
Halsey, Brad SP LAD	-	Free Agent	0.0	0	0	0	0	0	0	0	0	0	0	N/A	N/A	3337
Rheinecker, John SP TEX	-	Free Agent	0.0	0	0	0	0	0	0	0	0	0	0	N/A	N/A	3364
Kasparek, Kenn SP SEA	-	Free Agent	0.0	0	0	0	0	0	0	0	0	0	0	N/A	N/A	3368
Kiely, Timothy SP LAA	-	Free Agent	0.0	0	0	0	0	0	0	0	0	0	0	N/A	N/A	3392
Martin, J.D. SP WAS 	-	Free Agent	0.0	0	0	0	0	0	0	0	0	0	0	N/A	N/A	3397
Perez, Sergio SP HOU	-	Free Agent	0.0	0	0	0	0	0	0	0	0	0	0	N/A	N/A	3398
Etherton, Seth SP LAD	-	Free Agent	0.0	0	0	0	0	0	0	0	0	0	0	N/A	N/A	3400
Peguero, Tony SP TB	-	Free Agent	0.0	0	0	0	0	0	0	0	0	0	0	N/A	N/A	3402
Bouknight, Kip SP PIT	-	Free Agent	0.0	0	0	0	0	0	0	0	0	0	0	N/A	N/A	3429
Cabrera, Edwar SP COL	-	Free Agent	0.0	0	0	0	0	0	0	0	0	0	0	N/A	N/A	3431
Cole, Gerrit SP PIT	-	Free Agent	0.0	0	0	0	0	0	0	0	0	0	0	N/A	N/A	3467
Antonini, Michael SP LAD	-	Free Agent	0.0	0	0	0	0	0	0	0	0	0	0	N/A	N/A	3468
Cova, Rafael SP SF	-	Free Agent	0.0	0	0	0	0	0	0	0	0	0	0	N/A	N/A	3482
Blackley, Travis SP OAK	-	Free Agent	0.0	0	0	0	0	0	0	0	0	0	0	N/A	N/A	3483
Heckathorn, Kyle SP MIL	-	Free Agent	0.0	0	0	0	0	0	0	0	0	0	0	N/A	N/A	3490
Maine, John SP COL	-	Free Agent	0.0	0	0	0	0	0	0	0	0	0	0	N/A	N/A	3495
Webster, Allen SP LAD	-	Free Agent	0.0	0	0	0	0	0	0	0	0	0	0	N/A	N/A	3498
Chick, Travis SP TEX	-	Free Agent	0.0	0	0	0	0	0	0	0	0	0	0	N/A	N/A	3500
Komine, Shane SP OAK	-	Free Agent	0.0	0	0	0	0	0	0	0	0	0	0	N/A	N/A	3501
Thompson, Sean SP COL	-	Free Agent	0.0	0	0	0	0	0	0	0	0	0	0	N/A	N/A	3541
Bostick, Adam SP KC	-	Free Agent	0.0	0	0	0	0	0	0	0	0	0	0	N/A	N/A	3544
Mazone, Brian SP LAD	-	Free Agent	0.0	0	0	0	0	0	0	0	0	0	0	N/A	N/A	3560
Schmidt, Jason SP LAD	-	Free Agent	0.0	0	0	0	0	0	0	0	0	0	0	N/A	N/A	3566
Escobar, Kelvim SP NYM 	-	Free Agent	0.0	0	0	0	0	0	0	0	0	0	0	N/A	N/A	3586
Lowry, Noah SP SF	-	Free Agent	0.0	0	0	0	0	0	0	0	0	0	0	N/A	N/A	3589
Hernandez, Carlos E. SP TB	-	Free Agent	0.0	0	0	0	0	0	0	0	0	0	0	N/A	N/A	3599
Alvarez, Abe SP BOS	-	Free Agent	0.0	0	0	0	0	0	0	0	0	0	0	N/A	N/A	3602
Brownlie, Bobby SP WAS	-	Free Agent	0.0	0	0	0	0	0	0	0	0	0	0	N/A	N/A	3607
Wright, Matt SP OAK	-	Free Agent	0.0	0	0	0	0	0	0	0	0	0	0	N/A	N/A	3611
Martinez, Carlos SP STL	-	Free Agent	0.0	0	0	0	0	0	0	0	0	0	0	N/A	N/A	3626
James, Chad SP MIA	-	Free Agent	0.0	0	0	0	0	0	0	0	0	0	0	N/A	N/A	3630
Wada, Tsuyoshi SP BAL 	-	Free Agent	0.0	0	0	0	0	0	0	0	0	0	0	N/A	N/A	3638
Martis, Shairon SP PIT	-	Free Agent	0.0	0	0	0	0	0	0	0	0	0	0	N/A	N/A	3641
Torra, Matt SP ARI	-	Free Agent	0.0	0	0	0	0	0	0	0	0	0	0	N/A	N/A	3643
Haeger, Charlie SP BOS	-	Free Agent	0.0	0	0	0	0	0	0	0	0	0	0	N/A	N/A	3645
Miller, Adam SP CLE 	-	Shits & Giggles	0.0	0	0	0	0	0	0	0	0	0	0	N/A	N/A	3655
Woerman, Joe SP SEA	-	Free Agent	0.0	0	0	0	0	0	0	0	0	0	0	N/A	N/A	3656
Moyer, Jamie SP PHI 	-	Free Agent	0.0	0	0	0	0	0	0	0	0	0	0	N/A	N/A	3665
Withrow, Chris SP LAD	-	Free Agent	0.0	0	0	0	0	0	0	0	0	0	0	N/A	N/A	3673
Cole, A.J. SP OAK 	-	Free Agent	0.0	0	0	0	0	0	0	0	0	0	0	N/A	N/A	3677
Buckner, Billy SP COL	-	Free Agent	0.0	0	0	0	0	0	0	0	0	0	0	N/A	N/A	3681
Hendrickson, Ben SP MIN	-	Free Agent	0.0	0	0	0	0	0	0	0	0	0	0	N/A	N/A	3685
Flande, Yohan SP ATL	-	Free Agent	0.0	0	0	0	0	0	0	0	0	0	0	N/A	N/A	3695
Thomas, Kevin SP STL	-	Free Agent	0.0	0	0	0	0	0	0	0	0	0	0	N/A	N/A	3699
Redmond, Todd SP ATL	-	Free Agent	0.0	0	0	0	0	0	0	0	0	0	0	N/A	N/A	3706
Rohrbaugh, Robert SP SEA	-	Free Agent	0.0	0	0	0	0	0	0	0	0	0	0	N/A	N/A	3714
Morla, Ronny SP CHC	-	Free Agent	0.0	0	0	0	0	0	0	0	0	0	0	N/A	N/A	3736
Sanchez, Jesus SP PHI	-	Free Agent	0.0	0	0	0	0	0	0	0	0	0	0	N/A	N/A	3749
Mercedes, Simon SP SF	-	Free Agent	0.0	0	0	0	0	0	0	0	0	0	0	N/A	N/A	3753
Maroth, Mike SP MIN	-	Free Agent	0.0	0	0	0	0	0	0	0	0	0	0	N/A	N/A	3758
Bono, Robert SP MIA	-	Free Agent	0.0	0	0	0	0	0	0	0	0	0	0	N/A	N/A	3762
Rollins, Heath SP KC	-	Free Agent	0.0	0	0	0	0	0	0	0	0	0	0	N/A	N/A	3786
Carson, Robert SP NYM	-	Free Agent	0.0	0	0	0	0	0	0	0	0	0	0	N/A	N/A	3787
Hobgood, Matthew SP BAL	-	Free Agent	0.0	0	0	0	0	0	0	0	0	0	0	N/A	N/A	3792
Warren, Adam SP NYY	-	Free Agent	0.0	0	0	0	0	0	0	0	0	0	0	N/A	N/A	3796
Greenwood, Nick SP STL	-	Free Agent	0.0	0	0	0	0	0	0	0	0	0	0	N/A	N/A	3806
Christensen, Danny SP KC	-	Free Agent	0.0	0	0	0	0	0	0	0	0	0	0	N/A	N/A	3809
George, Chris SP BAL	-	Free Agent	0.0	0	0	0	0	0	0	0	0	0	0	N/A	N/A	3820
Simpson, Hayden SP CHC	-	Free Agent	0.0	0	0	0	0	0	0	0	0	0	0	N/A	N/A	3832
Livingston, Bobby SP TB	-	Free Agent	0.0	0	0	0	0	0	0	0	0	0	0	N/A	N/A	3843
Pelland, Tyler SP CIN	-	Free Agent	0.0	0	0	0	0	0	0	0	0	0	0	N/A	N/A	3852
Cummings, Jeremy SP TB	-	Free Agent	0.0	0	0	0	0	0	0	0	0	0	0	N/A	N/A	3862
Silva, Carlos SP BOS 	-	Free Agent	0.0	0	0	0	0	0	0	0	0	0	0	N/A	N/A	3876
Everts, Clint SP NYM	-	Free Agent	0.0	0	0	0	0	0	0	0	0	0	0	N/A	N/A	3879
Geer, Josh SP SD	-	Free Agent	0.0	0	0	0	0	0	0	0	0	0	0	N/A	N/A	3882
Bushue, Tanner SP HOU	-	Free Agent	0.0	0	0	0	0	0	0	0	0	0	0	N/A	N/A	3892
Solis, Sammy SP WAS 	-	Free Agent	0.0	0	0	0	0	0	0	0	0	0	0	N/A	N/A	3893
Taylor, Graham SP MIA	-	Free Agent	0.0	0	0	0	0	0	0	0	0	0	0	N/A	N/A	3905
Hornbeck, Ben SP OAK	-	Free Agent	0.0	0	0	0	0	0	0	0	0	0	0	N/A	N/A	3908
Heredia, Luis SP PIT	-	Free Agent	0.0	0	0	0	0	0	0	0	0	0	0	N/A	N/A	3911
Milton, Eric SP LAD	-	Free Agent	0.0	0	0	0	0	0	0	0	0	0	0	N/A	N/A	3915
Koehler, Tom SP MIA	-	Free Agent	0.0	0	0	0	0	0	0	0	0	0	0	N/A	N/A	3925
Grube, Jarrett SP SEA	-	Free Agent	0.0	0	0	0	0	0	0	0	0	0	0	N/A	N/A	3930
James, Brad SP HOU	-	Free Agent	0.0	0	0	0	0	0	0	0	0	0	0	N/A	N/A	3931
Munoz, Luis SP SEA	-	Free Agent	0.0	0	0	0	0	0	0	0	0	0	0	N/A	N/A	3935
Montgomery, Mike SP KC	-	Whiteness	0.0	0	0	0	0	0	0	0	0	0	0	N/A	N/A	3940
Gabbard, Kason SP BOS	-	Free Agent	0.0	0	0	0	0	0	0	0	0	0	0	N/A	N/A	3942
Sheets, Ben SP OAK	-	Free Agent	0.0	0	0	0	0	0	0	0	0	0	0	N/A	N/A	3952
Snell, Ian SP STL	-	Free Agent	0.0	0	0	0	0	0	0	0	0	0	0	N/A	N/A	3965
Marti, Yadel SP OAK	-	Free Agent	0.0	0	0	0	0	0	0	0	0	0	0	N/A	N/A	3992
Erlin, Robbie SP SD	-	Free Agent	0.0	0	0	0	0	0	0	0	0	0	0	N/A	N/A	3993
Odorizzi, Jake SP KC	-	Free Agent	0.0	0	0	0	0	0	0	0	0	0	0	N/A	N/A	4019
De Paula, Jose SP SD	-	Free Agent	0.0	0	0	0	0	0	0	0	0	0	0	N/A	N/A	4021
Windsor, Jason SP OAK	-	Free Agent	0.0	0	0	0	0	0	0	0	0	0	0	N/A	N/A	4026
Perez, Odalis SP WAS	-	Free Agent	0.0	0	0	0	0	0	0	0	0	0	0	N/A	N/A	4033
Jackson, Jay SP CHC	-	Free Agent	0.0	0	0	0	0	0	0	0	0	0	0	N/A	N/A	4039
Colvin, Brody SP PHI	-	Free Agent	0.0	0	0	0	0	0	0	0	0	0	0	N/A	N/A	4047
Sandoval, Juan SP MIL	-	Free Agent	0.0	0	0	0	0	0	0	0	0	0	0	N/A	N/A	4048
Snyder, Ben SP TEX	-	Free Agent	0.0	0	0	0	0	0	0	0	0	0	0	N/A	N/A	4066
Van Benschoten, John SP CHW	-	Free Agent	0.0	0	0	0	0	0	0	0	0	0	0	N/A	N/A	4068
Mildren, Paul SP KC	-	Free Agent	0.0	0	0	0	0	0	0	0	0	0	0	N/A	N/A	4069
White, Steven SP NYY	-	Free Agent	0.0	0	0	0	0	0	0	0	0	0	0	N/A	N/A	4073
Deza, Fredy SP BAL	-	Free Agent	0.0	0	0	0	0	0	0	0	0	0	0	N/A	N/A	4080
Smith, Will SP KC	-	Free Agent	0.0	0	0	0	0	0	0	0	0	0	0	N/A	N/A	4086
Mathes, J.R. SP CHC	-	Free Agent	0.0	0	0	0	0	0	0	0	0	0	0	N/A	N/A	4092
Gothreaux, Jared SP HOU	-	Free Agent	0.0	0	0	0	0	0	0	0	0	0	0	N/A	N/A	4100
Rohrbough, Cole SP ATL	-	Free Agent	0.0	0	0	0	0	0	0	0	0	0	0	N/A	N/A	4112
Washburn, Jarrod SP DET	-	Free Agent	0.0	0	0	0	0	0	0	0	0	0	0	N/A	N/A	4137
Connolly, Jon SP DET	-	Free Agent	0.0	0	0	0	0	0	0	0	0	0	0	N/A	N/A	4138
Hernandez, Pedro SP CHW 	-	Free Agent	0.0	0	0	0	0	0	0	0	0	0	0	N/A	N/A	4151
Jang, Pil Joon SP LAA	-	Free Agent	0.0	0	0	0	0	0	0	0	0	0	0	N/A	N/A	4152
Bonderman, Jeremy SP DET	-	Free Agent	0.0	0	0	0	0	0	0	0	0	0	0	N/A	N/A	4156
Niesen, Eric SP NYM	-	Free Agent	0.0	0	0	0	0	0	0	0	0	0	0	N/A	N/A	4172
Estes, Shawn SP WAS	-	Free Agent	0.0	0	0	0	0	0	0	0	0	0	0	N/A	N/A	4179
Barthmaier, Jimmy SP WAS	-	Free Agent	0.0	0	0	0	0	0	0	0	0	0	0	N/A	N/A	4193
Feierabend, Ryan SP PHI	-	Free Agent	0.0	0	0	0	0	0	0	0	0	0	0	N/A	N/A	4195
Hampson, Justin SP OAK	-	Free Agent	0.0	0	0	0	0	0	0	0	0	0	0	N/A	N/A	4205
Lobstein, Kyle SP TB	-	Free Agent	0.0	0	0	0	0	0	0	0	0	0	0	N/A	N/A	4222
Atilano, Luis SP WAS	-	Free Agent	0.0	0	0	0	0	0	0	0	0	0	0	N/A	N/A	4223
Main, Michael SP SF	-	Free Agent	0.0	0	0	0	0	0	0	0	0	0	0	N/A	N/A	4235
Martinez, Pedro SP PHI 	-	Free Agent	0.0	0	0	0	0	0	0	0	0	0	0	N/A	N/A	4250
Sanchez, Humberto SP NYY	-	SA`s	0.0	0	0	0	0	0	0	0	0	0	0	N/A	N/A	4253
Zink, Charlie SP MIN	-	Free Agent	0.0	0	0	0	0	0	0	0	0	0	0	N/A	N/A	4261
Cheng, Chi-Hung SP PIT	-	Free Agent	0.0	0	0	0	0	0	0	0	0	0	0	N/A	N/A	4266
Johnson, Kris SP BOS	-	Free Agent	0.0	0	0	0	0	0	0	0	0	0	0	N/A	N/A	4274
Johnson, Steven SP BAL	-	Free Agent	0.0	0	0	0	0	0	0	0	0	0	0	N/A	N/A	4285
Ranaudo, Anthony SP BOS	-	Free Agent	0.0	0	0	0	0	0	0	0	0	0	0	N/A	N/A	4287
Friedrich, Christian SP COL	-	Free Agent	0.0	0	0	0	0	0	0	0	0	0	0	N/A	N/A	4295
Smith, Greg SP COL	-	Free Agent	0.0	0	0	0	0	0	0	0	0	0	0	N/A	N/A	4297
Roemer, Wes SP ARI	-	Free Agent	0.0	0	0	0	0	0	0	0	0	0	0	N/A	N/A	4312
Sadowski, Ryan SP HOU	-	Free Agent	0.0	0	0	0	0	0	0	0	0	0	0	N/A	N/A	4323
Drake, Oliver SP BAL	-	Free Agent	0.0	0	0	0	0	0	0	0	0	0	0	N/A	N/A	4341
Youman, Shane SP PHI	-	Free Agent	0.0	0	0	0	0	0	0	0	0	0	0	N/A	N/A	4381
Drese, Ryan SP ATL	-	Free Agent	0.0	0	0	0	0	0	0	0	0	0	0	N/A	N/A	4392
Gibson, Kyle SP MIN	-	Free Agent	0.0	0	0	0	0	0	0	0	0	0	0	N/A	N/A	4403
Molina, Nestor SP CHW 	-	Free Agent	0.0	0	0	0	0	0	0	0	0	0	0	N/A	N/A	4414
Capellan, Jose M. SP BOS	-	Free Agent	0.0	0	0	0	0	0	0	0	0	0	0	N/A	N/A	4426
Rowland-Smith, Ryan SP HOU	-	Free Agent	0.0	0	0	0	0	0	0	0	0	0	0	N/A	N/A	4430
Bazardo, Yorman SP MIN	-	Free Agent	0.0	0	0	0	0	0	0	0	0	0	0	N/A	N/A	4434
Miner, Zach SP KC	-	Free Agent	0.0	0	0	0	0	0	0	0	0	0	0	N/A	N/A	4438
Wilson, Justin SP PIT	-	Free Agent	0.0	0	0	0	0	0	0	0	0	0	0	N/A	N/A	4442
Castillo, Jesus SP LAD	-	Free Agent	0.0	0	0	0	0	0	0	0	0	0	0	N/A	N/A	4444
Kelly, Joe SP STL	-	Free Agent	0.0	0	0	0	0	0	0	0	0	0	0	N/A	N/A	4454
Ohka, Tomo SP CLE	-	Free Agent	0.0	0	0	0	0	0	0	0	0	0	0	N/A	N/A	4456
Avery, James SP CIN	-	Free Agent	0.0	0	0	0	0	0	0	0	0	0	0	N/A	N/A	4489
Lerew, Anthony SP KC	-	Free Agent	0.0	0	0	0	0	0	0	0	0	0	0	N/A	N/A	4497
Shortslef, Josh SP PHI	-	Free Agent	0.0	0	0	0	0	0	0	0	0	0	0	N/A	N/A	4507
Lewis, Scott SP CLE	-	Free Agent	0.0	0	0	0	0	0	0	0	0	0	0	N/A	N/A	4511
Rasner, Darrell SP NYY	-	Free Agent	0.0	0	0	0	0	0	0	0	0	0	0	N/A	N/A	4512
DiNardo, Lenny SP BOS	-	Free Agent	0.0	0	0	0	0	0	0	0	0	0	0	N/A	N/A	4517
Oberholtzer, Brett SP ATL	-	Free Agent	0.0	0	0	0	0	0	0	0	0	0	0	N/A	N/A	4530
Pimentel, Julio SP KC	-	Free Agent	0.0	0	0	0	0	0	0	0	0	0	0	N/A	N/A	4533
Bleich, Jeremy SP NYY	-	Free Agent	0.0	0	0	0	0	0	0	0	0	0	0	N/A	N/A	4537
Souza, Justin SP OAK	-	Free Agent	0.0	0	0	0	0	0	0	0	0	0	0	N/A	N/A	4539
Smyly, Drew SP DET	-	Free Agent	0.0	0	0	0	0	0	0	0	0	0	0	N/A	N/A	4571
Adam, Jason SP KC	-	Free Agent	0.0	0	0	0	0	0	0	0	0	0	0	N/A	N/A	4577
Barone, Daniel SP OAK	-	Free Agent	0.0	0	0	0	0	0	0	0	0	0	0	N/A	N/A	4579
Junge, Eric SP LAA	-	Free Agent	0.0	0	0	0	0	0	0	0	0	0	0	N/A	N/A	4585
Iwakuma, Hisashi SP SEA 	-	Free Agent	0.0	0	0	0	0	0	0	0	0	0	0	N/A	N/A	4587
Wimmers, Alex SP MIN	-	Free Agent	0.0	0	0	0	0	0	0	0	0	0	0	N/A	N/A	4588
Linares, Serguey SP PIT	-	Free Agent	0.0	0	0	0	0	0	0	0	0	0	0	N/A	N/A	4593
Tatusko, Ryan SP WAS	-	Free Agent	0.0	0	0	0	0	0	0	0	0	0	0	N/A	N/A	4595
Elarton, Scott SP PHI 	-	Free Agent	0.0	0	0	0	0	0	0	0	0	0	0	N/A	N/A	4597
Wellemeyer, Todd SP CHC	-	Free Agent	0.0	0	0	0	0	0	0	0	0	0	0	N/A	N/A	4616
Osuna, Edgar SP KC	-	Free Agent	0.0	0	0	0	0	0	0	0	0	0	0	N/A	N/A	4640
Rosario, Rodrigo SP MIA	-	Free Agent	0.0	0	0	0	0	0	0	0	0	0	0	N/A	N/A	4656
Pettitte, Andy SP NYY	-	Free Agent	0.0	0	0	0	0	0	0	0	0	0	0	N/A	N/A	4659
Jenkins, Chad SP TOR	-	Free Agent	0.0	0	0	0	0	0	0	0	0	0	0	N/A	N/A	4669
Cassel, Jack SP CLE	-	Free Agent	0.0	0	0	0	0	0	0	0	0	0	0	N/A	N/A	4675
Malone, Corwin SP CHW	-	Free Agent	0.0	0	0	0	0	0	0	0	0	0	0	N/A	N/A	4685
Oramas, Juan SP SD	-	Free Agent	0.0	0	0	0	0	0	0	0	0	0	0	N/A	N/A	4711
Brazelton, Dewon SP STL	-	Free Agent	0.0	0	0	0	0	0	0	0	0	0	0	N/A	N/A	4714
Vincent, Nick SP SD	-	Free Agent	0.0	0	0	0	0	0	0	0	0	0	0	N/A	N/A	4717
Byrd, Paul SP BOS	-	Free Agent	0.0	0	0	0	0	0	0	0	0	0	0	N/A	N/A	4719
Kibler, Jon SP DET	-	Free Agent	0.0	0	0	0	0	0	0	0	0	0	0	N/A	N/A	4722
O'Malley, Ryan J. SP CHC	-	Free Agent	0.0	0	0	0	0	0	0	0	0	0	0	N/A	N/A	4727
Holliman, Mark SP BOS	-	Free Agent	0.0	0	0	0	0	0	0	0	0	0	0	N/A	N/A	4729
Chaffee, Ryan SP LAA	-	Free Agent	0.0	0	0	0	0	0	0	0	0	0	0	N/A	N/A	4730
De Los Santos, Valerio SP NYM	-	Free Agent	0.0	0	0	0	0	0	0	0	0	0	0	N/A	N/A	4746
Halama, John SP MIL	-	Free Agent	0.0	0	0	0	0	0	0	0	0	0	0	N/A	N/A	4751
